ID,Member1,Member2,Conversation_name,Conversation_created,Messages_quantity
Conversation_1296,mark52,gshields,Page for authority particular yourself for between.,2020-12-09 02:00:30,155
Conversation_1297,morrismichael,lwhite,Democratic method trouble truth fast.,2023-05-27 07:17:31,713
Conversation_1298,vkeller,stephanieweaver,Over least author true enjoy pattern fine teacher.,2023-10-30 17:48:41,164
Conversation_1299,iphillips,elizabethtucker,Exist avoid evidence economic tree color former.,2023-07-30 16:18:36,772
Conversation_1300,jennifercooper,garciatrevor,Occur ground television.,2020-05-22 01:39:14,966
Conversation_1301,jasongarza,davidwatkins,Miss material early type ball cut every.,2023-08-07 20:01:45,470
Conversation_1302,hernandezjessica,cheyennerodriguez,Sound light hit item represent.,2021-02-21 18:24:10,527
Conversation_1303,hartcharles,ucabrera,Quickly team hotel you last only.,2021-03-01 09:53:42,732
Conversation_1304,opatton,underwoodkeith,Whose different sometimes important stay.,2022-01-27 16:19:31,631
Conversation_1305,tbrown,dixonjoan,Similar take lose pay.,2022-12-25 09:59:37,473
Conversation_1306,hschmidt,mariestewart,Lose base go area.,2023-04-27 17:07:27,2
Conversation_1307,elizabethsmith,brandon45,Door talk leg voice money practice.,2022-02-03 23:40:25,925
Conversation_1308,donaldvasquez,richardsonanthony,Hospital born heart successful skill fear.,2020-11-24 23:13:28,539
Conversation_1309,leescott,bushtony,Trouble address sport easy local newspaper.,2022-01-19 22:03:46,935
Conversation_1310,michelle32,fieldsbrian,Maintain executive growth position.,2020-02-11 02:49:50,774
Conversation_1311,edwardclarke,andrewrussell,Right natural order no result.,2020-03-23 02:18:31,810
Conversation_1312,jeffreygarcia,jordan40,Happy it claim than itself near address.,2022-03-15 06:53:54,492
Conversation_1313,piercelauren,brucejohnson,Kind health feel house building theory.,2021-03-17 17:36:25,526
Conversation_1314,lesliebrooks,hernandezryan,Certainly commercial really reach.,2021-08-08 01:50:26,723
Conversation_1315,john59,mwilson,Event fact while upon when its.,2021-11-28 04:06:47,395
Conversation_1316,costadylan,marywolfe,Air anything collection.,2020-07-05 22:34:35,590
Conversation_1317,jameswright,lauranelson,Democratic go southern a base amount.,2021-05-17 08:26:39,362
Conversation_1318,wrightrandall,inelson,Buy scientist coach performance.,2022-09-17 21:12:20,747
Conversation_1319,daniel80,ramirezsuzanne,Pm agent common break.,2022-02-08 13:36:08,702
Conversation_1320,dunlaptimothy,kelseyrodriguez,Room might development start field now either dream.,2023-09-10 04:48:07,689
Conversation_1321,jennifer13,banksstephanie,Stage perhaps itself white.,2023-09-20 10:20:08,972
Conversation_1322,andersonmary,lewisjoseph,Seek political maybe place too fight.,2020-04-21 10:28:54,466
Conversation_1323,sarah49,natasha15,Add nation different benefit if beat thank.,2020-07-03 05:38:42,378
Conversation_1324,lisahart,parkerhannah,Blood could really cut.,2021-07-08 02:13:27,832
Conversation_1325,marissa92,sharonclark,Suffer girl build Democrat leg allow.,2020-12-11 20:11:08,546
Conversation_1326,melissa09,lyonsmelissa,If feeling inside discuss black daughter property not.,2022-06-05 12:32:18,349
Conversation_1327,brownsandra,ryan27,Ever ready lay whole agency admit.,2023-11-19 12:05:27,432
Conversation_1328,brian71,simonashley,Minute wonder image land.,2024-01-21 21:07:50,968
Conversation_1329,lloydsteven,saraharrell,Little certain produce word.,2020-12-01 11:29:27,554
Conversation_1330,anita82,jasongeorge,Show report company parent thought about we.,2022-05-15 16:41:19,463
Conversation_1331,gloria95,danieljohnson,Option too go blood personal.,2023-07-07 06:24:41,364
Conversation_1332,bondjason,christopher11,Source worker point still conference.,2023-01-20 13:55:02,623
Conversation_1333,ggilbert,derrick96,Organization certainly investment various be network.,2023-10-22 02:51:06,323
Conversation_1334,currychristopher,rosenewman,Recent always glass here wait.,2022-04-23 08:07:40,770
Conversation_1335,cathytran,charles74,Small ground once sport else.,2023-03-02 17:45:31,929
Conversation_1336,joshua75,jeff11,Sort late dark head risk six local.,2024-03-20 07:08:48,270
Conversation_1337,jasmine31,yoderderek,Explain these technology population.,2022-06-12 20:11:14,760
Conversation_1338,gracecastro,brian17,Plant out beyond bit.,2024-03-31 11:53:48,606
Conversation_1339,stephanie44,bushbruce,Training team use eye hard hope ground.,2024-03-11 14:22:03,463
Conversation_1340,fredericknovak,thomasbarry,Glass officer usually bar born bag audience pattern.,2022-04-17 07:19:12,915
Conversation_1341,lovealexandria,leescott,Team room rich along through politics affect.,2022-08-20 00:03:34,334
Conversation_1342,joseph23,bailey40,Draw minute tax stock.,2022-02-14 13:43:09,711
Conversation_1343,jamiehall,vwilson,No event check area detail study.,2023-09-08 11:15:52,398
Conversation_1344,gclark,melvinpalmer,Begin country despite draw great speak.,2024-03-05 11:54:40,187
Conversation_1345,sandra86,phammary,Hand wall performance wait city carry also.,2024-03-07 11:16:11,58
Conversation_1346,tamararomero,kimberly47,Field realize work drop picture sign amount.,2022-12-15 05:48:35,785
Conversation_1347,okey,evanglass,Measure PM statement smile trouble.,2021-11-04 08:36:27,273
Conversation_1348,vhenry,moorecatherine,Follow can weight center.,2022-09-15 03:29:57,287
Conversation_1349,fsmith,marcusbecker,Seven same know still speech after few.,2021-11-24 09:31:52,243
Conversation_1350,matthew11,vwright,World pattern despite medical.,2023-02-18 13:01:59,258
Conversation_1351,zacharywhite,jmiller,Play matter defense catch property though everyone.,2020-02-07 04:41:42,707
Conversation_1352,orrmark,valvarez,Wonder officer behavior data realize.,2023-06-22 11:26:20,87
Conversation_1353,alice42,brucemorris,Defense share community prove phone cold.,2022-01-29 17:25:36,410
Conversation_1354,tinavaughn,barbarapatel,Billion your current traditional professor dream money.,2021-04-19 04:06:02,37
Conversation_1355,fsmith,martinpeter,The grow gas result trial space understand.,2023-12-24 18:53:05,798
Conversation_1356,jvazquez,peterdawson,Pay activity a.,2021-10-27 04:42:23,458
Conversation_1357,kellycurtis,wayne30,Town oil cup reflect though one will.,2021-11-19 11:07:53,499
Conversation_1358,meyerdarius,daniel29,Answer world pull by.,2022-09-24 15:46:37,78
Conversation_1359,taylorharper,cjones,Reason assume how anything toward.,2021-10-13 18:57:41,431
Conversation_1360,ycruz,dmclaughlin,Public town spend add.,2024-03-31 14:00:07,245
Conversation_1361,vaughnmatthew,jamesburgess,Tv through wear theory.,2022-10-27 05:05:29,978
Conversation_1362,ylove,thomas33,Company huge southern plant.,2024-02-27 14:47:22,490
Conversation_1363,cameroncraig,smithdonald,Toward their than within.,2023-01-11 06:33:31,752
Conversation_1364,james20,brenda50,Include rise radio nice central become her.,2023-08-20 08:04:37,375
Conversation_1365,eugenegeorge,oblankenship,Production party place discussion happy.,2021-09-07 16:45:52,171
Conversation_1366,kellyhendrix,browningmitchell,Example describe energy almost avoid number cell.,2021-05-07 06:37:13,507
Conversation_1367,jeanmcintosh,tracy54,Job end stand half dog word.,2024-01-17 21:38:29,494
Conversation_1368,jason79,alyssa98,Sometimes final forget middle director.,2021-10-11 22:40:07,109
Conversation_1369,landrade,milesfranklin,Yes friend bank enough officer north.,2022-11-10 18:11:57,900
Conversation_1370,vmurphy,evelynconway,Hour commercial I plant media still.,2020-09-30 21:42:19,484
Conversation_1371,kingjonathan,kellyhendrix,Floor research drug what budget loss rather.,2021-03-23 04:46:25,621
Conversation_1372,amandaweiss,tayloranthony,Mind moment pressure wrong military rule management month.,2022-10-12 03:40:55,904
Conversation_1373,joshuathomas,daughertylaura,Only any support movement hour teach.,2021-01-02 17:43:03,732
Conversation_1374,amber32,ncompton,Recently finish firm nothing.,2021-09-19 00:58:28,342
Conversation_1375,kristin70,danieljohnson,Will pay happy blue sort.,2023-03-10 17:35:57,788
Conversation_1376,erik80,bushtony,Participant assume model home mission situation.,2020-01-23 05:02:27,871
Conversation_1377,tmorales,aliciacoleman,Which hard action at begin.,2021-10-19 22:30:15,643
Conversation_1378,thomaspatrick,gyoder,Sort true stage debate machine apply want.,2023-05-29 22:17:29,724
Conversation_1379,robertmiller,hansenjustin,Say stock it else happy.,2021-07-28 21:10:53,53
Conversation_1380,jonessherry,avega,Say adult with list church seat.,2021-05-16 09:43:25,962
Conversation_1381,ibryant,douglas02,Without teach tree system let different skin simply.,2021-02-21 07:34:00,322
Conversation_1382,underwoodkeith,elizabeth49,Military these question.,2021-07-31 23:39:15,771
Conversation_1383,rodgerstiffany,hjensen,Option sea security while drop.,2023-10-27 19:19:11,866
Conversation_1384,clarkwilliam,blake08,Executive painting religious ground.,2020-10-29 01:01:57,318
Conversation_1385,howellnathan,william92,Give not but major some election.,2024-01-17 02:57:31,838
Conversation_1386,james63,middletonedward,Staff play side gas entire.,2022-12-15 20:36:11,853
Conversation_1387,thomas26,xwilliams,These sign outside.,2020-06-23 06:14:51,397
Conversation_1388,marymeyers,kristi20,Seek almost man example miss.,2023-12-03 06:18:26,986
Conversation_1389,joshuaserrano,nathanlam,Pressure message wait doctor number message.,2022-11-18 17:59:40,946
Conversation_1390,barronalan,dennis26,Crime traditional another stage each.,2022-07-21 01:30:52,650
Conversation_1391,lindsay85,michael07,Wife manager foot name tend foreign strategy resource.,2021-09-05 04:46:41,563
Conversation_1392,matthew26,qmartinez,Finally officer long sign.,2021-07-04 06:55:08,998
Conversation_1393,michael02,debrasnyder,Network road public reason staff form war.,2020-02-03 19:23:29,312
Conversation_1394,david84,jamesgarcia,Treat character just interview.,2020-02-04 05:50:11,317
Conversation_1395,kelseywest,hillbrandon,Process girl table still.,2021-09-18 13:31:27,106
Conversation_1396,melissadickson,elizabethrobinson,Carry director tax newspaper describe.,2024-01-08 09:15:06,838
Conversation_1397,gilbertbryan,newtonkatherine,Us want act he college write.,2023-08-15 13:42:32,594
Conversation_1398,mcleanmaria,ddyer,Near crime front baby.,2021-01-16 06:26:16,37
Conversation_1399,fhughes,coxconnie,Discussion surface share crime.,2023-04-25 07:48:15,753
Conversation_1400,kristina12,mendozakristin,Range wonder spend environment discover half.,2022-10-13 09:09:57,581
Conversation_1401,fhoffman,gary50,General body peace conference girl care during significant.,2021-03-06 23:07:51,135
Conversation_1402,alejandra79,gharris,Decade our season quality move.,2023-08-30 18:29:11,413
Conversation_1403,hsmith,marysimpson,Leader magazine accept already state brother ever.,2023-12-15 21:55:25,242
Conversation_1404,marksilva,davisnathan,With need option put perhaps land sound.,2023-12-29 01:32:47,281
Conversation_1405,youngwilliam,davidochoa,Room want including forget pressure.,2022-04-20 08:13:57,98
Conversation_1406,hawkinsedward,garrettjamie,Series no discover page.,2023-06-20 09:34:06,160
Conversation_1407,jeromedavis,fernandocole,Give simple least with be city stuff.,2021-01-29 12:12:03,960
Conversation_1408,ngalvan,teresablake,Possible be seek rate network.,2023-06-08 11:48:23,538
Conversation_1409,nguyenpeter,ashleymurray,Order top do kind identify rest true.,2021-10-27 21:57:47,428
Conversation_1410,joshuabrown,mariamontoya,Cost Democrat decision audience month view.,2023-05-24 23:17:45,307
Conversation_1411,ryan36,smithkaren,Stage his picture part son speak.,2024-03-21 05:02:37,681
Conversation_1412,madisonmcdaniel,mariadavis,Production family open west suffer concern where.,2022-07-30 04:33:46,642
Conversation_1413,gregory44,natashajohnson,Mouth member win clearly thousand sell.,2023-05-20 16:23:33,264
Conversation_1414,dennis58,fleminggary,West bill cover particularly must subject answer win.,2020-08-18 11:33:59,512
Conversation_1415,philip38,marielopez,Less business including environmental drop say stay.,2020-07-11 23:10:00,129
Conversation_1416,ashley95,fernandocole,Answer consumer model point model.,2022-08-24 15:30:38,941
Conversation_1417,hudsongregory,kevindavidson,Sea piece detail race upon eye between small.,2021-01-06 17:12:55,816
Conversation_1418,taylorvalerie,teresablake,Throughout camera particularly answer.,2020-09-24 04:04:03,158
Conversation_1419,mcoleman,courtneycox,Trip stock evidence model.,2024-04-02 22:20:37,846
Conversation_1420,samantha55,bowentimothy,Understand list ability back compare also example.,2023-02-21 13:08:37,159
Conversation_1421,ricardomcmillan,etorres,Sea something around age.,2022-01-28 13:25:55,302
Conversation_1422,miranda34,vandersen,Federal color wrong well.,2023-07-03 07:52:51,484
Conversation_1423,briannacrane,christina34,Big wife attention analysis many.,2020-01-21 17:55:27,407
Conversation_1424,bmiller,jonathan40,Truth claim certainly true type door.,2023-05-23 07:24:15,381
Conversation_1425,davistom,joanna46,Mention of society sure.,2020-10-08 14:45:04,24
Conversation_1426,kellykristy,schultzjanice,Month why husband push hot chance.,2022-09-07 01:53:08,239
Conversation_1427,smolina,sarah40,Also couple race unit quite mouth fact.,2021-03-30 14:40:07,918
Conversation_1428,steven20,littlemichael,Old pressure whatever.,2020-08-04 23:52:04,96
Conversation_1429,judy43,beckdonald,Option foot apply west financial test city by.,2022-02-24 04:27:45,18
Conversation_1430,lloydsteven,fletcherrandy,Arrive least pay answer public health group.,2023-03-30 09:26:29,254
Conversation_1431,christopherwhite,ryan36,Arm individual test exactly shake.,2022-08-02 10:06:27,177
Conversation_1432,ucabrera,milesjeremy,Be yard talk statement increase.,2021-02-06 03:17:10,247
Conversation_1433,debbie61,kimberlynguyen,Mission should safe place.,2022-05-04 20:17:22,77
Conversation_1434,michael02,christina36,Store management record degree difference.,2022-07-13 11:40:23,563
Conversation_1435,jenkinsjose,lorraine69,Could north guy spring about light decade.,2022-09-04 07:15:07,651
Conversation_1436,tommy58,juanking,Next add also fact cover line.,2021-06-14 16:35:38,117
Conversation_1437,millermisty,smithalexander,Next argue local concern.,2024-03-25 21:43:12,267
Conversation_1438,garciamia,marybaker,Authority often value.,2023-01-30 03:03:05,392
Conversation_1439,mmcclure,bmiller,Author camera suggest watch through action modern.,2023-01-12 07:31:30,257
Conversation_1440,ryanallen,paul39,Different we rock night pattern.,2021-07-07 03:30:13,802
Conversation_1441,shill,riveraarthur,May learn character wife determine.,2020-04-11 10:21:59,760
Conversation_1442,tracy49,brianzimmerman,Science show dog center later tend.,2020-10-29 03:28:56,618
Conversation_1443,fwatkins,brittany10,Right cause type suddenly hear.,2021-09-02 11:43:42,851
Conversation_1444,tyronehale,edwardnunez,Here before skin man gas.,2023-01-02 21:15:01,484
Conversation_1445,davidwatkins,shawnwilliams,Range author minute data far red.,2023-12-15 15:05:40,261
Conversation_1446,banksmichael,xfitzgerald,Nature particular item really not.,2022-10-28 00:07:42,117
Conversation_1447,dustinhughes,anthonymiddleton,Store weight morning argue.,2024-04-06 23:58:24,41
Conversation_1448,mdonaldson,martin32,Line religious everything cultural.,2023-09-04 22:27:10,424
Conversation_1449,clarkglen,morganjeffery,Build brother pattern should.,2023-09-13 01:41:35,680
Conversation_1450,hebertlaura,gonzaleslarry,Nation pressure serious produce.,2021-03-16 23:04:13,57
Conversation_1451,rossgerald,lovealexandria,Perhaps doctor task service product.,2022-11-15 23:04:50,100
Conversation_1452,jford,simmonscraig,Risk young event eye high watch actually.,2022-02-20 10:51:37,767
Conversation_1453,christophercampbell,deannawolf,Capital above along line.,2022-01-06 21:25:01,95
Conversation_1454,antonio88,ashleysmith,State alone heart significant thought five.,2020-12-02 19:27:53,461
Conversation_1455,davidrodriguez,wgraham,Third understand green little leader everything.,2021-11-16 15:16:18,946
Conversation_1456,thomas08,sramirez,Beautiful vote authority but effect table.,2023-03-12 11:43:03,502
Conversation_1457,wjohnson,kimberly32,Size raise particular art.,2022-04-18 08:45:56,707
Conversation_1458,todd37,caitlingaines,News song sure stay.,2022-08-15 23:33:00,885
Conversation_1459,jennifer87,lisalopez,Eight away step fly compare key.,2021-02-21 10:04:20,371
Conversation_1460,jennifer73,allenwendy,Test current start industry realize lead.,2022-03-06 23:05:59,206
Conversation_1461,santiagoomar,greenmatthew,Ahead player deal keep change cost.,2020-03-31 08:33:03,160
Conversation_1462,justin19,beckdonald,Someone nature thank big.,2022-09-21 13:14:04,758
Conversation_1463,scotthouse,juangarcia,From federal detail true.,2022-03-15 16:24:38,648
Conversation_1464,wallaceerin,justinedwards,Better how present pay hour effect.,2023-07-29 15:39:56,262
Conversation_1465,eugenepena,listephen,Many record writer hard wish foot red.,2022-09-26 22:54:22,19
Conversation_1466,jimmy99,rgreer,Us may space human.,2024-03-04 04:09:01,721
Conversation_1467,lynnronald,curtisdanielle,Position professor practice actually serve.,2020-01-17 10:17:20,272
Conversation_1468,vlong,pateltroy,Must choice save television forget major catch.,2020-11-12 03:53:44,54
Conversation_1469,mcdonaldtimothy,parkerhannah,Stay significant lawyer major hot rest.,2020-05-16 20:47:05,936
Conversation_1470,ehernandez,denisemcdaniel,Now realize say plan analysis themselves part.,2020-04-13 08:48:32,858
Conversation_1471,dmclaughlin,wkennedy,Community somebody experience her service very friend.,2020-02-20 13:47:39,99
Conversation_1472,martinezann,shellyhernandez,Before skin wide relationship begin large.,2020-11-20 16:32:21,478
Conversation_1473,smithaaron,brian52,Course less type special take.,2023-01-19 17:08:46,183
Conversation_1474,mgutierrez,thomas71,General business about soldier anything.,2020-11-30 03:24:14,549
Conversation_1475,marshmiranda,kingstephen,Year alone eat tonight.,2020-08-15 18:30:01,58
Conversation_1476,popedeanna,ehansen,Magazine memory born base.,2023-08-11 03:37:06,659
Conversation_1477,christopherbrown,zclarke,Ago take nature despite.,2021-11-02 04:02:41,270
Conversation_1478,barbara97,lewisandrew,Loss point speech article citizen according wait.,2022-04-25 07:51:50,327
Conversation_1479,lisa07,sanderson,Community experience religious this hospital.,2022-02-13 20:23:06,807
Conversation_1480,reginasmith,mfrey,Name unit cold.,2020-06-06 21:18:04,392
Conversation_1481,kim51,matthew18,Claim view full resource argue along firm.,2021-01-24 17:50:32,540
Conversation_1482,timothymiller,mirandaheather,They official decade attention remember control report property.,2023-03-14 14:57:16,423
Conversation_1483,natashaibarra,cgordon,Study whatever share another body several.,2020-04-19 19:38:18,366
Conversation_1484,jack52,lewislaurie,Mind billion responsibility save.,2022-01-11 08:22:14,873
Conversation_1485,kellycurtis,ybenson,Only fall reason alone.,2021-09-02 20:48:38,960
Conversation_1486,gwhite,eadams,Enter hour experience many air expect.,2021-07-17 01:58:20,945
Conversation_1487,donna31,kevin10,Show able daughter at they stage example.,2020-08-28 22:55:53,267
Conversation_1488,davidweaver,clarkchristopher,Scientist of involve about news something.,2021-03-29 08:16:51,432
Conversation_1489,scott22,elizabeth26,Seek left stuff eight stock network chair.,2022-07-14 00:54:35,940
Conversation_1490,amanda58,xhamilton,Fill hit entire happen.,2022-10-19 16:36:17,572
Conversation_1491,chelsea02,caitlingaines,Sense who office maybe month safe.,2022-11-04 18:51:27,196
Conversation_1492,tcordova,dquinn,Change ball area hour.,2022-06-20 16:24:20,681
Conversation_1493,michaelortiz,oadams,Animal since anyone sea decade.,2023-05-29 02:38:50,208
Conversation_1494,brittany02,smithalexander,Approach school exist race few.,2022-09-30 11:03:52,102
Conversation_1495,jenniferlopez,kbennett,Soon he blood have public.,2022-11-04 19:30:43,18
Conversation_1496,hallann,sierra63,Suddenly let write possible yeah.,2022-09-04 04:45:41,332
Conversation_1497,jennifer36,michael59,Four establish treat future own gun my discuss.,2022-05-18 03:25:24,589
Conversation_1498,gregoryfaulkner,lmckay,Experience maybe ball sell them degree.,2021-11-09 17:37:26,929
Conversation_1499,woodsstephanie,qjackson,Thousand activity however third three race.,2022-09-26 17:16:54,342
Conversation_1500,hfreeman,jessicaholland,Reduce speech everyone investment building citizen.,2020-04-05 11:22:34,932
Conversation_1501,thomashawkins,mayashley,Usually someone police painting.,2023-07-23 03:04:38,413
Conversation_1502,staffordhannah,yorkmichael,Size include behavior me.,2020-06-19 10:11:17,350
Conversation_1503,johnsonmelinda,dustinhughes,Pull kitchen believe allow line lot growth.,2023-08-01 13:05:04,806
Conversation_1504,meyerdarius,cspears,Interesting without standard reveal pick remember free newspaper.,2022-04-20 17:09:08,278
Conversation_1505,reynoldsalex,kellyhendrix,Person gun remember role much write sure.,2022-02-13 11:15:45,459
Conversation_1506,patrick31,treed,Across early air single night.,2022-03-08 04:11:58,606
Conversation_1507,hillwilliam,sarahsilva,Key require doctor support either education production chair.,2020-06-04 12:28:07,493
Conversation_1508,qtanner,smithjason,Send debate very nearly boy appear purpose year.,2020-09-09 14:28:36,129
Conversation_1509,hansenjohn,nicole23,Hope evidence follow keep end number alone.,2020-05-14 19:02:39,25
Conversation_1510,rogervazquez,alyssa36,Suffer up weight fill write impact.,2020-05-07 21:15:56,824
Conversation_1511,dmiller,martinezchristopher,Production enter serve simple.,2020-04-05 09:49:44,211
Conversation_1512,hannah13,khuang,Military issue task investment page address mother.,2023-07-12 11:45:44,594
Conversation_1513,jennifer39,tommy87,Tough project rather billion floor.,2022-03-29 18:08:30,406
Conversation_1514,jennifer35,geraldjones,Relationship day catch believe first address.,2021-10-11 06:54:12,510
Conversation_1515,jessicalawrence,ramseyaustin,Price standard standard writer other.,2023-03-27 14:26:47,938
Conversation_1516,melissaleonard,melanieadams,Place key finish beyond sea better school section.,2023-06-11 07:32:31,611
Conversation_1517,nsmith,victoria29,Into research letter television need common reveal full.,2024-02-24 05:23:14,33
Conversation_1518,briana33,taylorvalerie,Might hope threat loss management.,2021-04-27 23:51:33,875
Conversation_1519,qfoster,richardsonanthony,Foot much when national cold.,2021-09-13 08:30:40,348
Conversation_1520,donna90,gnelson,Power make stage boy guy behind.,2020-04-07 21:14:02,44
Conversation_1521,markthompson,wrightrandall,Factor can chair.,2023-11-19 10:56:31,643
Conversation_1522,fjoseph,smithtyler,Stage run enjoy.,2022-01-14 04:53:35,697
Conversation_1523,kristen27,sanforddanielle,Store painting last past guy seem.,2021-04-14 01:59:06,587
Conversation_1524,ricecarolyn,brenda29,Blood official news cut.,2022-01-13 14:47:55,623
Conversation_1525,bailey40,elizabeth51,Future tonight difficult off else low risk stage.,2020-09-11 02:25:46,563
Conversation_1526,michael85,stevendaniels,Special laugh indeed never.,2022-04-22 04:17:05,798
Conversation_1527,moniqueturner,paulhawkins,Fly site door yeah.,2022-07-16 16:52:14,345
Conversation_1528,swansonclifford,steven19,Executive throw new safe smile beat.,2021-02-03 18:56:27,962
Conversation_1529,bvang,vvang,Security teacher fear visit.,2023-09-04 22:45:56,714
Conversation_1530,zriley,vhernandez,Cause nature mention big question onto.,2021-12-21 01:11:04,325
Conversation_1531,arthurtaylor,christopherparker,Bill really indeed cell management walk challenge.,2022-04-07 20:50:22,809
Conversation_1532,cindytucker,amynichols,Improve add sell maybe however say strong.,2021-02-16 11:19:43,870
Conversation_1533,joshuaserrano,brownbrian,Foot trip economic about either.,2022-04-30 09:02:44,196
Conversation_1534,pamelaferguson,daviserin,Issue position trip rate age chair.,2020-11-07 23:23:46,983
Conversation_1535,jennifer73,clopez,Industry discuss media they.,2021-10-16 08:45:50,582
Conversation_1536,zbailey,zsmith,Authority determine condition produce at himself.,2023-06-11 01:51:53,383
Conversation_1537,jessicachoi,rileyangela,Well dream local world.,2021-01-09 20:07:11,615
Conversation_1538,kgarcia,yshepard,Sense professor may decade need ahead.,2023-10-08 02:52:44,76
Conversation_1539,pwilson,charles90,Share rule deep beat human central authority.,2020-10-30 19:25:33,719
Conversation_1540,browncole,desiree32,Produce land relationship task.,2023-06-10 18:29:27,718
Conversation_1541,rmiller,karenhodges,During western deal campaign approach.,2023-10-24 13:57:01,160
Conversation_1542,kristi20,debrasnyder,Rather the to each leave poor must.,2022-03-30 07:45:15,265
Conversation_1543,marysimpson,allensierra,Similar somebody off training.,2022-05-29 15:02:46,257
Conversation_1544,iphillips,evansdonna,Somebody music glass example approach law could.,2022-08-11 22:52:20,737
Conversation_1545,ggilbert,teresa28,Decision stuff page after they pass.,2022-12-02 07:25:50,104
Conversation_1546,gclark,george41,Official low trial type.,2020-03-29 05:46:13,839
Conversation_1547,ramirezphillip,reedtiffany,Name participant worker under article better raise.,2020-03-23 22:05:46,44
Conversation_1548,shepherdlaura,sandra86,Price maintain center more painting.,2022-09-11 07:58:24,627
Conversation_1549,zacharydixon,rothmelinda,Here hot ago.,2023-05-18 06:52:19,65
Conversation_1550,moralesbrittany,tmiller,Case agency magazine role suggest best ahead position.,2021-07-09 13:25:15,929
Conversation_1551,james12,carly56,Believe wonder product discussion approach.,2021-03-13 07:41:46,183
Conversation_1552,rgomez,nathan54,Center candidate consumer natural.,2023-07-29 19:19:26,25
