ID,Member1,Member2,Conversation_name,Conversation_created,Messages_quantity
Conversation_3603,alexisbrown,joycecurtis,Fact likely practice international partner personal two.,2022-03-22 20:25:24,275
Conversation_3604,amychavez,thomasalexander,Tough teacher traditional unit husband nice.,2022-08-08 20:55:52,488
Conversation_3605,sarabarnes,djohnson,Would wind think.,2022-01-21 02:43:51,364
Conversation_3606,misty02,hernandezamber,Civil heavy around leader most particular.,2022-12-30 13:27:41,59
Conversation_3607,xpeterson,mooreryan,Television method kind draw benefit record age.,2022-03-03 21:58:45,639
Conversation_3608,hkidd,wpeterson,Whatever professional science not light support simple.,2022-02-07 17:05:05,649
Conversation_3609,brian37,brownshannon,On bit particularly also nothing air responsibility.,2022-02-05 05:04:26,489
Conversation_3610,mirandaheather,brian52,Church couple rise five way piece inside.,2024-02-13 06:24:06,35
Conversation_3611,nflores,marysimpson,Second address lawyer sure hit.,2022-11-15 00:55:19,549
Conversation_3612,dorothy80,hvargas,Participant begin wide which meet.,2024-01-19 21:55:23,728
Conversation_3613,fullerjoshua,john33,Hand rest help out guess leader response.,2022-04-29 19:14:21,143
Conversation_3614,piercewilliam,perezcarl,Thought expert bar up why participant season.,2023-08-13 20:34:35,870
Conversation_3615,jessicajones,jasonrosales,Local sport attack vote.,2021-04-04 12:23:05,127
Conversation_3616,twilliams,plane,Camera down social shoulder organization.,2020-08-15 06:12:04,948
Conversation_3617,whughes,rogervazquez,Exactly approach nothing hair all house democratic tonight.,2022-04-07 20:13:10,478
Conversation_3618,kbennett,johnsonjennifer,Rather beyond which serve memory from per.,2022-03-10 09:32:36,511
Conversation_3619,roberthayes,robertlee,Enjoy main like total between.,2022-12-23 16:54:26,113
Conversation_3620,philip84,williamsjanet,Scientist peace ability class.,2023-05-12 19:38:07,25
Conversation_3621,clarkchristopher,zmaldonado,Data father how possible avoid.,2022-04-04 15:32:56,283
Conversation_3622,ofisher,robert67,Thus summer because low.,2022-05-15 13:54:04,832
Conversation_3623,elizabeth44,hbailey,Draw life mission compare green want.,2023-04-27 13:14:26,458
Conversation_3624,crystalthomas,lhunt,Teacher camera light win ball rest could.,2022-09-11 06:30:14,709
Conversation_3625,omorales,amanda56,Budget north her another sure leader fire.,2021-03-01 14:13:48,528
Conversation_3626,jeffreygibson,yallen,Now black nation detail bed suddenly leg.,2021-10-19 07:31:12,685
Conversation_3627,zboyer,fowlersandra,Theory decision both early page hot pick.,2023-12-21 11:02:40,785
Conversation_3628,michael83,wilsonkimberly,Popular turn note team hotel owner series.,2024-03-11 00:42:20,689
Conversation_3629,erin87,davisstephanie,Society thus thing produce staff phone.,2021-02-01 07:25:53,741
Conversation_3630,ugarcia,fieldsjustin,Marriage general property us address number.,2021-04-06 14:36:15,695
Conversation_3631,kenneth83,amoore,Financial finish single pattern shake.,2022-09-07 19:55:28,588
Conversation_3632,montgomerylinda,david84,These carry good when talk support teacher.,2021-04-24 18:56:26,454
Conversation_3633,nicoleguzman,cheyennerodriguez,Sing Mr buy probably through.,2020-07-09 13:30:25,103
Conversation_3634,alawrence,kevin62,Interview moment increase.,2024-02-07 18:28:43,805
Conversation_3635,nguyenpamela,marielopez,Significant ago six write use someone mention.,2023-04-23 02:38:40,1000
Conversation_3636,proctorcody,michael34,Hot range first might focus.,2022-03-26 07:09:57,417
Conversation_3637,emily29,williamsann,Simple experience use into but wonder.,2023-02-06 10:20:33,128
Conversation_3638,igiles,dennistaylor,Good view order live.,2023-04-24 19:36:25,609
Conversation_3639,zzimmerman,danielsadam,Expect certainly TV dinner early mother dark.,2021-12-01 04:40:24,739
Conversation_3640,sharonclark,mark55,Best meeting very food stay long.,2021-10-14 23:50:35,259
Conversation_3641,justindavidson,dgomez,Health administration environment right bed professor what heart.,2020-05-10 00:42:13,235
Conversation_3642,gonzalezbarbara,bakerkimberly,Car social six some example.,2022-12-06 03:54:01,582
Conversation_3643,whitebrett,johnbenson,Final behind decide.,2020-04-13 01:52:04,991
Conversation_3644,angelacox,kcarpenter,Crime yeah figure forget today test vote.,2023-12-29 22:40:42,677
Conversation_3645,christopherlee,bruce90,Once any plant several arrive.,2021-11-22 19:34:05,587
Conversation_3646,benjamin77,thomasstephanie,Cultural claim either loss tend career.,2023-01-26 05:10:13,872
Conversation_3647,kwalker,heathertran,Modern behavior close store campaign save walk.,2021-11-17 01:15:49,921
Conversation_3648,mckeechristopher,reginasmith,Film from create human occur pattern.,2022-12-03 08:01:43,870
Conversation_3649,mooneynicholas,bradywalker,Buy sister stage ago take.,2021-12-26 14:28:54,988
Conversation_3650,hbarker,elizabeth13,Mother night movie magazine audience despite.,2020-10-29 20:36:26,300
Conversation_3651,katherine39,vrobinson,Prepare behind enter management.,2021-05-24 01:41:19,551
Conversation_3652,veronicahanna,lanejulia,Be beautiful machine national ability future debate.,2022-06-01 05:15:37,926
Conversation_3653,denisegutierrez,charleshenderson,Something might mind serve open.,2020-03-25 04:59:47,533
Conversation_3654,qriley,esmith,Assume should new civil long reason strong leader.,2020-05-19 13:48:57,195
Conversation_3655,fernandogreen,tcruz,Recently view important charge.,2023-08-18 07:23:16,714
Conversation_3656,gary76,elizabeth51,Majority investment everything live seat.,2021-08-17 07:38:27,193
Conversation_3657,wboyer,ymay,Level probably any ball first activity.,2021-03-05 00:18:22,151
Conversation_3658,lporter,alyssa74,There main move.,2021-05-25 16:13:19,222
Conversation_3659,sheltondavid,xmartinez,Want would treat middle image.,2021-07-23 09:22:29,231
Conversation_3660,hrivera,mwatson,Wish start statement.,2022-12-09 21:46:52,411
Conversation_3661,knightjoshua,andrewmoses,Camera tonight drop.,2022-09-10 05:31:10,435
Conversation_3662,kbrown,rachelnorris,Either attention tell language others.,2021-09-29 01:40:17,118
Conversation_3663,theresa17,brentgonzalez,Long else lot score condition fact.,2023-08-24 13:23:34,509
Conversation_3664,mbrown,cisnerosstacy,Be operation wish successful allow prevent type risk.,2023-08-24 08:46:58,69
Conversation_3665,christopherwood,mmcclure,Risk first arm our start on organization.,2020-08-31 01:03:16,125
Conversation_3666,mbryant,jameslopez,Drug compare health central.,2021-12-12 08:10:22,586
Conversation_3667,aaron21,waltersjeffrey,Development sister very think.,2021-11-18 13:57:10,508
Conversation_3668,wmartin,aaronsandoval,Hold see around benefit third.,2022-10-09 11:23:19,149
Conversation_3669,erin00,baxterjennifer,Feel series edge current.,2022-01-28 20:15:46,712
Conversation_3670,plittle,maria39,Page third late risk.,2022-06-15 16:56:42,625
Conversation_3671,jwright,xlong,Nor help drop human nearly.,2022-09-02 20:54:07,649
Conversation_3672,ericbruce,tomtate,Experience number must stop two light to.,2021-05-20 23:05:34,227
Conversation_3673,myersdonald,justinscott,Physical myself thus draw option like.,2021-03-13 02:15:49,72
Conversation_3674,omartinez,lmartin,Ask much dream chair position first believe husband.,2022-03-06 12:11:37,868
Conversation_3675,diane02,ofry,Without kitchen prepare.,2020-12-06 03:36:01,672
Conversation_3676,jeffreyreed,angelamartinez,Myself when just mother collection cold society president.,2022-05-21 20:07:03,359
Conversation_3677,okey,jacoborr,Learn challenge each hard throw sense.,2022-07-01 19:36:43,447
Conversation_3678,michellepugh,carrie14,Imagine morning who perform.,2020-05-10 13:46:58,407
Conversation_3679,larrynunez,diane02,New yet turn right.,2020-05-16 10:10:46,431
Conversation_3680,xrogers,rgomez,Almost information town arrive deal enough.,2023-01-16 18:08:34,987
Conversation_3681,matthew72,fraziersteven,Consumer single law sit.,2023-11-23 10:04:43,81
Conversation_3682,bcruz,campbelljoseph,Eye per back.,2020-06-03 09:51:25,930
Conversation_3683,owheeler,sheilaconley,Laugh defense always minute sing.,2024-02-13 19:54:18,659
Conversation_3684,jamesburgess,martinamanda,Reveal serious yeah free itself statement television.,2022-06-28 13:32:16,547
Conversation_3685,danielpatrick,james98,New minute treat weight instead evening meet eat.,2023-05-25 06:43:57,802
Conversation_3686,christina21,hjones,Discussion energy talk throw center thousand fire.,2020-02-03 01:19:13,186
Conversation_3687,patrickrobertson,bhansen,Body story you.,2020-02-04 09:47:12,624
Conversation_3688,knappkevin,millervicki,Performance tough shoulder energy fill wind.,2022-10-12 20:14:44,358
Conversation_3689,mwalter,vmorrison,Three see make people someone girl office indeed.,2023-12-23 04:43:52,985
Conversation_3690,ruthgalvan,nancy01,Home break sure purpose picture space none effect.,2024-03-03 13:16:58,585
Conversation_3691,kyle35,ysmith,Fish likely red hope force energy stop well.,2023-04-27 01:27:11,66
Conversation_3692,annette52,christophercoleman,Adult end blue item some mission together.,2022-12-24 05:35:30,587
Conversation_3693,dgomez,mathisbrenda,Official two ask hair natural.,2021-11-07 01:39:28,691
Conversation_3694,prattlee,hwalker,Him theory court.,2021-10-25 06:14:07,636
Conversation_3695,elizabethsanford,hunterguerrero,Western affect society sit ten entire.,2022-09-02 11:40:36,486
Conversation_3696,wgraham,pholland,Sense practice image last audience race.,2021-11-07 23:11:15,42
Conversation_3697,kevin06,rickeysilva,Case could away road wonder present he.,2021-07-09 01:42:32,594
Conversation_3698,simpsonelizabeth,charles62,Let pay leader large office.,2023-05-31 21:08:42,135
Conversation_3699,maciascaroline,olopez,After break perform.,2021-05-22 02:17:04,230
Conversation_3700,khill,crodriguez,Record letter deep owner ten.,2021-03-02 07:27:12,561
Conversation_3701,rsmith,heather75,Area air list high low whole.,2020-10-16 01:49:44,575
Conversation_3702,diane02,jeremyyoung,Everyone know speak series stay culture again.,2020-10-10 06:53:18,332
Conversation_3703,valerie30,jimmykelley,As food security base speak capital discover place.,2020-12-09 04:08:19,707
Conversation_3704,wrightfelicia,michael40,Huge reveal through.,2021-01-24 09:34:24,750
Conversation_3705,tmiller,barnettfrank,Imagine star seat never.,2022-07-23 17:09:04,778
Conversation_3706,krystal52,wcarney,Suggest create easy early doctor great notice.,2020-10-26 18:49:58,231
Conversation_3707,robertellison,kristy83,Cause business each enough product.,2022-06-06 13:51:27,532
Conversation_3708,rachel06,djones,Report beat like ever risk dinner worker.,2020-04-07 04:15:25,214
Conversation_3709,osanchez,martinezpeter,Anything from network begin find.,2022-05-23 12:42:37,957
Conversation_3710,wisetimothy,obaker,Serve also shake foot onto.,2020-10-19 20:20:14,157
Conversation_3711,tonyharvey,cbaker,Course technology support level.,2020-11-15 13:16:13,275
Conversation_3712,andrewharvey,barbarapatel,Yourself think blue research manager above.,2022-09-11 04:38:48,674
Conversation_3713,gabrielwilliams,laurachavez,Voice place administration she dinner product husband.,2024-01-08 00:17:26,240
Conversation_3714,gina18,michael59,Various later lead character social a section.,2023-03-03 09:56:00,123
Conversation_3715,harry58,cromero,Report seat may crime issue environmental.,2021-11-29 04:14:39,281
Conversation_3716,jmartinez,william40,Response imagine end wall where address.,2023-05-05 09:01:37,716
Conversation_3717,barrerakimberly,brianhoover,Lot worry president.,2021-08-12 10:31:47,878
Conversation_3718,jerry07,gsimpson,Senior team say child a effort executive.,2024-01-19 01:04:28,508
Conversation_3719,hchambers,jason58,After store difference.,2024-03-31 17:31:28,192
Conversation_3720,sortiz,warrenjohnson,Radio today put camera six style force.,2022-07-21 13:42:37,765
Conversation_3721,avilashawn,scottjackson,Tend improve anything why.,2023-03-13 22:54:52,145
Conversation_3722,brentmendez,awolf,Decide put behavior choice cultural lawyer military.,2022-12-14 18:54:59,636
Conversation_3723,ashleyvega,bartonjennifer,Rule option big.,2023-01-20 12:30:03,298
Conversation_3724,jonathanrowland,elizabethvillanueva,Analysis purpose difficult responsibility reality.,2021-11-24 22:33:26,105
Conversation_3725,samanthaesparza,bradley79,Several put beautiful.,2021-07-09 07:20:37,261
Conversation_3726,kenneth45,joseph24,Whole condition major hundred.,2022-03-26 21:15:32,82
Conversation_3727,randygregory,amiles,Identify night begin.,2022-12-10 04:18:28,841
Conversation_3728,jwarren,ericgarcia,Guess serious single often rate difficult author.,2022-09-13 03:44:51,338
Conversation_3729,crodriguez,maria39,Character safe PM page sort sometimes.,2023-05-08 15:33:46,716
Conversation_3730,tiffany86,bushbruce,Fall air part.,2020-10-15 16:57:00,0
Conversation_3731,gabriel74,joseph49,Bit film nor sing art throughout.,2023-10-14 23:20:45,730
Conversation_3732,zromero,keith37,Administration game because involve use.,2023-06-02 23:59:57,217
Conversation_3733,aduncan,zgarcia,Study charge strategy the stop.,2023-05-10 17:38:54,732
Conversation_3734,diana86,heather05,Five trip wind girl customer edge again maybe.,2021-05-19 04:55:01,463
Conversation_3735,bowendaniel,lowens,Skill start specific happen drug though collection.,2020-07-05 14:44:38,46
Conversation_3736,erika62,monicadoyle,Safe rather final ten.,2022-10-20 19:31:34,910
Conversation_3737,bradywalker,bforbes,Rise relationship training.,2021-01-12 23:53:33,905
Conversation_3738,samanthalee,jessicanash,Develop analysis just risk bring chance alone.,2023-02-12 20:28:02,513
Conversation_3739,tcordova,justin68,President follow can final.,2021-05-18 04:44:29,809
Conversation_3740,valerie84,amanda65,There crime position team.,2021-10-11 19:37:36,30
Conversation_3741,garcialindsey,david67,Truth old guy win.,2023-06-19 05:34:42,549
Conversation_3742,andersonkathleen,johnsoneric,Fund drive water guy of.,2022-11-28 12:55:41,708
Conversation_3743,sreed,mcdonaldanne,Probably your Mrs song property drop.,2021-08-03 02:00:27,851
Conversation_3744,tracyfowler,maxwellhannah,Cup history again process cost whatever.,2020-11-03 11:42:47,552
Conversation_3745,garciarebecca,lyonssamantha,Particularly still case get defense east guy.,2022-03-16 12:36:03,600
Conversation_3746,danieljohnson,ijacobs,Role ball already modern always alone current.,2021-10-23 12:35:36,267
Conversation_3747,lawsonjessica,tammy61,Consider newspaper president everyone hit live player.,2020-05-22 19:17:03,201
Conversation_3748,sandraprice,cortiz,Ago hand attention coach.,2023-07-20 09:16:31,668
Conversation_3749,dianewilson,thomaspaula,Firm marriage pass us sea.,2023-03-18 09:46:09,738
Conversation_3750,michaelsanchez,ryanho,Financial pick realize couple feeling night president.,2020-05-27 09:11:41,413
Conversation_3751,phansen,leslie29,Party understand Congress pick.,2022-07-14 09:20:17,255
Conversation_3752,terrynichole,kempmichael,Support establish wonder common this dinner health.,2021-10-17 16:58:08,63
Conversation_3753,vmurphy,gharris,Significant away number specific who late world require.,2022-06-16 05:27:36,194
Conversation_3754,stacyjones,johnmarshall,Discover actually staff stage too.,2022-08-23 22:29:59,622
Conversation_3755,sharpkyle,mooreryan,Resource approach rather black budget.,2020-03-14 04:55:30,439
Conversation_3756,muelleranthony,pricelindsey,Drug their she nice.,2021-12-04 07:14:16,732
Conversation_3757,richardshaw,shannon43,These two difference society.,2020-03-11 11:29:33,833
Conversation_3758,wsmith,mpalmer,Issue child wife during woman school.,2021-07-13 07:58:36,557
Conversation_3759,peggy16,joseph97,Put forward growth quickly.,2022-12-12 10:38:32,222
Conversation_3760,carteryolanda,frodriguez,Type here each few sit wife personal skin.,2024-03-09 15:28:53,494
Conversation_3761,rachelwilliams,mcmahonbobby,Tonight according there fast.,2023-08-07 12:55:01,243
Conversation_3762,williamsonjessica,elizabethfisher,Talk special total century mean describe serve student.,2021-09-15 12:26:54,164
Conversation_3763,jacksonbrandon,woodpaul,Forward together never second seven bit measure.,2023-02-11 14:59:09,833
Conversation_3764,lawsonanthony,sarah37,Child interest tough walk final.,2023-12-26 03:41:47,92
Conversation_3765,michaelmills,ybrown,President full myself grow others.,2022-05-31 17:28:16,904
Conversation_3766,crystalthomas,matthew49,Mr standard chance wait fall get.,2020-01-30 03:54:39,52
Conversation_3767,jpayne,osmith,Cup chance participant mean picture current.,2023-08-13 06:55:21,849
Conversation_3768,bettytate,wilsonwayne,Interest risk direction art action garden billion.,2022-06-02 18:19:27,335
Conversation_3769,charles74,hunterbowers,His lead decide hear her even they.,2020-01-30 11:37:17,630
Conversation_3770,catherine38,ayoung,Avoid important authority enjoy office ground huge.,2020-03-23 07:18:10,475
Conversation_3771,jamiedavis,stephen09,Sit hard former month note.,2023-07-30 11:22:11,128
Conversation_3772,johnvaldez,yhebert,Movie low discussion pretty during since husband improve.,2020-08-24 10:02:51,887
Conversation_3773,jenniferwest,phansen,Protect trip it charge.,2020-10-16 15:33:38,458
Conversation_3774,christian41,jodijones,Determine identify science against drug rule.,2021-11-15 03:17:28,192
Conversation_3775,xfaulkner,kathleenray,Stand believe half.,2020-01-07 17:05:04,221
Conversation_3776,paul84,riddlejason,Impact traditional dog address summer.,2023-09-29 08:50:11,877
Conversation_3777,twebster,clarkglen,Throughout former draw recognize real.,2021-11-26 19:35:36,886
Conversation_3778,qjohnson,djames,Part again certainly action too ground health.,2023-04-16 19:12:03,403
Conversation_3779,geoffreyhunt,donaldhuerta,Drop arm political get.,2021-01-07 16:57:28,986
Conversation_3780,michaelortiz,marshalldonna,Most admit serve low nature.,2022-05-28 06:09:30,405
Conversation_3781,rodriguezashley,kthomas,Fire several inside behavior quickly.,2021-01-28 21:32:44,193
Conversation_3782,mcdonaldtimothy,jeffreywall,Mission especially decade meeting.,2020-07-27 16:31:57,63
Conversation_3783,michaelmccormick,douglasanthony,Star economy try around scene he will.,2021-06-10 01:20:27,656
Conversation_3784,xhensley,andrew54,Training even field government contain serious set.,2020-09-21 19:26:56,648
Conversation_3785,wcarney,laura82,It lawyer attack spend painting just.,2022-02-25 05:28:50,128
Conversation_3786,cainzachary,michelle65,Best budget traditional other.,2022-04-11 00:18:55,99
Conversation_3787,lisabarnes,jennifercolon,Season picture up just.,2024-03-28 21:27:54,502
Conversation_3788,angela56,regina96,Cover drop born cell.,2020-11-05 14:03:45,779
Conversation_3789,terryolson,martinhooper,Participant major owner above above its.,2021-10-29 05:59:39,652
Conversation_3790,tracy54,dmoss,Wife fund enough may property grow.,2021-12-07 06:00:27,246
Conversation_3791,ibryant,sjones,House think try single suddenly.,2023-10-15 00:35:53,904
Conversation_3792,caitlincarter,isaiah40,Television occur get.,2022-04-26 23:41:19,368
Conversation_3793,wwilkins,vstewart,Sport other ball public.,2022-11-19 16:13:11,541
Conversation_3794,rodriguezwilliam,danielpatrick,Mention use whether how believe.,2022-12-19 07:06:23,974
Conversation_3795,benjamin77,gthomas,Little reality strong team remember later.,2020-06-30 21:16:20,683
Conversation_3796,jeffery63,younganne,Foot since one policy.,2021-05-03 02:53:22,480
Conversation_3797,daviskimberly,tyronehale,Like politics page late.,2022-10-30 02:45:55,47
Conversation_3798,jasongarza,patrick57,We experience let reveal action.,2023-06-15 16:34:31,9
Conversation_3799,dgomez,davismark,Personal show ten wish perform girl.,2022-10-28 23:28:48,331
Conversation_3800,thomas08,robertsonjamie,Thus thus name consider.,2023-07-19 12:12:55,269
Conversation_3801,ugonzalez,jasonjohnson,Close computer theory office agent.,2020-10-21 10:33:43,297
Conversation_3802,barbara33,jonathan40,Data soon military treat.,2021-10-26 03:11:27,715
Conversation_3803,martinezstephen,shawn44,Own clearly recognize speech carry appear necessary.,2024-04-08 07:05:54,482
Conversation_3804,santiagonicholas,kevingonzalez,You clear stage increase exactly population until could.,2020-02-10 05:07:00,528
Conversation_3805,allen30,molly05,Character security box prepare such child box under.,2023-10-09 16:17:25,734
Conversation_3806,brandi06,griffithwilliam,Site across Mrs cause former war.,2023-05-26 04:13:04,627
Conversation_3807,joshuarichards,uferguson,Measure bag American reveal foreign Republican current.,2023-01-08 21:41:36,318
Conversation_3808,ehicks,adamkirby,View happy whole often together degree bring.,2020-09-10 01:28:44,102
Conversation_3809,catherine38,lisa88,Can too name enter spring play safe early.,2020-07-23 13:37:44,591
Conversation_3810,brandihodge,hollowaytami,Then as force development month around drive.,2024-02-08 12:47:27,121
Conversation_3811,tyronelopez,millercarlos,Possible behind forget fine people.,2022-10-12 15:36:26,791
Conversation_3812,vpruitt,colemanning,Purpose site few easy education.,2020-06-25 04:48:10,720
Conversation_3813,matthewgomez,howellveronica,Company player draw two interest individual.,2023-10-06 00:07:47,831
Conversation_3814,dominicevans,reynoldsalex,But type question shoulder.,2023-09-12 18:52:20,743
Conversation_3815,shannon12,kelseyrodriguez,Agreement approach upon shake.,2023-08-05 22:31:06,513
Conversation_3816,halejane,amanda19,Try PM owner rise wonder positive religious message.,2020-10-02 01:00:48,935
Conversation_3817,logan11,millergeorge,Talk better entire sit general.,2021-08-17 14:27:21,901
Conversation_3818,louis41,michael88,Human director Democrat effort find.,2021-08-22 14:11:25,935
Conversation_3819,jacksonbrandon,qmartinez,Through over mission price probably bar eight.,2023-05-16 11:26:18,823
Conversation_3820,kingemily,ringram,Night its need only cold southern hit finish.,2023-10-30 09:47:42,109
Conversation_3821,hjones,dustin24,Only garden past happy billion weight.,2024-04-09 09:22:17,136
Conversation_3822,tharmon,clarkwilliam,Road full about who medical.,2022-08-16 13:49:24,37
Conversation_3823,elizabethmiranda,goodwintara,Above PM out.,2020-01-25 22:18:09,670
Conversation_3824,danielatkins,nflores,Now fall ever watch scientist morning world.,2021-03-30 08:38:21,328
Conversation_3825,juan21,yvonne04,Wall term down happy part star may court.,2021-05-18 15:59:20,224
Conversation_3826,campbelljennifer,rachelwilliams,Word realize statement maintain again.,2022-03-09 08:28:08,454
Conversation_3827,mcdanielstephanie,tanyastark,Traditional training cup until.,2021-08-28 11:35:02,413
Conversation_3828,torresroger,gcuevas,Others significant up minute defense article particular.,2024-02-07 13:18:59,47
Conversation_3829,ramirezamy,gmyers,Small game have national add subject.,2022-12-07 06:11:49,192
Conversation_3830,vdyer,gibsoncraig,Person answer put store seat.,2020-07-21 06:40:40,1000
Conversation_3831,kevinlopez,bellnicole,Maybe cost man learn very.,2021-10-06 20:24:09,260
Conversation_3832,ortizjose,natalie15,On piece debate program edge Mr young.,2021-10-06 01:30:12,853
Conversation_3833,moyerjustin,marthabrown,During throughout recognize claim.,2022-01-06 21:11:51,144
Conversation_3834,eprice,lloydsteven,Third else whole citizen heart practice.,2022-11-05 10:30:02,170
Conversation_3835,michaelwilliams,wallsmichael,Magazine first letter left and establish.,2021-04-12 00:48:16,464
Conversation_3836,awolf,carolyn31,Likely professor statement today rate.,2022-07-29 10:08:58,592
Conversation_3837,kayla14,panthony,Study election hot upon stuff strong.,2023-01-28 03:47:19,991
Conversation_3838,estone,ncompton,Television also though expect occur interest change respond.,2020-11-04 10:29:34,765
Conversation_3839,lee98,samanthaesparza,Reflect two feel line share reach find.,2021-12-01 22:23:26,0
Conversation_3840,martinhooper,elizabeth79,Those meeting himself hotel.,2021-05-02 03:57:55,238
Conversation_3841,davidrodriguez,rbennett,Week either citizen alone young relationship production.,2023-07-31 01:29:00,317
Conversation_3842,hollyyork,jesuscain,Mean decade prepare care section PM interest.,2022-05-17 20:34:55,8
Conversation_3843,smithaaron,regina03,Task both around baby public return.,2022-11-01 02:42:57,298
Conversation_3844,oellis,owheeler,Personal physical here.,2020-11-09 12:22:57,863
Conversation_3845,erica29,williamsann,Like bag exist bill sport.,2022-09-07 19:19:20,400
Conversation_3846,joshua05,maria18,Read too economy strong fly bag today.,2022-01-04 09:42:27,362
Conversation_3847,lori85,wellsjacqueline,Do leg dark hair father half.,2021-05-18 09:47:28,365
Conversation_3848,mooreheather,stephanie95,Authority tend artist physical always.,2022-06-16 09:37:40,660
Conversation_3849,andrew25,oadams,Office cell hospital exactly.,2020-06-03 09:11:40,388
Conversation_3850,helendaniels,duranjohn,Matter time attack while.,2022-12-31 03:38:46,508
Conversation_3851,jon61,tdavis,Scene manage case tough everything tough.,2021-12-11 18:21:16,723
Conversation_3852,daniel23,jameshawkins,Mean player middle machine fly.,2021-09-20 11:00:04,816
Conversation_3853,usimpson,amber38,Such life beat perform best entire look.,2023-04-24 23:15:56,778
Conversation_3854,lisahart,cortega,Painting family quality he expert tend up home.,2021-03-26 17:42:05,246
Conversation_3855,spencercasey,millerkristen,Least same behind Democrat game response add street.,2022-04-09 21:38:59,770
Conversation_3856,brandon89,clarkhannah,Others eat better benefit.,2023-08-04 08:18:07,465
Conversation_3857,natashaibarra,dclark,Without few between agreement them.,2021-06-20 18:10:34,34
Conversation_3858,edwardslee,gallowaykristina,Begin hotel interview week.,2023-02-09 23:27:36,377
Conversation_3859,pcook,jasongarza,Effort finally church understand.,2023-02-26 22:56:19,536
