ID,Member1,Member2,Conversation_name,Conversation_created,Messages_quantity
Conversation_0,mcleanmaria,garciajill,Within eat environment college wonder side Democrat.,2022-03-31 22:28:32,214
Conversation_1,renee53,brandi06,Then page figure carry.,2020-04-24 13:59:46,304
Conversation_2,mariamontoya,cheryl90,Ground citizen would good see.,2023-05-09 04:28:56,696
Conversation_3,samuelmoody,fcoleman,Store when feel like high investment first.,2021-01-30 11:44:29,886
Conversation_4,tommy87,jeremy55,Sense half important room medical six southern.,2022-02-20 01:43:48,136
Conversation_5,ericbruce,davidfowler,Poor budget customer will.,2022-01-30 08:54:50,541
Conversation_6,phillipsnicholas,mirandaheather,Industry model mission force.,2022-04-23 20:31:44,475
Conversation_7,byrdjulie,rmoore,Member business operation thousand the.,2021-01-25 14:10:10,174
Conversation_8,michaelware,martinpam,Interest stock before continue future front all.,2022-05-26 16:20:14,846
Conversation_9,millervicki,amy51,Training fly at before interest say.,2021-08-27 21:15:24,190
Conversation_10,karensolis,adamdavis,Others real gun ground memory early.,2022-12-16 12:14:54,590
Conversation_11,jjenkins,obailey,Senior program certainly force toward industry.,2021-07-11 22:53:12,692
Conversation_12,manuelpalmer,johnsonjoshua,Policy region animal same.,2021-02-17 23:01:39,954
Conversation_13,nicolezuniga,brandon45,Home area high run administration year bed.,2021-12-03 21:43:04,591
Conversation_14,valerie30,smartinez,Anything level want risk song less war.,2021-04-09 23:48:32,60
Conversation_15,rebecca15,logandavis,Wear especially shake politics investment.,2022-09-08 08:10:23,962
Conversation_16,graveseric,brooketorres,Real thousand likely admit military memory walk.,2022-05-25 01:42:20,500
Conversation_17,nicolebeck,johnsantiago,Cost painting side man be response.,2021-10-29 15:14:06,277
Conversation_18,fortiz,williamssheila,Letter concern hear.,2023-06-05 08:12:01,191
Conversation_19,ogreene,franklinvanessa,Decision art others rate attorney carry usually.,2021-05-11 17:19:23,606
Conversation_20,currynicole,cannonchelsea,Maintain available dark various.,2022-10-14 13:10:08,76
Conversation_21,jennifer46,mary28,Agent likely system risk end.,2021-09-05 11:46:37,880
Conversation_22,michaelhall,piercelauren,Away board medical main prevent current rock rate.,2020-05-08 10:25:48,826
Conversation_23,dorseykarina,jserrano,Popular policy bank own.,2020-12-10 20:20:36,435
Conversation_24,patrickvaldez,todd64,Sport force line.,2022-09-10 23:09:08,162
Conversation_25,reynoldsalex,samantha76,Well himself source.,2020-12-01 10:49:00,698
Conversation_26,shanesmith,zscott,Word myself light out total former.,2022-05-12 19:22:29,789
Conversation_27,amber32,dylan61,Why ten space type next girl close.,2021-11-06 13:16:01,369
Conversation_28,katherine25,campbelltiffany,Ask bank church hold serve.,2024-04-05 14:11:49,212
Conversation_29,david20,sean93,Fire left manager change sound.,2023-09-16 14:15:10,667
Conversation_30,cowanscott,allenphillips,Story relationship coach boy traditional onto.,2020-08-20 06:36:02,74
Conversation_31,margaret93,ryanvalencia,Recent experience pick half study.,2023-03-20 09:07:45,117
Conversation_32,martinfrancis,chuff,Discover impact free rock wonder writer.,2023-01-10 08:33:37,427
Conversation_33,amoore,david86,Agency see attention concern start make.,2023-08-01 08:26:02,297
Conversation_34,lloydsteven,erika62,Past arrive rise find.,2023-05-18 14:25:20,802
Conversation_35,xle,lshepherd,Ability own whatever travel turn job.,2024-04-02 21:24:50,147
Conversation_36,parkjennifer,kleinlouis,Lawyer blood yes field respond show sit.,2023-02-23 12:24:02,744
Conversation_37,angela89,hubergregory,Future sure spring including business ahead hope.,2023-09-30 11:58:32,519
Conversation_38,vegajessica,valerie30,Part as remember think store.,2022-08-07 08:35:04,957
Conversation_39,wdunn,seanjenkins,Happy personal check ago last.,2023-03-27 05:58:11,970
Conversation_40,rachelchavez,lriddle,Act difference occur middle quality beat.,2023-12-25 07:49:39,237
Conversation_41,thomaskaren,isilva,Level something old commercial model.,2020-07-28 03:12:07,585
Conversation_42,mirandacarolyn,carolinebrown,Believe lot film own type take.,2023-04-28 21:35:20,641
Conversation_43,hdillon,robertgarcia,Time thank human common offer protect Democrat structure.,2023-09-03 11:18:09,984
Conversation_44,rsavage,dgardner,Outside fall receive stop.,2022-07-12 21:48:38,385
Conversation_45,kayla92,heathermurphy,Painting soldier yet alone see field.,2023-04-21 18:54:02,826
Conversation_46,nealderek,gutierrezholly,Court option season land seem time keep.,2020-03-08 19:00:33,964
Conversation_47,jaredhawkins,colemanrobert,Police cultural government size fly.,2022-11-22 16:00:53,484
Conversation_48,lucas89,suarezmary,Place person consider sound seat middle.,2021-11-26 09:08:30,171
Conversation_49,smithdonald,ramirezkatherine,Fine plant participant push.,2020-06-06 19:13:57,787
Conversation_50,whitegeorge,parkerhannah,Boy popular year staff little.,2023-03-13 06:44:59,696
Conversation_51,timothyedwards,ryan15,Theory likely deep require.,2021-02-28 23:31:53,372
Conversation_52,louis41,robertburns,Six out enter phone but line local.,2022-12-15 06:47:43,728
Conversation_53,nsmith,maldonadojesse,Guess sometimes beautiful difference possible ask.,2022-09-05 21:08:32,424
Conversation_54,matthewanderson,jenniferwoods,Share bank look art six effect hope.,2023-07-18 15:23:52,993
Conversation_55,danielpatrick,medwards,Development south exactly return none.,2024-01-07 14:24:45,566
Conversation_56,marysmith,annette52,Discussion lose which floor focus become.,2021-02-07 03:30:39,219
Conversation_57,rgreer,rbridges,Million camera could eight present politics.,2020-11-17 17:37:37,648
Conversation_58,shawnsweeney,allenwendy,Heart not either voice church door.,2020-09-28 06:26:41,643
Conversation_59,jmeyer,peterscott,Page sometimes sing story job.,2020-03-16 09:27:54,739
Conversation_60,melissaprice,jeffreysteele,With process offer word serve heart.,2021-02-12 16:22:53,881
Conversation_61,kevingonzalez,yoderderek,Once much buy let speak actually.,2020-03-18 10:23:48,175
Conversation_62,zscott,antoniodowns,For push expect sing term fine senior.,2020-02-09 01:31:39,566
Conversation_63,thomas96,zford,Paper beyond whether protect.,2021-01-21 12:01:49,693
Conversation_64,moralesthomas,fraziersteven,Second production establish have take.,2020-04-11 15:26:43,636
Conversation_65,longlee,beth55,First grow clear still side with.,2021-06-30 04:25:16,907
Conversation_66,medinasandra,rcarey,Worry degree believe trial source southern size.,2022-07-23 00:29:40,247
Conversation_67,strongkatherine,misty02,Seat result anything use before think else human.,2023-04-15 11:09:47,787
Conversation_68,colton70,erika53,Three build current join west road business.,2023-10-09 09:07:12,330
Conversation_69,erika26,ashleyvega,Boy writer training top pass.,2022-03-28 14:41:05,146
Conversation_70,transhelby,tammynewton,Control writer special religious citizen.,2022-02-26 03:59:15,809
Conversation_71,julia85,schmittmanuel,Public low understand nothing guy.,2020-10-22 22:12:22,769
Conversation_72,moodygilbert,watkinsbrian,Against purpose ok serious reveal themselves.,2021-03-19 18:49:40,284
Conversation_73,ortizjose,newtonnatasha,Find election stuff director treat financial sport.,2021-05-21 05:49:00,321
Conversation_74,rosewendy,garciadana,Hotel success report loss sport.,2022-02-05 12:17:16,673
Conversation_75,bwood,elliottrick,Area every present what hope section everybody.,2022-12-25 12:27:40,525
Conversation_76,mathisjessica,antoniodowns,Eye Democrat radio real that too.,2023-08-11 07:15:39,591
Conversation_77,caseyrodriguez,zmclaughlin,Especially throughout forget tree table.,2022-04-20 07:25:58,30
Conversation_78,lwilliams,kristenbarry,Threat grow loss loss book cover test improve.,2022-11-23 02:27:13,782
Conversation_79,rodriguezbrian,jeremy17,Woman husband bank agency.,2020-10-30 18:42:33,255
Conversation_80,xgilbert,danielle83,Control instead price ground program particular.,2020-02-26 22:41:29,547
Conversation_81,adam31,thomasstephanie,Address compare attack indicate.,2022-11-20 17:21:59,254
Conversation_82,markmiller,amoore,Miss democratic choose worry.,2020-04-02 19:48:06,929
Conversation_83,kcook,santiagonicholas,Piece join prevent.,2022-03-07 21:42:41,827
Conversation_84,davidhall,lee98,So include board culture clear agree bag.,2021-06-22 10:21:53,483
Conversation_85,qtanner,eileenortega,Many probably everyone wait open national family.,2021-02-10 02:46:55,230
Conversation_86,martinamanda,kelly01,Region part case know cost.,2023-08-07 19:51:11,903
Conversation_87,erikgray,victoriajames,His significant radio family important.,2022-11-02 17:02:01,856
Conversation_88,djohnson,jasmine93,Simple will citizen economy physical nothing key.,2021-05-14 07:05:08,843
Conversation_89,moranjasmine,evanhenson,Field site against office apply point act short.,2023-01-25 21:14:00,999
Conversation_90,bking,lopezandrew,Add agent himself I would catch.,2020-12-29 15:15:45,655
Conversation_91,blake74,dianaallen,Thank floor outside product likely report threat.,2022-07-03 20:28:06,243
Conversation_92,wgray,martinsamantha,Record allow television power final interview data.,2020-06-21 22:21:51,823
Conversation_93,gallegoschristie,brian10,She former write know police only order.,2022-08-23 14:14:12,7
Conversation_94,bking,vduran,Player right official she now.,2024-01-13 16:22:59,824
Conversation_95,clarkenicole,sanderspenny,Second see parent box speech woman.,2024-01-08 00:21:43,805
Conversation_96,mendezpaul,justinsmith,Plan nature serve customer business institution international once.,2020-11-04 21:24:11,613
Conversation_97,matthewmarshall,robertmiller,Edge early through Congress rock.,2022-09-18 18:29:58,301
Conversation_98,clarkchristopher,samuel48,Half experience four actually under then.,2021-07-19 13:48:57,110
Conversation_99,jacobbrown,dylancarson,Very open arm hear commercial crime.,2022-12-17 22:13:42,715
Conversation_100,garciadana,david20,Green else be rich unit new yes.,2023-03-14 07:49:00,143
Conversation_101,jason05,uwolfe,Resource medical effect better support hope.,2020-12-28 14:57:11,256
Conversation_102,alyssa74,ichavez,Bed from case structure.,2020-06-24 14:20:59,354
Conversation_103,yandrews,richard03,Form line trade body world figure.,2022-06-01 13:26:26,772
Conversation_104,scott23,anne66,Six dog join student.,2021-12-20 21:56:31,593
Conversation_105,milesemily,browncole,Form time hand need daughter executive.,2022-08-01 10:12:14,870
Conversation_106,reynoldsalex,stevensjennifer,Grow care ability.,2022-10-27 05:48:38,164
Conversation_107,benjaminadams,jeffreymejia,Some western vote talk modern coach.,2022-06-02 21:36:04,987
Conversation_108,bennettjulie,jfitzgerald,Important provide agent occur chair away man.,2023-09-15 01:07:33,364
Conversation_109,zlee,berryruth,Lay family sport red.,2023-08-15 06:21:52,140
Conversation_110,smartinez,hollowaytami,Feeling news price describe billion check month.,2021-06-02 16:21:54,254
Conversation_111,daniel19,millervicki,Experience which direction to write church financial.,2023-05-31 06:09:08,302
Conversation_112,kevingonzalez,kristinemosley,Need good until enjoy unit public key.,2024-02-05 05:36:44,593
Conversation_113,andre92,samueljackson,Want majority message son.,2022-04-17 12:08:13,200
Conversation_114,tjenkins,mccanndiana,Investment as strong line not kind.,2024-02-12 19:37:24,876
Conversation_115,greenkaren,velazquezthomas,Theory fly government figure debate southern.,2021-05-07 07:43:47,400
Conversation_116,zclarke,hernandezkatherine,Various American easy hit four note.,2022-03-02 17:54:37,757
Conversation_117,parkerkristina,smithcathy,Truth manager support by dinner.,2024-04-07 12:48:28,778
Conversation_118,zford,natasha15,Threat family manager pattern fish support center author.,2021-06-14 00:20:18,780
Conversation_119,adam73,marysimpson,Name even person something.,2020-05-04 08:52:57,913
Conversation_120,aking,angelamartinez,Ball particularly detail guy player.,2021-01-07 19:07:19,638
Conversation_121,jose77,anita34,Film but animal prevent production friend dinner.,2022-05-13 19:38:03,964
Conversation_122,schroederjoy,jasonduran,Teach general generation his in.,2024-03-31 10:31:14,954
Conversation_123,christopherpaul,lawsonanthony,Market goal left imagine white by.,2020-03-10 15:00:57,736
Conversation_124,berrygina,diazwilliam,Quality energy baby moment expect view difference.,2023-03-06 06:08:27,493
Conversation_125,tylerlee,bfoster,Prevent nice another perform nation why south either.,2022-10-07 08:02:22,746
Conversation_126,okey,michaelwhite,Answer and must.,2023-09-25 09:44:16,556
Conversation_127,rowens,brianhoover,Phone against degree year season man reduce show.,2020-07-07 22:08:34,915
Conversation_128,ronaldbrown,ann63,Trip act manage real truth.,2024-02-13 19:38:12,739
Conversation_129,antoniowaters,gyoder,Couple realize level its life.,2021-09-03 22:35:26,397
Conversation_130,uferguson,raven42,Share of stop production property cultural event idea.,2020-05-11 15:57:18,127
Conversation_131,nina08,owheeler,Nice participant need.,2023-04-24 05:59:38,212
Conversation_132,hbarker,zromero,Anything Mr style picture.,2021-01-16 04:25:53,633
Conversation_133,johnsondanielle,davismark,Force continue front soldier daughter along way.,2024-03-24 08:20:20,582
Conversation_134,sjohnson,jessicaclark,Card her heavy alone mean.,2022-01-18 02:45:47,232
Conversation_135,mark97,vferguson,Half system become unit add environment our.,2020-08-27 08:38:04,367
Conversation_136,carlwillis,marvin70,Individual treatment we central of outside.,2022-09-05 14:49:57,400
Conversation_137,adamsthomas,lowerybrandon,Could population amount more now true avoid.,2020-04-13 16:41:32,972
Conversation_138,wilsonjohn,reyesdavid,Company clear collection else letter manager.,2021-02-23 14:31:30,453
Conversation_139,okey,jane91,Item program however water.,2022-01-28 09:49:23,385
Conversation_140,williamtrevino,cgarcia,Service form day lawyer wife face next.,2021-03-22 16:30:34,83
Conversation_141,qtaylor,briannadavis,May ever market drop model participant minute.,2020-08-04 18:54:47,479
Conversation_142,charlesallen,kaylawebb,Ok create relationship show east.,2022-01-25 15:12:26,513
Conversation_143,erikazimmerman,brittany10,Authority purpose a all walk determine month author.,2021-08-30 18:09:19,982
Conversation_144,psmith,gregory69,You we knowledge.,2020-03-10 07:25:35,777
Conversation_145,ochoaallison,michael07,Ask get anything.,2022-08-15 10:52:29,627
Conversation_146,brianwright,lmartin,Or market floor conference.,2021-05-07 21:37:50,640
Conversation_147,jesse10,lauraarmstrong,Agree rule simply again claim.,2020-05-28 13:25:37,3
Conversation_148,julia85,thomastimothy,He Mr professor maybe travel.,2023-05-20 20:38:23,695
Conversation_149,dustingrant,laurahurst,Point size dream seat expect.,2022-07-08 22:25:11,821
Conversation_150,tommy58,charles98,Whatever establish plan four respond model prove happen.,2021-07-24 14:18:12,729
Conversation_151,michael09,belljasmine,Event employee ball real hear listen air.,2023-12-16 00:42:47,778
Conversation_152,brenda29,jared93,Fall necessary maintain sister.,2021-06-26 07:40:54,73
Conversation_153,amiles,sharpkyle,Indeed book enough least live benefit soldier.,2021-11-07 14:30:11,216
Conversation_154,youngallison,lesliebrooks,Democratic decade star foreign way.,2020-02-05 01:04:48,165
Conversation_155,orandall,scott13,Instead stuff our.,2022-11-05 11:53:45,78
Conversation_156,david84,lorettapena,Five save suggest.,2023-08-30 23:12:33,33
Conversation_157,jwilliams,mackenzie48,Remain enough a answer.,2020-06-23 03:21:22,862
Conversation_158,tbowman,kthomas,Social rather child budget as change fire financial.,2023-01-03 10:16:28,664
Conversation_159,hernandezamber,carly18,Government cost employee lay ahead.,2020-08-21 21:20:25,374
Conversation_160,samuelmiller,robinnash,Situation guess send reduce most laugh at.,2022-03-10 23:29:11,802
Conversation_161,gilbertbryan,frodriguez,National movie evidence leave assume course card.,2022-06-25 11:19:00,713
Conversation_162,harringtonkelly,smithmichelle,Consider stand fear around financial page be.,2021-11-29 04:33:44,94
Conversation_163,johnsonwilliam,dustin24,Book including entire month.,2020-06-08 19:29:24,281
Conversation_164,hwalker,connie05,Debate deal thought third something true past.,2023-08-05 11:40:21,671
Conversation_165,hartcharles,richardsmith,Deep smile season mention player.,2020-01-25 02:28:26,843
Conversation_166,williamsevan,rlewis,Just model could since.,2020-09-01 09:54:41,158
Conversation_167,burnettashley,obishop,Stock build them difference herself.,2022-11-03 01:01:23,286
Conversation_168,wwood,turnerkimberly,Total through mind very table.,2023-09-17 04:24:32,417
Conversation_169,donnamoreno,chandlermarc,Again third purpose game glass full.,2022-09-04 17:32:29,564
Conversation_170,riggsstephen,lyonssamantha,Rise feel tonight.,2022-01-16 23:42:03,88
Conversation_171,shannon50,ggallegos,Audience it hold financial garden turn into.,2022-06-01 04:27:26,665
Conversation_172,browndavid,christopherlee,As be crime nice and.,2022-04-09 12:00:20,60
Conversation_173,jessica30,ebennett,Old health statement experience figure.,2021-05-27 20:21:28,649
Conversation_174,christopher42,lrichardson,Everybody manager meeting no thousand sea.,2020-05-01 07:04:29,787
Conversation_175,angelastark,robertmann,Sing maintain space music half question.,2023-03-01 00:28:24,915
Conversation_176,ronaldsutton,rodney06,Choice activity according southern.,2021-03-26 10:49:25,659
Conversation_177,jonathan61,abigail00,Could personal make cold service owner computer.,2020-08-02 08:47:36,224
Conversation_178,htate,huangjonathon,Evening upon deal color run forward.,2023-06-28 09:52:31,318
Conversation_179,brianallen,yhensley,Whole situation rest arrive history by.,2021-11-17 15:18:19,743
Conversation_180,jbrooks,calhounsandra,Even how customer we newspaper usually thousand animal.,2022-10-26 10:15:15,2
Conversation_181,ssmith,xparks,Office customer difficult word money pretty can.,2022-04-01 01:03:10,513
Conversation_182,tammyhardy,jasonjohnson,Great walk result enjoy summer.,2021-04-16 13:57:36,193
Conversation_183,michelletorres,elarsen,Few experience movie true.,2024-02-29 04:35:08,252
Conversation_184,jennifercooper,muelleranthony,Prove price consider protect tell science.,2021-04-03 21:20:38,825
Conversation_185,morgan13,qmarshall,Significant choose risk it.,2021-08-04 11:09:21,15
Conversation_186,ellismonica,williamsjessica,Professor me alone treat class current.,2023-12-14 07:50:58,955
Conversation_187,amber32,tracy54,Determine any happen push officer.,2020-04-10 09:26:10,323
Conversation_188,robertgarcia,mgomez,Individual sea work with maybe make.,2023-06-18 20:15:39,179
Conversation_189,nramos,gallowaykristina,Medical building natural voice.,2021-04-21 14:02:48,356
Conversation_190,robert83,melissa09,Whose meeting way behavior.,2023-02-28 19:50:41,513
Conversation_191,dustin24,moorepatrick,Foot book add.,2020-06-24 22:07:34,683
Conversation_192,kathrynanderson,rcooper,Door single sign start natural.,2023-06-12 23:25:53,826
Conversation_193,vaughnlawrence,clarkwilliam,Type that tree sound by.,2020-05-16 15:20:38,596
Conversation_194,barnettjustin,qrobinson,Win question throughout color finally despite.,2022-05-03 00:02:23,403
Conversation_195,justin35,carolinetucker,Employee owner brother resource.,2022-06-09 22:19:41,229
Conversation_196,clewis,prestonsarah,Chair score part president base entire make.,2021-04-19 20:23:05,59
Conversation_197,vgreen,patrick57,Police natural until four item.,2023-07-07 03:12:35,183
Conversation_198,barbarasmith,jonesjoseph,Activity town southern.,2023-07-29 23:42:16,838
Conversation_199,uferguson,vandersen,Travel bill white discover.,2022-07-01 12:27:31,770
Conversation_200,reedryan,goodchristopher,Program defense help fear husband late.,2023-05-28 14:32:56,612
Conversation_201,strongkatherine,zscott,Exist beat camera knowledge beyond door.,2020-04-25 21:44:57,987
Conversation_202,richardbooth,justinscott,Player station again.,2024-01-30 09:56:58,205
Conversation_203,jeremy52,williamzimmerman,Keep strong me economy structure road food make.,2022-09-21 16:42:38,937
Conversation_204,robinspencer,amorrison,Available audience artist fall bill Republican political.,2023-09-06 14:00:14,20
Conversation_205,kingjonathan,kennedynina,Theory company author study occur argue cell place.,2020-01-04 23:17:11,436
Conversation_206,julia85,collinsricky,Yourself quite think best gun you provide.,2023-05-13 02:44:04,990
Conversation_207,leenoah,kristinacardenas,Town force state trip wife act matter true.,2022-02-26 19:58:50,382
Conversation_208,joseph24,jonesnatalie,Before evening allow trouble recent.,2023-02-28 07:48:58,73
Conversation_209,ashley95,kellyhendrix,Nor perhaps family idea.,2023-11-04 01:52:49,475
Conversation_210,hintonshane,bradyamber,Official lay knowledge.,2020-05-19 11:03:32,371
Conversation_211,ricardorodriguez,leenoah,Study explain protect today she enough.,2020-09-02 21:09:07,269
Conversation_212,brandon44,luke67,Among prove share house.,2023-03-18 02:21:59,220
Conversation_213,joshuaross,donovanmichael,Population focus life color.,2021-10-29 18:05:46,540
Conversation_214,pharris,goliver,Still teacher indeed.,2022-01-11 22:54:16,849
Conversation_215,kwillis,michelle32,Fight media physical feeling green guy.,2023-12-03 18:54:46,643
Conversation_216,jeremyyoung,rryan,Each sell star.,2022-10-23 21:51:02,603
Conversation_217,whughes,njones,Safe but rule me citizen most friend to.,2020-09-07 15:10:34,108
Conversation_218,jordanestrada,pedrohale,Leg four several.,2021-06-18 20:55:33,77
Conversation_219,lpeterson,robertfarrell,This white throw help year reduce.,2024-02-21 11:45:41,559
Conversation_220,alvarezchristopher,keith37,Those us make cause recognize bill each.,2020-05-18 17:20:09,415
Conversation_221,lawsonjessica,mcdonaldtimothy,Remember social with region different someone week.,2020-09-05 15:24:35,903
Conversation_222,matthew49,jacob02,Something man standard.,2023-05-25 22:24:09,978
Conversation_223,jdominguez,samantha08,Often car describe improve choose around.,2021-05-04 14:32:58,17
Conversation_224,clewis,xsmith,Own something recognize fill city.,2020-05-23 23:25:32,628
Conversation_225,avaughan,ubell,List conference up.,2022-08-18 16:03:14,955
Conversation_226,maryfitzgerald,brianlucero,Sort system total beautiful toward.,2023-03-25 11:31:55,497
Conversation_227,brucejohnson,medinamichael,Shake responsibility paper green wish through.,2021-01-28 21:18:48,992
Conversation_228,elizabeth39,jamessingh,Area reveal position property various defense.,2021-03-02 09:42:04,451
Conversation_229,spencerwalsh,wanda17,Carry place leg hundred civil leave alone sport.,2021-03-11 00:45:36,193
Conversation_230,robert96,wadejohnny,Sell risk allow offer easy feeling.,2020-12-18 06:53:27,893
Conversation_231,frodriguez,rebeccajenkins,Animal part major up.,2021-07-09 08:27:30,727
Conversation_232,walkershannon,alexanderjohnson,Fine cut moment star by view.,2022-03-21 21:17:41,210
Conversation_233,wilsonandrew,robert90,Thank can mind people find current.,2023-02-25 22:21:19,728
Conversation_234,bdougherty,kim02,Knowledge care his use talk relationship size.,2021-02-26 14:48:57,256
Conversation_235,anthonycortez,josephjones,Statement charge language price seek the against.,2021-06-17 20:43:12,669
Conversation_236,fredericknovak,cooperjerry,Enter their involve side though myself statement still.,2022-06-12 10:31:06,464
Conversation_237,waynelove,kellydanielle,Eight go group include.,2022-02-27 08:56:19,876
Conversation_238,sburnett,lisahart,Watch organization owner window.,2022-05-03 11:08:35,818
Conversation_239,proctorcody,phyllisromero,Couple around practice probably wife bag.,2021-05-04 20:11:27,879
Conversation_240,carlsonwhitney,anthonycortez,Daughter a truth war eye left.,2021-07-01 04:48:42,511
Conversation_241,oconway,jonathanjames,East Democrat company most tend ago other.,2024-02-28 10:49:08,572
Conversation_242,john81,davidgordon,View network class station international north your.,2022-07-04 23:49:32,339
Conversation_243,jesuscain,anthonyjohnson,Decide hair concern send six official point.,2021-04-13 05:58:28,835
Conversation_244,richardjimenez,kayla57,Certain back to writer can space explain.,2021-08-11 21:16:50,796
Conversation_245,jamesmeredith,zacharywhite,Herself task idea again.,2022-02-25 22:15:39,902
Conversation_246,hrivera,rodriguezmatthew,Picture student remain still remember.,2021-07-08 03:47:27,132
Conversation_247,taylortiffany,saustin,Glass medical citizen may.,2021-04-01 13:24:06,842
Conversation_248,brianna42,kristinacardenas,Positive off require late.,2023-10-29 23:25:13,179
Conversation_249,dmorgan,thomaspaula,Keep forward listen least green.,2024-03-20 06:35:20,792
Conversation_250,millerjennifer,anthonyjohnson,South nearly may something on help.,2022-10-31 21:01:45,980
Conversation_251,andrew87,brendaconrad,Evidence discussion goal whom cell.,2021-12-19 09:50:21,34
Conversation_252,alyssa15,gloria35,Opportunity age rest instead administration.,2021-03-01 21:52:49,613
Conversation_253,wilsonlaura,cookecharles,Expert bed large company different.,2020-07-24 21:32:39,516
Conversation_254,roberthayes,sarah24,Child bar mean food agent analysis personal.,2020-10-10 10:48:36,446
Conversation_255,james76,andrew44,Increase top win myself fact.,2021-06-13 11:11:55,85
Conversation_256,cassandrawolf,amanda32,Administration amount garden out thank local expert.,2022-12-18 18:53:02,680
Conversation_257,woodskathleen,omurray,New rather during according.,2022-10-28 00:01:43,704
Conversation_258,kevindavidson,dylan61,Environment drug ground get shake including.,2020-09-16 18:12:06,283
