ID,Member1,Member2,Conversation_name,Conversation_created,Messages_quantity
Conversation_2579,bruce90,martinezerik,Ahead matter much.,2021-04-29 18:24:11,904
Conversation_2580,rpage,gwood,Old lay listen follow.,2024-01-10 14:38:56,39
Conversation_2581,elizabeth26,ryan68,Particular wonder bad interesting we.,2021-10-23 05:55:04,633
Conversation_2582,blake08,robertarmstrong,Type traditional popular guy land happen modern.,2022-04-17 12:07:39,229
Conversation_2583,robbinsalan,sierracopeland,Defense these federal fish.,2024-04-07 21:52:26,386
Conversation_2584,vanglarry,peggy16,Later indeed watch when down agent east.,2024-02-27 13:54:55,781
Conversation_2585,chenrenee,fgonzales,Ever today practice laugh.,2022-03-21 15:51:09,187
Conversation_2586,michelemcmahon,lvaldez,Traditional popular best event company.,2023-08-17 17:09:29,561
Conversation_2587,mcdonalddavid,wsmith,Laugh study father buy view last.,2022-02-16 19:24:12,475
Conversation_2588,kjennings,courtneysanchez,Difference decide after must over baby.,2020-07-27 05:56:09,0
Conversation_2589,lawsonmichelle,rosswilliam,Age specific decision assume decision keep size.,2022-09-11 11:34:50,724
Conversation_2590,connie84,jbrooks,Attorney necessary together newspaper service else seven.,2021-12-13 00:31:16,224
Conversation_2591,vmorrison,zwalters,Million whether other the subject court interesting feel.,2024-01-06 10:48:47,532
Conversation_2592,john41,smithkaren,Bed wear western true experience statement picture.,2023-07-17 21:38:03,238
Conversation_2593,hthompson,wrightkevin,Worry election bit view bill.,2023-11-12 02:27:45,622
Conversation_2594,andrewmoses,pattondavid,Else middle nearly rise bit might.,2022-09-22 17:12:52,501
Conversation_2595,mcdonaldanne,wilsonjohn,Source world station hear change.,2021-10-13 23:54:45,815
Conversation_2596,amandamartinez,wilsoncrystal,Bill behind then.,2023-06-27 04:32:32,398
Conversation_2597,bettylong,martinezstephen,Result fight city movie.,2023-11-22 17:31:03,188
Conversation_2598,qharris,xrussell,Everything real page raise movement marriage cup.,2020-05-16 14:09:54,838
Conversation_2599,meganellison,joe73,Face result range.,2023-12-04 12:38:24,618
Conversation_2600,samantha58,tamararomero,Without name say exactly try.,2021-11-25 16:33:47,727
Conversation_2601,piercelauren,calvin01,Win possible seem project range size woman.,2023-08-27 03:41:56,811
Conversation_2602,qestrada,amberwilcox,Behavior full life half.,2020-08-15 14:05:45,744
Conversation_2603,jennifer93,yrios,World think development say.,2020-11-02 06:27:51,947
Conversation_2604,sharon07,mariarowe,Election whom form if.,2020-02-04 00:43:59,461
Conversation_2605,avilabarbara,aaron91,Window speak generation prove.,2023-04-21 12:44:40,757
Conversation_2606,jonestimothy,fhenry,Degree truth now trouble concern model.,2021-10-25 01:26:41,206
Conversation_2607,santiagonicholas,marthasnow,Meeting a learn class seat leader data.,2023-12-19 16:50:20,369
Conversation_2608,cevans,bking,Girl teacher professor certain.,2020-07-18 19:25:46,939
Conversation_2609,petersonanthony,rallison,Fund expert keep evidence develop.,2023-07-22 04:20:55,239
Conversation_2610,nnichols,carterdanielle,Exactly phone dark sign fill.,2020-05-27 22:12:41,327
Conversation_2611,logandavis,anthony20,Eye lawyer culture southern.,2020-05-14 13:23:01,863
Conversation_2612,williamstimothy,alicia16,Suddenly keep growth rather kind hair once.,2020-11-15 16:17:38,817
Conversation_2613,maliksullivan,haynesashley,Many way risk administration record true.,2023-08-21 22:06:28,820
Conversation_2614,jeremiah26,adam14,Here lay on big according network.,2020-09-04 15:08:25,230
Conversation_2615,vferrell,martin32,Pretty marriage key camera ask cell yes population.,2021-10-30 11:36:00,75
Conversation_2616,william39,zneal,Ahead information near office increase concern protect.,2020-12-05 12:31:05,405
Conversation_2617,autumnphelps,margaretholt,Next listen adult child risk.,2024-03-16 05:25:43,501
Conversation_2618,michaelbentley,elizabeth81,Minute per enter next assume probably plan become.,2021-01-31 17:33:08,605
Conversation_2619,ireed,zriley,Letter technology series consider stage.,2023-03-20 20:55:21,218
Conversation_2620,jacksonmichael,anthonyashley,Late yard theory fast.,2021-12-27 19:02:15,109
Conversation_2621,ogibbs,medinamichael,Season serve identify describe.,2020-04-22 07:42:48,201
Conversation_2622,christopherhumphrey,davidvaldez,So common improve moment power.,2021-10-18 06:22:10,837
Conversation_2623,nelsondarrell,heather37,Authority move left member vote.,2021-12-21 21:11:00,896
Conversation_2624,natasha15,taylorvictoria,Father skin remember.,2020-03-24 04:23:56,647
Conversation_2625,melinda56,lynnbeck,Deep agreement local dog even.,2021-07-13 11:56:23,307
Conversation_2626,shawnwilliams,gonzalezmatthew,Loss benefit which human accept rather meeting.,2020-10-21 03:24:37,7
Conversation_2627,bakeralexandra,alyssazavala,Will order magazine live air argue.,2020-03-21 22:55:57,618
Conversation_2628,nwilliams,catherine29,Ball idea if city management member executive seven.,2020-06-12 20:04:37,656
Conversation_2629,istevenson,ann40,Rate else artist situation.,2023-06-24 20:50:26,994
Conversation_2630,joshua13,newtonkatherine,Civil take must ready could.,2020-11-13 09:35:25,250
Conversation_2631,waltonbrett,cunninghamgary,Billion size small career enjoy seem film.,2022-05-30 14:04:56,721
Conversation_2632,yjefferson,summerschristopher,Thought own statement address writer.,2022-09-25 21:17:15,777
Conversation_2633,wmalone,fishermichelle,Sit minute beyond understand perform letter.,2022-10-22 10:31:40,696
Conversation_2634,jeffreysteele,leecatherine,Wide score describe material record special.,2022-12-18 21:29:21,231
Conversation_2635,dmcpherson,danagonzalez,Accept base mouth beyond.,2020-07-18 02:27:02,397
Conversation_2636,tylerjanice,sanchezroger,Art over show day send.,2022-04-15 14:11:24,873
Conversation_2637,jameshernandez,jserrano,Head artist technology.,2023-10-04 04:32:41,738
Conversation_2638,josephvasquez,xfitzgerald,Involve quality thus old eat sit.,2023-07-28 10:15:26,602
Conversation_2639,veronica04,martinezpeter,Report chance PM position size.,2020-03-17 13:33:26,443
Conversation_2640,crystallawrence,youngjames,Raise fine design price heavy identify few.,2020-11-04 08:11:16,481
Conversation_2641,amyscott,zmiller,Cost learn couple yes.,2021-11-25 08:37:50,982
Conversation_2642,zhays,david25,Cold special well imagine station.,2024-03-23 12:39:13,450
Conversation_2643,donna31,brownanthony,Green interest similar according future out.,2020-02-20 08:25:50,823
Conversation_2644,nataliedorsey,tammynewton,Actually training activity something huge single major.,2023-10-07 14:45:37,316
Conversation_2645,lindamercado,bcunningham,Budget quickly government support interest indeed.,2020-04-09 15:41:30,430
Conversation_2646,sarah40,mark45,On write white central thing.,2023-03-20 09:51:04,66
Conversation_2647,anthony84,allenphillips,Star bad effort.,2020-07-12 05:40:11,987
Conversation_2648,lmckay,ewilson,Medical issue summer thing act body.,2022-01-10 21:05:22,33
Conversation_2649,wjohnson,richardsalinas,Popular wide hundred.,2022-11-08 17:19:29,733
Conversation_2650,qtaylor,devindavis,Way approach suffer box alone expert.,2022-07-07 17:36:13,641
Conversation_2651,daviddavis,bondjason,Movie find prove alone official police.,2023-05-12 01:50:04,591
Conversation_2652,bfoster,lwhite,Decision structure how necessary kitchen.,2020-08-17 19:38:47,457
Conversation_2653,samanthalee,andrew68,Order network product why police pressure.,2020-06-18 04:00:32,356
Conversation_2654,ncortez,heather81,Example vote table wrong arrive fly alone.,2022-12-24 10:14:24,848
Conversation_2655,thompsonscott,ortizalicia,Reveal group he music.,2024-03-17 11:17:32,565
Conversation_2656,mcdanielstephanie,edwardsmichael,Walk guy current four.,2021-06-15 01:41:28,350
Conversation_2657,martinsantos,juangarcia,Cup without become make try accept.,2020-02-23 09:39:30,731
Conversation_2658,vharris,ashley29,Away deal traditional enjoy cup ahead.,2022-10-22 05:20:40,714
Conversation_2659,jeffreyreed,medinasandra,Table sit through here film data garden follow.,2021-02-04 23:11:27,357
Conversation_2660,cynthia24,cassandrarichardson,City about military dream sense.,2024-02-22 22:46:23,868
Conversation_2661,frederick60,rbrooks,Rule experience add discussion.,2022-05-13 14:56:02,485
Conversation_2662,cwilliams,aking,Argue add receive worry enough author thing.,2020-10-30 20:57:58,368
Conversation_2663,natalie42,bautistacharlene,Throughout especially almost work name fill beat land.,2020-09-21 15:13:38,280
Conversation_2664,michelle04,joseph56,Mind challenge report factor rich whether speech upon.,2021-11-30 05:11:45,538
Conversation_2665,brucemorris,mary03,Site thing area training whether.,2021-03-10 14:11:54,290
Conversation_2666,watsonnathan,monica77,Throughout education effect fight thus again.,2020-01-10 10:06:31,327
Conversation_2667,joseph56,dcurtis,Late table ahead prepare want young.,2024-02-22 07:16:25,211
Conversation_2668,mbrown,shelleyjackson,Pressure condition peace threat great artist her.,2020-03-20 02:35:30,657
Conversation_2669,zmclean,walterdaniel,Season focus parent ten admit situation.,2021-06-05 07:10:35,937
Conversation_2670,rodriguezelizabeth,kennethgeorge,Inside partner middle development stage response treat.,2021-02-23 00:20:50,302
Conversation_2671,christina36,andrew70,Cultural less money recently fact.,2023-11-28 11:30:14,273
Conversation_2672,luke67,jeffrey48,Politics item member even pick.,2021-09-01 20:00:25,621
Conversation_2673,michelleschmidt,psmith,Entire people eye between set act school medical.,2022-03-18 12:29:06,839
Conversation_2674,daviddavis,geraldsherman,Receive individual central including same indicate building.,2023-12-04 04:42:33,81
Conversation_2675,donald49,isaiah40,Center argue night pressure less none.,2021-08-10 16:10:27,34
Conversation_2676,charleswhite,kmartinez,Project member forward.,2022-12-20 19:34:43,359
Conversation_2677,lorraine69,kristijohnson,Perhaps large change good deep bag poor.,2023-03-22 19:15:53,966
Conversation_2678,norman81,suzannejimenez,Painting analysis reflect report reach face car.,2022-05-17 00:04:52,827
Conversation_2679,schroederalison,samuelmiller,Tend who happy happen less education.,2022-06-15 03:07:39,36
Conversation_2680,hollandmiguel,ecaldwell,Way thus gas big save these meet.,2021-04-30 05:56:28,270
Conversation_2681,joseph10,asnow,President program their participant.,2022-11-30 09:27:21,920
Conversation_2682,hunterangela,anne66,Gun throw situation heart think really past.,2020-09-15 02:52:41,187
Conversation_2683,morganjoseph,foxmichael,Author station former factor least night available.,2021-08-08 03:46:56,452
Conversation_2684,hwalker,jennifer46,Shoulder specific record newspaper use improve put.,2020-10-22 06:23:57,832
Conversation_2685,wanda17,jasonduran,Fill century able might.,2020-07-31 22:19:35,793
Conversation_2686,orrmark,mparker,Reason consumer lay lead rest official.,2022-04-19 04:02:41,919
Conversation_2687,melissa19,ofranco,Decision record him eat likely.,2023-07-29 20:16:27,247
Conversation_2688,xturner,jasonpeterson,Try box mean quite from allow off reach.,2022-04-10 23:13:12,830
Conversation_2689,josephvasquez,millerjoseph,Amount plant ok.,2023-11-28 20:51:11,690
Conversation_2690,vharris,moraleseddie,My management bag data lay Mrs chance college.,2020-12-03 16:44:31,799
Conversation_2691,hrivera,jwilliams,Simple head husband million song.,2020-01-16 11:08:27,70
Conversation_2692,casekevin,michaelcraig,Grow word across civil the about picture soon.,2023-10-14 09:35:08,571
Conversation_2693,hansenjustin,thomas08,Pick owner coach where.,2020-06-14 13:13:01,87
Conversation_2694,garciadana,jennifercolon,Gas movie themselves time test impact enough entire.,2022-10-13 13:04:38,489
Conversation_2695,staffordsamantha,opatton,Impact professor away change wind.,2020-10-23 05:45:39,938
Conversation_2696,rodney06,anthonycortez,Body popular anything.,2022-01-01 15:29:59,850
Conversation_2697,travis08,dianaphillips,Rock Mrs network particular sign hour.,2023-03-22 01:26:05,897
Conversation_2698,janetlozano,schultzrobert,Speak store situation say social positive discover.,2022-02-08 03:22:14,924
Conversation_2699,cgordon,vrose,Purpose find property body occur picture pretty military.,2021-07-25 06:38:57,789
Conversation_2700,kroberts,lewislaura,Should thought dinner tell agreement area gas.,2021-04-04 06:48:41,502
Conversation_2701,stevensongina,lgonzalez,Begin us report many pass research return.,2023-09-01 22:02:00,240
Conversation_2702,joeharper,michael63,Place none teacher seek billion.,2023-12-29 19:24:44,384
Conversation_2703,donaldhuerta,dallen,House town cultural example read move away.,2023-10-19 15:27:17,874
Conversation_2704,nicholas90,mark87,Such piece five product write.,2023-03-09 05:00:52,942
Conversation_2705,christine36,meganreynolds,Window discussion individual pull else live.,2023-10-14 23:49:45,725
Conversation_2706,sydney47,joshua91,Defense structure good kind consider my always.,2022-07-26 20:54:51,233
Conversation_2707,erika62,morganjeffery,City reflect education girl parent time.,2020-06-14 05:36:00,874
Conversation_2708,kroberts,fmacdonald,Model animal evening indeed capital.,2020-05-03 15:18:15,209
Conversation_2709,jford,ryanmatthews,Audience thousand can attorney quickly on.,2022-08-07 01:08:48,413
Conversation_2710,vargasbrandon,john50,Strategy against put blood about our.,2021-11-05 07:52:29,731
Conversation_2711,alvaradokayla,mark54,Site person product lead hard.,2020-07-26 00:56:51,896
Conversation_2712,pricebetty,xwilliams,High manage world learn prove area discussion.,2021-10-20 14:54:12,141
Conversation_2713,williamsmatthew,crystalholt,Adult different hundred century example agent need.,2022-05-16 11:16:31,420
Conversation_2714,chenrenee,donovanmichael,Behavior performance remain consider exist trade.,2023-11-08 15:28:09,308
Conversation_2715,ryan68,jeffreybrown,Unit reveal buy sport remember design.,2023-12-03 00:06:02,939
Conversation_2716,owensrebecca,meganmalone,Event wait establish father throughout half.,2021-05-09 10:38:30,844
Conversation_2717,heather23,andrewwhite,Soldier kitchen cut outside.,2022-12-03 03:53:11,692
Conversation_2718,joshua91,qgiles,Program third six.,2024-01-23 19:00:33,881
Conversation_2719,emilythomas,poncealfred,Article human account and yet.,2022-08-02 21:38:38,308
Conversation_2720,tinahaynes,michaelmills,Join suddenly fight law mean.,2020-04-21 00:45:27,822
Conversation_2721,thomaspatrick,catherinehood,This physical drive apply phone scientist.,2024-01-06 15:50:49,115
Conversation_2722,tdavis,brandi62,Group travel catch wall.,2022-07-14 10:31:31,145
Conversation_2723,richbrianna,jameslee,Either give animal talk.,2022-10-17 10:39:06,814
Conversation_2724,patrick86,tylerjanice,White guess against involve discussion read.,2023-03-27 11:32:33,622
Conversation_2725,webbsean,rothmelinda,Collection control hold lose recent only.,2020-01-02 04:47:55,904
Conversation_2726,alicia19,dortiz,Cup perhaps friend traditional because clear particular.,2022-05-12 06:03:14,714
Conversation_2727,dana44,nprice,Car choice her them.,2021-02-06 14:28:56,475
Conversation_2728,daviskimberly,lindsayday,Report big dog.,2022-06-01 20:20:01,36
Conversation_2729,james66,tward,Become trouble artist that or only.,2022-10-21 09:04:03,795
Conversation_2730,piercewilliam,annamiller,Campaign first western experience.,2022-12-04 10:42:28,697
Conversation_2731,bradley92,amy14,Theory heavy person too certain market prove.,2022-02-02 12:19:46,584
Conversation_2732,jacksonscott,carterkyle,Practice line political toward.,2022-10-04 23:00:52,832
Conversation_2733,leslie29,karen01,Without keep wife respond.,2020-06-20 05:49:27,689
Conversation_2734,joseph72,serranochristine,Police fear its include only hour possible pressure.,2024-01-12 08:37:50,857
Conversation_2735,jasmine31,imccall,Player civil clearly.,2021-12-09 19:03:43,964
Conversation_2736,hrios,andrew44,Hold few change doctor.,2022-06-13 12:49:01,789
Conversation_2737,iwillis,sharonclark,Interview fall wrong director summer.,2021-01-28 05:40:23,920
Conversation_2738,lonniemorrison,kwright,Four number animal talk live open true.,2023-01-20 19:38:18,801
Conversation_2739,jamesmcintosh,fischerbenjamin,Few cause drop well single clear.,2021-05-07 10:38:10,331
Conversation_2740,william39,elliottrick,Way system interview continue step thing.,2020-05-09 20:41:14,874
Conversation_2741,shellybernard,brianrobinson,Total time ten between.,2021-11-17 03:21:22,999
Conversation_2742,adamsjoseph,jserrano,Accept American political management task debate.,2021-02-06 04:46:39,655
Conversation_2743,monique58,joseph58,Message when sea those trip choose safe.,2022-01-15 09:50:36,902
Conversation_2744,jennifer81,johnsonlarry,Material way face do seek ahead perform.,2020-08-04 08:09:24,440
Conversation_2745,andrewhaley,michaelgutierrez,Leader no happen science huge their.,2023-09-19 13:09:30,206
Conversation_2746,greenjoshua,mary17,Everything must management word.,2020-05-21 16:38:51,487
Conversation_2747,kennedynina,ericbruce,Much air dream medical involve end.,2023-11-21 11:35:02,714
Conversation_2748,ellispatrick,douglasralph,Seem measure change theory.,2022-10-05 00:51:06,34
Conversation_2749,ashley29,johnny79,Recent toward room husband bill.,2020-08-01 21:53:09,490
Conversation_2750,lowerymichael,smithmichael,The feel prepare behind available evening offer.,2021-07-22 00:36:50,629
Conversation_2751,lopezbrett,hcarney,Thing whether international help.,2021-07-05 13:40:18,403
Conversation_2752,bcruz,welchrhonda,Catch teach factor compare.,2020-06-07 03:32:10,829
Conversation_2753,preyes,qsimpson,Box authority describe respond effort recently prove.,2021-08-23 04:34:34,362
Conversation_2754,dburton,amberryan,Fact serve instead yard.,2021-06-12 08:55:20,727
Conversation_2755,ramirezkatherine,jessica16,Ahead time dream alone would important.,2022-07-14 16:25:13,436
Conversation_2756,wayne30,alicia59,Source debate article actually.,2020-08-26 02:38:54,271
Conversation_2757,smithmichelle,hannah13,Interesting military yes effect learn.,2020-07-22 01:25:26,397
Conversation_2758,jacksonmichael,angela32,Everybody land war gun sometimes provide long.,2023-08-30 23:30:35,606
Conversation_2759,shannon42,jacobbrown,Themselves now old prevent use student church.,2024-03-06 19:21:22,756
Conversation_2760,chambersjay,robertturner,Choose organization dinner.,2022-03-28 02:26:24,577
Conversation_2761,sandrasmith,jesuscain,Important rather heart central.,2023-01-24 19:12:21,617
Conversation_2762,xrose,melissaprice,International born economic success painting during where.,2022-09-24 14:51:43,741
Conversation_2763,omarjoseph,veronicahicks,Effect hospital arrive set.,2023-10-14 08:16:06,257
Conversation_2764,qoliver,james74,Article life effect language head.,2020-09-28 10:19:13,347
Conversation_2765,oowens,jamesmeredith,Official or street art.,2020-03-06 15:12:59,528
Conversation_2766,qyoung,dylan85,Huge memory conference feeling above plant general.,2024-02-19 00:51:03,432
Conversation_2767,qmartinez,yanderson,Statement successful she evening need allow also option.,2022-11-27 20:43:40,107
Conversation_2768,alexander94,margaret93,Stage space thus day fight.,2023-10-05 06:44:01,452
Conversation_2769,edouglas,kennedydavid,Law miss fine minute room speak cultural theory.,2021-11-12 23:10:39,714
Conversation_2770,barajasbriana,lisalopez,Agreement arrive court apply central during.,2021-08-31 17:48:58,512
Conversation_2771,nsmith,xmclaughlin,Serious individual dinner type somebody live create.,2022-07-29 07:03:20,78
Conversation_2772,kyleburns,john81,Identify seven not lot quality.,2024-04-06 11:46:14,719
Conversation_2773,paigewatkins,ricecarolyn,Rate ability if so everybody growth enjoy.,2020-06-26 15:06:22,605
Conversation_2774,tmcclure,nicolerobinson,Her computer memory painting team.,2021-07-03 12:04:18,776
Conversation_2775,kelly49,ashley27,Risk instead wife either who.,2023-09-16 06:10:57,364
Conversation_2776,kellyrollins,hubergregory,Draw guy first speak responsibility management along however.,2023-12-13 11:08:37,501
Conversation_2777,josephingram,shieldsdonna,Prove member three whom economy series top.,2021-02-02 03:58:15,717
Conversation_2778,rodriguezjessica,kelly30,Fly name front use.,2023-02-10 17:32:49,704
Conversation_2779,shannon42,swalsh,Protect eight financial week film.,2020-11-13 06:37:44,318
Conversation_2780,kim51,scottbolton,Edge physical of.,2023-05-29 23:09:36,11
Conversation_2781,paula41,victoria26,Offer nice other executive hold change.,2020-11-19 06:49:44,798
Conversation_2782,justinlopez,dianehamilton,Worry responsibility bring body.,2022-06-07 09:41:04,210
Conversation_2783,maryjohnson,randrews,Fear thousand ask information writer.,2020-11-05 23:21:57,639
Conversation_2784,hbailey,qmata,Water address specific sense son individual start.,2024-02-06 19:15:01,558
Conversation_2785,stacyjones,melissa23,Result white should effect decide explain.,2020-10-10 03:13:22,661
Conversation_2786,madelinelee,amandarice,Us late mouth democratic opportunity record candidate.,2023-07-29 13:57:46,127
Conversation_2787,timothy78,denisemcdaniel,Brother oil view identify.,2022-07-22 21:26:50,320
Conversation_2788,schmidtkimberly,michelle16,Church already strong time traditional happy training time.,2022-06-04 07:13:42,218
Conversation_2789,justinnelson,brianallen,Size view sister statement attack.,2023-11-13 08:04:14,326
Conversation_2790,aoneal,ianderson,Model ability each also resource arm cause collection.,2020-05-17 13:29:38,310
Conversation_2791,dunnangela,eatoncharles,Certain hear about white money improve.,2023-07-08 02:28:04,306
Conversation_2792,amyjohnson,rodriguezcharles,Herself risk dream occur indeed prove.,2022-10-22 03:21:40,309
Conversation_2793,lfrancis,erin00,Improve debate so situation concern too other.,2023-01-31 11:16:20,224
Conversation_2794,anthony93,robertburns,Everything practice nor someone.,2023-03-24 01:31:49,187
Conversation_2795,ryan27,jmiller,Foreign material time remember.,2022-04-03 17:25:06,634
Conversation_2796,gonzalezmatthew,rebecca70,Civil control issue body model state.,2020-12-15 02:04:50,881
Conversation_2797,brandi06,melissawoods,Bank exist social least rise rather like.,2020-12-11 09:55:43,36
Conversation_2798,monicadoyle,amanda65,When resource painting Mr have single race.,2020-09-26 14:14:23,891
Conversation_2799,shawn29,alyssa74,Truth let itself six.,2022-05-25 16:45:11,114
Conversation_2800,dudleyshannon,dclark,Short spring off remember feel step hotel.,2022-02-24 20:12:33,862
Conversation_2801,frussell,edgar80,Region born actually program within need doctor start.,2020-09-02 11:39:19,161
Conversation_2802,erik80,fjoseph,Agreement rule space health without.,2023-08-26 22:28:15,845
Conversation_2803,cookelizabeth,garygreen,Avoid case business finish.,2023-07-10 07:04:53,141
Conversation_2804,lshepherd,mcgeenicole,Car should manager ahead.,2022-05-07 06:58:55,196
Conversation_2805,gilbertkrystal,cookjoel,Game dog simply raise leave especially very approach.,2022-03-02 05:22:40,675
Conversation_2806,thomaspaula,wayne30,Teach especially pass exactly learn low they.,2021-07-28 18:34:47,379
Conversation_2807,sdixon,lmitchell,Why note five gas.,2024-01-30 21:33:59,322
Conversation_2808,patricia06,adamedwards,Throughout strategy movement any.,2022-12-02 16:45:08,515
Conversation_2809,vargasjessica,graycraig,Build myself method important.,2023-06-15 14:25:36,190
Conversation_2810,zwhite,ricardorodriguez,Police open nice do.,2023-04-01 10:51:41,570
Conversation_2811,lawsonmichelle,gonzalezbarbara,School near material per air natural reach.,2020-01-22 19:40:02,597
Conversation_2812,millercaitlin,mcleanmichele,Beat wind war letter.,2022-11-28 21:10:39,821
Conversation_2813,danlewis,carolineadkins,Attention up general.,2021-01-09 02:54:55,162
Conversation_2814,smithzachary,brightmiranda,Artist myself dinner hit or rather federal.,2023-04-04 20:00:24,776
Conversation_2815,nicoleguzman,kimberly44,Almost alone source also southern.,2021-04-09 15:30:26,751
Conversation_2816,hschmidt,lucasdaniel,Green wait imagine choose us education may.,2022-09-18 09:49:47,353
Conversation_2817,aking,colonjennifer,Begin Republican least himself we two fund glass.,2022-12-12 06:45:03,650
Conversation_2818,daniel35,carla60,Maintain modern lot its table time voice.,2021-01-01 10:38:06,787
Conversation_2819,gonzalezmaria,garymiller,Wide inside appear politics.,2022-12-12 12:49:08,251
Conversation_2820,robert94,molly05,Name control commercial vote nice scientist yes man.,2022-01-29 09:01:35,535
Conversation_2821,ssmith,kevin62,Letter cut financial foreign.,2020-10-09 12:40:42,855
Conversation_2822,andrew68,philip41,Poor get try would listen carry.,2023-01-14 07:00:24,65
Conversation_2823,teresa41,antoniowaters,Choose detail director white.,2022-07-06 08:52:36,694
Conversation_2824,jamesmcintosh,gonzaleszachary,For specific bed what.,2022-02-16 08:39:32,678
Conversation_2825,rwalters,teresaking,Its become image meet material allow.,2023-04-14 09:14:16,714
Conversation_2826,jmeyer,briandeleon,Employee work truth.,2020-07-26 16:10:15,435
Conversation_2827,thompsonstephanie,hthomas,Strategy employee indicate produce itself.,2021-09-16 08:04:56,107
Conversation_2828,amber81,morenobrandi,Choose factor range near beyond degree actually.,2022-12-01 03:12:07,559
Conversation_2829,paul84,denise67,Operation late population year.,2021-01-08 12:21:09,793
Conversation_2830,melindadunlap,tiffany40,Power idea woman paper mouth resource.,2020-09-19 20:59:21,185
Conversation_2831,vyang,meyerdarius,Place best help us.,2022-09-02 17:17:43,130
Conversation_2832,brandonpadilla,jasonrobinson,Wide technology situation produce training.,2020-12-30 03:51:28,660
Conversation_2833,angelanelson,thomas26,Three really financial network fire opportunity even.,2023-02-21 09:29:46,345
