Username,Hobby,Date_liked,Interest,Comment
User_971,Hobby_8,2020-04-22 14:27:04,2,"Sea human effect pull ask use. Relate chair again piece.
Receive street marriage. Stay former political similar bill.
Teacher policy later follow mission out. Present should Mr ten car."
User_972,Hobby_3,2022-10-21 10:37:41,5,"Dinner must where recognize travel home its. Foot party get continue million road.
Difficult top citizen four war general. Law also pass compare factor general. Five bar like stand."
User_973,Hobby_4,2021-10-09 21:36:10,7,"Decide cost near your bank go above. Idea ever draw meeting agency.
Forget true himself base. Themselves maybe Mrs suffer.
Less blood stop. On benefit author pretty."
User_974,Hobby_1,2023-06-30 10:48:44,3,"Yard wear Democrat image. Time wear office get.
Scientist reason player happen. If nature training media serve quite film. Attorney authority appear money throughout."
User_975,Hobby_1,2022-01-24 01:30:49,6,"Himself box hear activity. Stop describe walk treatment it ago. Down law take dream million state.
Enter sort save. Parent especially move rate sister nation open such."
User_976,Hobby_6,2021-01-26 05:01:09,3,Month do mention draw player hospital. Box stage center above college maintain. Thousand green ability.
User_977,Hobby_8,2020-11-06 01:06:45,2,"Lawyer read his us long knowledge teach. Also building successful popular provide do. Food test station father.
Fill story stock avoid table. Build result role name."
User_978,Hobby_9,2021-01-01 06:15:26,7,"Road without state stuff all. Mother question then statement.
Natural entire foot indicate. Bill red cause unit. Soon style finish staff."
User_979,Hobby_4,2023-11-27 06:02:53,7,"Friend sport difference response than month build rock. Usually different floor lay.
Sort talk control sure enter answer discuss ago."
User_980,Hobby_1,2023-02-03 03:06:31,2,"Task science report walk. Develop point today break lay war day.
Team short science me section. Tree become agree garden. The cause western effort food audience girl always."
User_981,Hobby_5,2020-02-07 10:25:28,2,Window give technology material officer day step. Already run man. Paper career catch soldier window reality.
User_982,Hobby_7,2021-08-23 07:00:06,8,"Pull how serious fly memory such not. Piece know news anything.
Among director less nothing. Upon director trial culture industry effect."
User_983,Hobby_6,2023-04-10 17:15:48,8,National relationship serve might. Knowledge order all spend production despite until. Between some few ahead particular nor.
User_984,Hobby_0,2024-02-04 03:24:58,8,"Pull medical capital leave government. Economy Republican beat require parent success bring.
Whose song floor sort street we. Budget detail accept who site power hundred."
User_985,Hobby_7,2022-03-06 18:23:12,5,"Else everybody size mother which democratic. Along marriage drive after.
Race itself buy girl. Address computer red however answer concern hold population."
User_986,Hobby_2,2021-09-18 03:36:23,8,"His history data. Care detail them prove eight. A recently nice two front author smile.
Religious style player tough may budget energy.
Truth between law ever no rather. Phone although technology."
User_987,Hobby_7,2021-08-26 10:04:06,4,Vote place beyond eight leave huge. International window civil nothing make difference. Company page spend listen for anything.
User_988,Hobby_8,2022-08-20 12:25:07,7,Car image point story military nearly. Prepare position remain he firm face season whatever. Because dinner in bar around above.
User_989,Hobby_6,2023-09-12 04:38:37,2,"Area experience minute assume piece story moment foreign. Probably several relate. Responsibility development very.
Research goal hot trade over meet. Than exactly serve."
User_990,Hobby_1,2022-08-07 12:12:33,3,"Increase task sure apply again keep move. Animal already structure attorney inside. Know fine another ask process admit ask.
These relate pattern take. Senior son action form look idea green."
User_991,Hobby_2,2021-01-05 14:56:04,6,"Whether oil us. Could around system fear per court message east. Rock recently garden attention near girl.
Reduce read edge. Message seven ahead toward check hold."
User_992,Hobby_3,2022-01-13 16:31:11,4,"Executive piece grow become hard. Believe cut peace board. Remain without whole group them drop section.
Back plan seat common nothing unit. Later professional born gun enter center if."
User_993,Hobby_8,2021-02-02 16:48:46,7,"Condition rise risk cup market reduce customer. Discuss sign important same.
Yes Mr film. Total raise natural card."
User_994,Hobby_0,2021-12-14 16:01:35,10,"Read wife crime. Audience shoulder remember game oil significant. Contain another first charge class name arm.
Able man leader see. History here term risk ground require."
User_995,Hobby_8,2022-02-10 18:41:07,10,"Measure cut event already follow today mean.
Enjoy board wind someone growth. Soon would instead debate conference. Cause article guess and remember exactly since medical."
User_996,Hobby_5,2022-10-13 03:18:02,8,Instead space perform garden. Before whether morning fire.
User_997,Hobby_2,2023-05-20 02:55:46,1,"Dog present meeting lot. Family such east. Move business state maybe house crime on.
Mr since piece consider stuff. Director happen class radio call. Technology different reveal trial."
User_998,Hobby_1,2023-06-25 20:59:31,7,"Out paper song movie.
Body health city care commercial lose. Police together no remain information resource. Necessary serve agent talk what rock."
User_999,Hobby_0,2024-02-22 21:33:11,10,"Save wrong trade prevent at nearly local. Your help admit them reflect Republican organization must.
You age despite black suddenly these. Leave she radio method feeling fact price."
User_1000,Hobby_9,2020-11-23 05:55:50,3,"Fish successful bank talk. Development receive they consider much necessary.
Speak note item offer. Such begin enough rise senior town. Information be during son music start."
User_1001,Hobby_2,2021-09-30 03:37:35,2,"Record ever suggest base argue. Establish place pay he leader range check city.
Single deal matter answer reality mean although want. Visit to may believe certain."
User_1002,Hobby_6,2020-09-30 19:06:43,5,"Work positive movement consumer myself. Commercial pay fill low feeling thing.
Concern give example between reduce. They pattern audience determine too."
User_1003,Hobby_6,2024-03-05 13:23:21,1,"Anything those much long local.
Two front myself when do kid.
Road language fill decision. Care wall mother appear several little leg. Baby catch middle much protect during into."
User_1004,Hobby_4,2023-08-24 14:05:11,4,"Measure sometimes camera recent. Dinner help summer. Skin site address.
Quickly during under science work hope natural. Population brother film notice."
User_1005,Hobby_8,2021-07-09 13:32:05,10,"Instead person knowledge foot media even. Street figure security purpose exactly news floor defense.
Meeting likely important live mean scene."
User_1006,Hobby_0,2023-04-09 14:26:53,8,"You thing finally kitchen. Amount environment determine base sign drug second.
Single west however newspaper. Prove high probably. Various perhaps body their."
User_1007,Hobby_0,2022-12-03 07:08:17,7,Image plant create Mr create agency southern. Firm keep necessary major language impact attorney. Son part analysis general machine real.
User_1008,Hobby_6,2023-04-01 05:40:34,4,"Tend night company gas economy. State worry although use.
Reduce message paper. Piece arm great field.
Summer increase energy first federal state. Nearly want rise education.
Recent high it and."
User_1009,Hobby_2,2020-05-26 22:12:10,10,Guess middle seek behavior total music. Include live executive instead rest heavy ask. Appear finally oil determine. Toward culture own hotel.
User_1010,Hobby_1,2021-01-16 11:37:26,7,"Tree economy seat speak. Less life nor out although appear part under. Above anyone government already left past.
Avoid break between quite own sense."
User_1011,Hobby_9,2020-05-18 01:38:48,1,"Somebody hit standard realize easy. Accept floor whose since save whom. Energy money thousand eight either first type.
Clearly data job stay. Student play shoulder."
User_1012,Hobby_3,2021-12-09 20:40:25,8,"Situation thank line figure realize above.
Onto others beautiful may charge term game power."
User_1013,Hobby_2,2024-03-02 08:37:03,10,"Meet kind fine wear radio nation write glass. Everybody else than. One have admit open different do.
Woman investment same fly no father computer the."
User_1014,Hobby_4,2023-11-06 02:42:23,8,Result law help main range significant each. Somebody worker return way officer final expect different.
User_1015,Hobby_2,2023-09-24 05:05:25,8,"Doctor summer think really. Fire system thought candidate nearly also these.
Throw along back TV under laugh. Southern power four sit someone."
User_1016,Hobby_2,2022-08-06 21:49:07,5,"Learn project it by sport political seven. Fear result many approach and college.
Decade sign face executive market mouth class. Pm physical almost culture."
User_1017,Hobby_5,2022-10-05 01:41:31,4,"Smile system include almost attack that ready. Card two nice type newspaper sea. Media never artist record huge.
Order call future recognize. The tell parent authority cup no."
User_1018,Hobby_2,2021-12-26 11:06:18,7,"Company learn authority west situation pull natural operation. Carry maybe very.
Threat change way the dinner difference perhaps. Others tonight term."
User_1019,Hobby_6,2023-11-29 15:01:09,2,"System anything cup environment situation. Seven sense just picture writer final.
Dark much wide tonight.
Increase church experience guess south."
User_1020,Hobby_8,2022-10-03 19:24:54,1,Trip course reality thus man customer bad. Machine health thousand force sister up. Knowledge product give pretty poor.
User_1021,Hobby_9,2022-08-04 00:17:01,3,"Top fast start provide activity start friend. Early like pattern these tree. Alone who choose pressure.
Theory she money three. Character others base. Movie sit away worker campaign."
User_1022,Hobby_3,2023-03-04 05:05:56,3,Especially participant should thought deep. Item opportunity soldier what old determine.
User_1023,Hobby_5,2024-03-01 01:01:15,10,"Agreement to citizen over positive method common. Exactly wonder hold.
Culture size management science nice. Know argue political customer."
User_1024,Hobby_4,2022-11-12 00:10:41,9,"Situation soon then good. Long teach close wide.
Pick her analysis. Study entire soldier attention cup. Beyond bag news forget guy. Likely wait Republican turn simple."
User_1025,Hobby_5,2021-03-23 10:51:33,6,Anything effect form value common phone stage. Front small establish.
User_1026,Hobby_0,2020-12-14 03:04:51,2,Former team choice clear score. Within finish design figure. According structure institution room bad none method let.
User_1027,Hobby_6,2020-10-31 18:07:26,9,Best note start imagine. Since guess with deal election apply. Hit paper house theory long road technology.
User_1028,Hobby_9,2022-02-06 19:01:42,1,Budget reach some issue reduce him analysis. Else behind movement result kid better marriage training. Certain part benefit thus mind kid claim.
User_1029,Hobby_2,2022-05-21 17:27:05,6,Present certainly total easy. Any north whom represent your ten why. Class eat learn bit interest American.
User_1030,Hobby_7,2023-10-06 06:03:20,6,"Trade west member candidate phone.
Drop movement over expect lose. Lot boy exactly describe seat force lose. Wrong close prevent town."
User_1031,Hobby_2,2020-09-28 12:52:56,9,Left fly pattern wind statement what. Board medical nothing example audience. Live modern become stop environmental.
User_1032,Hobby_1,2023-12-18 17:45:05,3,"Clear establish force too. Each mouth street far fund maybe.
Education particularly environmental detail. Occur structure key turn where.
Way seat sea structure front American."
User_1033,Hobby_0,2021-01-26 11:53:21,8,"You paper rest surface artist many without chance. Find research machine member key artist risk.
Take girl tax although. Today common box movie Democrat."
User_1034,Hobby_8,2024-02-03 00:48:15,4,Year college you cell. Recognize each gas book debate left simply. Address finally scientist watch.
User_1035,Hobby_4,2020-10-29 06:47:59,2,"Good window learn option. Fast agreement ten move discover gas. Rather they tend investment wrong. Through argue level player.
During make write property. Personal set woman require special high."
User_1036,Hobby_8,2023-09-01 23:50:41,3,Individual audience century especially difficult green. Sort street some believe high watch building.
User_1037,Hobby_3,2021-04-22 10:23:49,5,Doctor authority here billion none. Able protect explain cultural. Family road do dark already wear tax.
User_1038,Hobby_6,2022-08-25 18:38:33,10,Role none throughout everybody last stand. Suddenly owner story whose throughout available. Relate figure across turn.
User_1039,Hobby_0,2020-09-03 13:13:47,2,"Catch program building least Mrs join. Court explain you environmental again next. Organization write environment history.
Skin mission itself. Term skill simple whether example public position."
User_1040,Hobby_7,2022-04-20 02:53:26,8,History career hot pull bag probably. Reason at soon tell money among. Somebody eye bill yeah medical.
User_1041,Hobby_2,2022-03-01 10:59:59,9,Reality other various writer important. Culture gas daughter arrive artist rule grow. Few rise loss born position two. Material in account their training.
User_1042,Hobby_3,2020-02-04 21:51:26,9,"Carry consumer month charge security difficult section.
Various next charge."
User_1043,Hobby_7,2022-07-31 14:23:09,8,"Organization same once marriage.
Court kind hard catch. Others perhaps pattern. Day risk simply second let establish. Role camera majority pretty factor."
User_1044,Hobby_5,2021-05-14 09:11:27,2,"Much grow want hand two. Evidence stand piece into owner. Final future land anyone strong relate.
Win four discussion alone owner structure. To partner order whose performance our business exactly."
User_1045,Hobby_4,2021-02-03 18:55:03,10,"Run cover lawyer discussion anyone process. Which century learn better media some send challenge.
Kind should yeah stop TV since service. Name car away return anything."
User_1046,Hobby_0,2023-06-27 09:20:13,9,"Big authority religious establish. But often share tough.
Apply visit political yard table condition deal. Stage travel much behind brother nation whatever. Word physical some be."
User_1047,Hobby_0,2024-03-05 10:36:05,9,Story save film. Perform throughout leg study heavy build style none. So large professor quite yes return base.
User_1048,Hobby_1,2021-05-13 06:00:09,6,"Which head simple research rate system again. Sport behind price tax box.
Watch pull few house his. Character some son hot skin instead important. Pattern several increase."
User_1049,Hobby_9,2021-05-16 21:09:56,10,"Popular rock majority speak three by successful. Would red involve resource news risk stand.
East room affect. Five hotel old find those. Employee method wall blood concern society care."
User_1050,Hobby_5,2020-08-30 19:17:03,4,"Condition relate campaign free ball suffer reduce. Need would anyone fish increase. Fund design up.
Myself animal ten protect dark really. White vote suggest north language leg."
User_1051,Hobby_4,2022-01-30 17:05:30,4,"Sound arm since within story let. Health ten we avoid gas note. Others upon raise lot direction turn.
Organization attack why current."
User_1052,Hobby_7,2022-04-20 12:47:37,4,Top stock authority alone general face partner. Show around water their natural. Government open experience half quite as.
User_1053,Hobby_9,2023-04-29 15:29:32,3,"Set his group through eye family. Few site expert stand notice few. Wind direction fill set claim health finally.
Other country eight social gas record four hotel."
User_1054,Hobby_1,2021-10-01 00:45:21,7,Build factor smile citizen teacher appear politics. Outside star grow program south. Foot participant group field quality.
User_1055,Hobby_6,2024-02-02 11:43:06,9,"Mission college safe television picture herself per authority. Record group end group.
Main scientist side happy. Can investment century nothing various theory boy move."
User_1056,Hobby_1,2020-04-14 17:35:38,5,"Always friend sort event difference treatment tough. Now moment rock represent year amount yet. Might college affect billion.
Institution federal street evidence. Public medical home purpose sport."
User_1057,Hobby_1,2021-12-28 06:22:20,6,"Type employee real station. Happen fish month matter adult machine. Senior again center.
Page edge or concern establish suffer. Hope show investment suffer his record reach."
User_1058,Hobby_7,2021-10-26 15:47:51,2,"Late small local race actually with film sport. Task east safe on five health.
Tonight today politics alone try. Rather window while week near."
User_1059,Hobby_2,2020-10-22 13:41:30,2,"Phone policy ten my evidence nothing. Question rich future mother boy.
Administration owner industry life. Person environment one community economy hospital. What only century source."
User_1060,Hobby_3,2021-05-23 03:27:01,4,"Cup government upon true store image. Home officer couple money. Item mention health.
Official small away. Send town everyone score unit name cold."
User_1061,Hobby_7,2020-10-18 11:28:14,5,"Operation live discover full sense site. Easy structure measure strong goal partner ground during. Onto single behavior.
Life work and water oil analysis."
User_1062,Hobby_7,2024-01-24 22:55:46,10,"Produce public never into look add.
Section character decision. Action join grow reveal interest such TV yard."
User_1063,Hobby_3,2020-05-03 21:56:21,5,"Our develop sister expect staff. Service him tax meeting artist example.
Store fire take into us form ago. Leg source trouble discuss more control."
User_1064,Hobby_2,2021-07-31 11:42:06,3,Behavior clearly cup billion send best. Wear medical network serious growth where edge.
User_1065,Hobby_3,2023-02-03 18:29:12,7,"Production might expect agree guess. Once model mother market middle present.
Economic environmental cause lay strong measure no. Draw during sometimes."
User_1066,Hobby_5,2023-05-11 13:32:57,6,"Water drug chair debate effort skin. Know than movie cold. Reach boy traditional.
Just impact article may physical. Start seat middle step wife program positive have."
User_1067,Hobby_5,2023-07-20 17:27:13,2,"Fly partner stop data. Moment prepare according.
Family late decade foreign. None though production usually."
User_1068,Hobby_5,2021-03-24 15:43:22,2,"Heavy if event history. Arm include someone instead. Likely defense can exist.
Land central hit.
Forget candidate college sound upon. Animal the fact keep several."
User_1069,Hobby_1,2023-06-11 21:56:58,6,"Coach everyone movie method then direction time. Certainly situation look term room hit life.
Quite majority none rich realize main pretty. Environmental base common course age lawyer structure."
User_1070,Hobby_2,2020-05-23 11:37:07,3,"Story impact high food letter in together.
Relationship be especially sing. Often action religious recent history inside stop."
User_1071,Hobby_7,2021-07-29 19:41:26,5,"Baby home nice door sing fast quickly. Black which today.
Threat draw hour happen decision pretty yourself. Happy then I just. Fast central here box subject note."
User_1072,Hobby_6,2021-06-20 06:23:27,5,However approach generation. Analysis above after school they. Gun star simple maybe tend war.
User_1073,Hobby_4,2022-09-20 06:05:10,9,Which usually allow threat specific event yourself. Value board able industry foreign resource expect. Machine special left particularly. Reflect attention responsibility believe eat.
User_1074,Hobby_1,2022-06-07 17:15:37,4,Drug pass assume movement never apply. Pressure specific their Mr space. Long hold test mission with. Special class dream.
User_1075,Hobby_4,2023-08-10 00:27:00,5,"Air series seat against.
Call home drop military fire blood.
Authority score evening toward story expert third. Including health might."
User_1076,Hobby_4,2020-02-01 15:27:06,2,"Great ahead idea eat development focus future test. Hear together write civil.
Population form into view. Professional food like bank source social fear."
User_1077,Hobby_2,2022-07-15 06:17:06,8,"Subject south half machine.
Industry check former conference someone sea. Bit soldier occur number both thing.
Hand stay car give night. Provide pressure building oil sell occur both."
User_1078,Hobby_2,2020-02-29 03:42:52,2,"Civil politics gun letter tonight market win. Minute whether million young.
Road few continue occur type sport. Old team animal find own put never sign. Go painting five fine memory series."
User_1079,Hobby_7,2021-10-30 19:05:18,5,"Recognize edge throw city hand current sense. Early gun from couple. Benefit certain customer director page think decide front.
Energy although particular same."
User_1080,Hobby_1,2022-06-03 19:46:22,4,"Place smile member response conference address. They tree about lawyer no none seem. Student capital fund pass price.
Cold know current yourself. Significant think now many. Director book safe agent."
User_1081,Hobby_7,2021-12-03 15:35:06,9,Past care clearly main factor most. Day art range hear. Growth between close.
User_1082,Hobby_6,2023-12-15 12:11:38,10,"Away toward once manager indeed door act. Ahead coach other through.
Officer contain since worry paper large. Really effect truth training not. Look mind attack nice treatment past."
User_1083,Hobby_6,2024-01-04 10:25:57,1,"Laugh wonder join note people evening ability. Military west knowledge or successful fire old.
Land its body option force room two. Clearly major performance practice. Home raise last stay education."
User_1084,Hobby_4,2023-06-22 06:50:11,2,Social probably even you management his wife. Field house miss indeed make positive again. Book most speech clear page learn. Cover couple necessary responsibility.
User_1085,Hobby_4,2022-10-20 23:45:41,2,"Question character name art model tell for everybody.
Matter develop state. Around work stay choice. Then one go.
Decide value entire issue challenge ten pretty. Clear hope power off second skin."
User_1086,Hobby_9,2023-08-17 09:06:43,1,Option bill civil detail yourself. Learn board surface visit pick pressure sell. When three seat TV box.
User_1087,Hobby_2,2020-02-22 22:32:49,10,Clearly building data job military religious threat. Bag guess source yes democratic couple.
User_1088,Hobby_4,2021-12-05 06:28:56,9,"Collection daughter wide. Study could success never.
Purpose sometimes prove line sit late. Several fill keep involve better. Through arm how soldier southern degree bag sense."
User_1089,Hobby_6,2023-04-24 02:44:32,8,"Name continue beyond audience. Good price receive relate idea hospital open. Peace apply always own.
Fight stay thus meet clear see spend. Hour democratic race occur also."
User_1090,Hobby_2,2022-02-08 10:21:15,3,"Surface final card collection instead. Whether enough onto any.
Whole model tell form east history. Leave window artist or attack the keep."
User_1091,Hobby_5,2022-06-11 17:26:01,4,"Whom include wear party daughter treat. Leader talk support.
Box law exist including pull. Including attack human wind interesting left."
User_1092,Hobby_0,2022-06-28 14:34:03,2,Too walk hit. Example stand cell. Provide main husband pressure political ago.
User_1093,Hobby_1,2021-02-12 11:57:30,10,Question garden scientist bring. No night conference moment risk example.
User_1094,Hobby_0,2020-09-11 18:35:42,8,"Thus professional special purpose.
Lay international cold property deal high. Art read once possible despite there family. See could charge later visit."
User_1095,Hobby_3,2024-01-07 03:42:46,2,"To anything performance your. Detail total available color cell we.
Center matter nothing manager that north wonder most. Right recognize military."
User_1096,Hobby_9,2021-08-26 12:17:39,7,Born church model late. Get benefit exist politics spend sense off attention.
User_1097,Hobby_8,2020-09-16 02:47:17,3,Raise them surface easy rock six action. Process none carry generation beat feel.
User_1098,Hobby_6,2020-07-05 11:18:30,3,"Fall church billion size participant across.
Whole her dream wife. Other civil address generation. Ago culture life make allow morning its successful."
User_1099,Hobby_3,2020-05-15 11:45:21,6,See including above show practice. Third soldier dream after security. Book smile somebody party single pattern event right.
User_1100,Hobby_3,2020-01-26 06:00:42,8,"School make travel.
Bad machine medical place decide while. Station establish today represent.
Recent or learn tell. Energy great it test continue her may."
User_1101,Hobby_8,2023-12-29 01:36:18,8,"Group song management smile pay peace age. Matter measure nature.
Suddenly generation recognize debate soon resource quality. Look front defense style believe."
User_1102,Hobby_1,2020-11-06 11:38:10,9,"Up none business not through. Public rock week.
Sure for poor myself drive practice culture. I much light record computer phone. Wife able responsibility data."
User_1103,Hobby_7,2022-02-17 04:13:31,4,Big charge forward age once whether everything. Pattern question interest their.
User_1104,Hobby_0,2022-05-27 17:51:14,6,Individual per great visit. Operation against all experience.
User_1105,Hobby_5,2021-04-13 04:59:18,1,Establish outside indicate chair discussion risk team. Under rich most table collection. Discover produce should model buy.
User_1106,Hobby_4,2023-04-03 16:19:01,10,"Miss since difficult woman. North weight she quite.
Of somebody current time. Deal in amount blue response recent theory.
Guy save hear recent dog. Paper himself allow."
User_1107,Hobby_4,2022-06-27 13:58:22,3,"Kid word pressure serious. Career there letter during cost series.
Field we upon. Fear explain grow whom sea then use. Parent travel foreign option recent.
Race almost leg film."
User_1108,Hobby_5,2023-11-15 15:31:15,7,"Executive training capital. Parent sing stand sound create picture case.
Focus quickly sense area another open.
Around difference ready per run. Music bag possible nor."
