Username,Hobby,Date_liked,Interest,Comment
User_0,Hobby_2,2022-02-27 15:14:47,8,"Minute true check claim. Product capital even administration lead answer.
Available spring eye war act start. Ability forget same newspaper hospital. Affect peace wrong room important better."
User_1,Hobby_4,2023-01-20 22:07:06,10,"Heavy large million me heart just source also.
Level weight effect. A help approach one."
User_2,Hobby_2,2023-01-27 17:47:13,8,"City low pretty good respond mind.
International level cover manage me involve father.
Admit or letter buy. Walk white standard."
User_3,Hobby_3,2022-08-30 08:35:26,7,"Edge result kid owner be few both difference. Loss test sea effect age picture easy. Include current same quality someone television. Professional training contain.
Certainly resource as authority."
User_4,Hobby_9,2020-05-24 13:22:03,6,Eight behavior down pay wear street camera however.
User_5,Hobby_7,2022-02-16 23:11:52,5,Affect write either employee. Serious brother fill plant exactly. Thank realize learn certainly miss.
User_6,Hobby_5,2023-07-10 06:41:34,6,Age road chance service. Crime garden dinner benefit forward you claim. World task these onto star statement.
User_7,Hobby_1,2023-10-25 09:09:49,2,End politics individual. Keep more professional at born hear environment. Congress say region popular up. Behavior worker near become develop together.
User_8,Hobby_5,2020-09-27 23:46:07,4,"Or push poor garden.
Rather pressure can ok public. Light without mind perhaps door loss. Discussion final total occur break anyone.
Travel across training without serious. Single fire half a."
User_9,Hobby_8,2021-04-13 09:02:05,10,"Such case bag game beyond pass now. Though pattern right bit spring sort last.
Wall letter decade wide evening light language. Hope girl majority friend plant question. Role vote wife."
User_10,Hobby_0,2020-03-26 00:21:47,2,"Rule wide test almost they candidate spend. Court window benefit Mrs north impact still. Consumer spring risk author.
Best painting young. People although that other candidate must true."
User_11,Hobby_8,2022-01-06 03:30:00,4,"Defense and including. Science plan pretty institution often. Pull among budget point cause window too. Serious five protect fish.
Really laugh project order. Require different process voice across."
User_12,Hobby_2,2022-03-17 02:43:20,3,Material defense describe garden. Decide certainly truth maintain argue show blood bed.
User_13,Hobby_7,2020-07-21 07:59:50,6,"Southern education worry spring. Call he their large human sense. Figure newspaper lead care mean off.
Billion challenge various course read traditional technology. Little you future morning house."
User_14,Hobby_8,2022-05-01 01:52:12,4,"Happen down only identify reach example. Week see different statement behind painting.
About place various evening. By hand financial down."
User_15,Hobby_6,2020-08-24 05:20:25,2,"Professional during lot. East gun floor its way good rest.
Win whatever collection manager strategy head. Agency about fact lose yard church."
User_16,Hobby_2,2021-04-17 02:36:42,1,"Pattern themselves hotel live decision. When book food law traditional dog.
Role issue letter. Want raise else more."
User_17,Hobby_1,2020-12-20 20:41:51,4,Share paper scientist institution ahead only discussion black. Old establish open. Present social will allow indicate particularly ten.
User_18,Hobby_9,2021-10-12 06:47:02,7,Share environment than trip. However including myself follow real bed author. Look structure understand usually.
User_19,Hobby_1,2021-12-13 04:34:48,5,Growth economic send save nor. Much allow bank but. Money adult many once argue never oil.
User_20,Hobby_9,2024-03-14 14:19:33,2,"Store PM among defense issue she. Test evening develop animal return inside whose.
Home discussion stuff yet. Although big remain table. Away box kid tend out."
User_21,Hobby_7,2023-09-26 07:28:30,5,Person garden south idea hit its. Instead probably husband according learn parent force fly. Opportunity computer energy car.
User_22,Hobby_8,2022-06-16 11:13:44,2,Small five television small brother bag young until. I executive huge hard. City create sound everybody eat mean.
User_23,Hobby_3,2024-04-09 08:01:47,8,There artist still trouble drop point control one. Finish above happen mention address new agent. Have us myself next box.
User_24,Hobby_0,2023-07-12 21:54:00,2,"However adult live for budget indeed none. Science part mouth threat right. Hear poor late per forget.
Four language myself material gun task. Behind range get difference."
User_25,Hobby_1,2022-06-09 15:31:44,6,"Sure field treat sit art.
Anything care reflect fire find participant. Often effect west wife to fish he available. Outside remain interview someone however."
User_26,Hobby_9,2023-04-14 09:14:38,4,Him possible quickly lose continue choice. Goal protect big human. Where could else affect tend wear event. With institution our or safe.
User_27,Hobby_0,2022-12-06 07:50:20,9,Policy role eat bill challenge be. Wonder perform blue make area create. Include phone figure relate bag lead manager.
User_28,Hobby_9,2022-08-14 04:49:06,8,"Pick walk alone finally season. Skin two upon under.
Brother to democratic. Which poor employee hard."
User_29,Hobby_5,2020-08-31 17:50:20,1,"While mouth raise third officer adult. Success check after method.
Respond we PM. Happen have address administration. Black really turn very."
User_30,Hobby_2,2021-09-29 01:29:24,5,"Election fish few teacher speech. Page specific west her personal.
Now best pick leader tough today power."
User_31,Hobby_2,2021-07-23 01:08:05,10,"Available tree any talk. Work herself sound benefit might oil as. About staff contain identify attorney commercial low.
Southern stay bit. Care politics what police."
User_32,Hobby_6,2022-03-02 14:42:38,3,"Often base realize soldier goal popular be. Beyond me room live. Hotel without here ask dog.
Someone form in design. Room fund represent camera follow. Policy main feel later."
User_33,Hobby_3,2020-08-23 20:51:59,1,"Look food public air. Wonder which may where that trade.
Really power art institution dog certain. Company either middle discuss perform together."
User_34,Hobby_3,2021-01-27 14:54:18,5,"Audience trade of brother. A thank allow learn feeling economy walk.
Play story budget know art. Claim control nor common news term billion."
User_35,Hobby_4,2023-04-28 22:21:38,10,"Week participant clearly purpose natural character administration. Ball cup feeling else.
Again factor sure.
Pass network too. Man lot support arm usually. Bar respond degree administration woman."
User_36,Hobby_7,2021-08-11 00:16:00,4,Enter government mouth tell fight sing. Training democratic trade north democratic ball. Sea position step itself usually one.
User_37,Hobby_5,2020-09-11 04:41:29,8,"Wife garden successful impact road owner. Event garden statement measure be less.
Really yard fine local."
User_38,Hobby_2,2024-02-28 09:33:54,10,"Chair model require economic talk budget. Response reality upon baby miss seven.
About business her fund. Establish yet then including issue economy. Eight say name because."
User_39,Hobby_4,2023-10-31 20:36:41,7,Woman hard special check move Mrs effort. Top industry today meet add despite form conference. Bed arm fight.
User_40,Hobby_0,2020-10-12 08:42:02,1,"Hour notice list drop. So town media charge product.
Send team interview myself space. Dog quality mention key."
User_41,Hobby_8,2022-11-28 16:54:04,1,"For sing long know reality. North movement bar reach physical evening.
Reality sometimes which several. Production series quality walk herself white beat. Evening where clear size involve left."
User_42,Hobby_2,2020-03-31 18:06:29,1,"Purpose than pay a line only reduce treatment. Allow edge reality either. Maybe bank yet enjoy teacher would decade.
Skill generation local instead."
User_43,Hobby_9,2021-01-18 08:45:40,10,"Hundred clearly must true. Military discuss enough as move.
Cup argue alone good parent. Prove magazine gas five reach six. Perhaps several participant usually why."
User_44,Hobby_5,2021-03-04 23:36:21,10,Threat some carry environmental bed. Ground individual campaign family arrive his sit. Scientist bit until low watch. Character popular site development way.
User_45,Hobby_3,2022-05-29 21:24:06,10,Current make source. Stuff middle because personal inside person think. Compare offer know group important program husband memory. Why bill TV whom apply.
User_46,Hobby_0,2022-04-24 17:45:16,2,Simply standard drive her adult. Debate expect book significant upon theory get wide.
User_47,Hobby_6,2021-12-12 06:01:51,8,Fly why until war film individual live. Care affect just. Executive culture so treat.
User_48,Hobby_4,2021-12-27 16:15:24,2,Majority within follow vote soldier. Any program visit agent week new. Relate prove instead process language work significant.
User_49,Hobby_3,2022-12-02 07:54:37,5,Blood series administration company establish husband action coach. Pull boy floor base spend effort. Learn watch result their give federal.
User_50,Hobby_8,2020-10-22 08:32:35,10,"Sister argue Mr consider everybody ready. Money ok care. Large thing rule country issue production television.
Several call free seat marriage field. People analysis wear kid item recognize."
User_51,Hobby_3,2022-10-07 04:30:58,2,"Hold allow method drug arm. Piece bill management.
Physical series music score agree design. House movement enter around hot staff exactly. Describe resource himself computer sometimes four."
User_52,Hobby_6,2023-01-20 19:04:53,7,Recent reveal media establish certain decide. Good affect behind range statement sort. Else piece college.
User_53,Hobby_7,2024-01-20 22:59:40,9,"Civil western short him. Success director trouble but community lead economic.
Less number garden more provide up. Contain third life approach chair expert."
User_54,Hobby_8,2021-04-24 00:01:53,1,"Officer brother specific stage owner. Nature story animal.
Practice speak environment place region nor. Look sing pay pattern debate. Sure bag before painting class charge."
User_55,Hobby_1,2021-10-21 01:09:19,7,"Father as great. Side professor than sense.
Spend glass song. Maintain much run board both work hospital through. Girl father foot."
User_56,Hobby_1,2020-01-02 17:18:52,9,Pretty instead set skill enjoy foreign fly left. Agent hour fill owner. Religious hit quickly others detail have authority. Most carry point vote spring.
User_57,Hobby_6,2022-05-20 16:41:10,2,Dinner moment even different. Treatment notice feel fast job such reach.
User_58,Hobby_6,2024-01-03 22:36:55,1,Last hotel throughout tend attorney. Explain six section somebody fall truth. For control camera blue.
User_59,Hobby_9,2020-08-10 17:46:08,1,Pass behavior focus care remain million thank. Industry trouble week Republican itself. Son once key wall unit entire order.
User_60,Hobby_8,2021-07-09 15:09:47,7,"Popular quite forget here.
Left happy arrive dark Congress community ground. Adult case fine feel."
User_61,Hobby_2,2021-12-26 06:41:28,5,"Weight traditional own subject. Democrat serious chance. Arrive peace vote.
Doctor yeah specific room. Production forward herself poor another without. Make civil car public street bit."
User_62,Hobby_3,2021-05-18 22:34:44,7,Baby project close. Course news coach movement.
User_63,Hobby_1,2023-02-14 22:23:24,5,"Then rise first west it recently brother.
Over run participant finish tax data may. Financial yet someone professional.
Space enough fly wall professional girl section interest."
User_64,Hobby_4,2022-02-25 21:51:37,1,"Second decide blood none close. Seem from admit case community meeting dog.
Role drop major thank. Million anything forget something you happy. Hope start someone."
User_65,Hobby_1,2020-09-26 15:39:53,7,Window spring drug TV. Notice exactly defense her any develop change. Form state suffer either.
User_66,Hobby_4,2021-06-26 02:49:07,9,Experience water herself pattern theory scene. For music ability protect account probably daughter.
User_67,Hobby_0,2023-02-01 10:50:33,7,"Small especially three worker goal blue physical. Article speak law fly actually.
Republican clearly really. Chance form appear.
Control continue money various offer movement him."
User_68,Hobby_2,2021-01-31 06:37:08,6,Talk since central throughout tend. Fill sister evening material woman option friend. Idea television security. Hair tonight product partner yeah hope career.
User_69,Hobby_6,2023-11-29 16:59:39,2,"Drug see learn shoulder their before produce animal. General leg watch possible. Discussion seven professional per writer.
Effect affect nothing. Easy enough line concern control when."
User_70,Hobby_0,2022-04-30 05:49:57,8,Take site race dinner. Wear letter shake color leave dark federal. Scene early buy benefit political plan.
User_71,Hobby_3,2023-07-29 04:25:21,8,"Many instead develop understand. Mean well smile college give score.
Day need book toward management. Draw simply whatever whatever president network try."
User_72,Hobby_8,2024-03-08 02:35:14,5,"Impact early north financial among. Six seem answer whole.
Nation arm suggest they pattern guess event. Poor statement if only stuff. Teacher national next thus."
User_73,Hobby_0,2021-06-16 21:21:08,6,"Property itself early prevent. In hand simply push. Thousand raise house unit.
Though data account scientist between only among. Give happen this."
User_74,Hobby_9,2024-02-13 06:46:18,5,"Degree modern another total behind follow.
Expect ready but pay culture recognize professional. Old deal politics foreign brother word car."
User_75,Hobby_7,2021-06-19 05:07:51,5,"Light prevent free evidence church operation. Mr leader suggest perhaps nice democratic.
Local manage beat sort investment. Pattern scene positive oil. Team financial out lawyer us."
User_76,Hobby_8,2023-12-10 22:32:38,4,Rather possible likely industry attorney. Challenge economic help get. Base box chance important perform yeah computer.
User_77,Hobby_9,2022-11-03 16:04:01,8,Still she staff. Suggest field last try base computer prepare. Guy seven institution recent itself fact again. Opportunity blood example notice event.
User_78,Hobby_9,2022-06-15 20:47:55,8,"Letter such main. Relate teacher fill third attorney unit.
Choice serve avoid truth natural certainly two. May ground throw seem respond growth song wind."
User_79,Hobby_9,2021-07-26 13:18:38,6,"Remember significant challenge western soon day buy protect. Notice certain another operation rule animal. Phone president law daughter.
Door term market."
User_80,Hobby_7,2023-04-26 05:24:17,3,Image trade here attack continue people language. Chance still forget until owner account daughter.
User_81,Hobby_6,2020-06-19 23:54:33,2,Each fast north address Democrat. Require people oil television class magazine. Physical blood well material sell recognize.
User_82,Hobby_0,2024-01-26 18:42:30,4,Maybe true trade war thousand. Direction resource the move best. Professor trouble three last police however.
User_83,Hobby_4,2023-11-05 23:08:45,3,"Choice become soldier base keep son part speech. Claim write wish detail. Couple travel office good social political in.
Almost person middle stay husband quickly. Get push glass figure member."
User_84,Hobby_0,2020-05-31 02:02:47,4,"Game guy last age.
House program information two big practice when. Attention memory once term traditional positive.
Peace teacher contain boy environmental stop claim. Pass drug for laugh."
User_85,Hobby_9,2022-07-03 04:28:17,3,"Vote play present newspaper when. Model surface note the voice.
Maintain next Mr. Standard girl third friend rock life realize. Place live their since."
User_86,Hobby_0,2023-12-19 03:58:40,8,"Admit if sit pressure. Hundred according citizen policy their accept population.
Hundred present American letter. Environment son subject. Bring anything newspaper financial than yeah hour."
User_87,Hobby_1,2021-08-26 01:36:31,3,"Cell few idea.
Material walk without attorney fund. Still how gun foreign. View fund project seek floor can.
Light through truth south police grow."
User_88,Hobby_6,2022-05-02 22:10:36,10,"Stuff respond wait late fear commercial. Process music what two. Street me make start plant sea dark.
Support parent quite enter understand everything then."
User_89,Hobby_0,2022-01-26 19:38:59,8,Must two federal glass. Ask perhaps country traditional. Measure government majority quite environmental represent.
User_90,Hobby_4,2024-02-11 11:59:29,2,Though policy notice ground base. Though apply white fish individual kitchen herself. Throughout without view.
User_91,Hobby_4,2023-02-13 09:18:40,1,"Wall always officer direction. Audience whom top. Common try open fight.
Walk news right. Discover meet modern character themselves many."
User_92,Hobby_5,2023-01-28 17:10:02,4,"Worker well bank sound. Seven candidate mind door call various.
Administration size group already ago then. Firm itself fight along top nice officer. Method order south population among behavior."
User_93,Hobby_6,2023-10-13 17:17:14,3,"Modern high crime ten. Hand though call race true turn. Speech no decision number second pass production. Father both particularly these.
Movie control carry available part."
User_94,Hobby_9,2021-12-06 13:32:01,5,"Business discussion usually life rest man next campaign.
Research place line crime off attack. Perform mean hard."
User_95,Hobby_9,2020-04-24 08:50:17,5,Interview democratic debate listen. Dinner find hair herself imagine artist amount.
User_96,Hobby_6,2023-08-11 05:58:30,4,Radio action return. Wait happy box front machine miss heavy ever. Same fact society than yard a.
User_97,Hobby_5,2022-03-01 04:18:28,6,"Over machine he serious. Read author national accept decade.
Rule nothing front if senior agreement would. Already shoulder only."
User_98,Hobby_0,2021-11-09 09:16:10,10,Life short partner hair next stage southern. Record week again new together eye standard.
User_99,Hobby_7,2022-07-26 05:25:24,7,Scene accept effort seven crime. Wife serve artist hundred out brother.
User_100,Hobby_9,2020-06-19 09:02:05,5,Bank continue particular deal little health television. Pm response six may walk.
User_101,Hobby_1,2022-01-12 19:08:39,8,"Apply lawyer ball become if. Leave our member entire million game civil. South money want song color.
Guy president name. Worry spring fly. Camera environmental find."
User_102,Hobby_6,2020-04-14 01:19:06,8,Field need early front international believe team. Thank environment day simply talk. Figure hospital hit base.
User_103,Hobby_8,2023-05-10 09:39:45,8,Machine mother especially college west. Allow medical house speak clear life. Consider movie discussion itself show.
User_104,Hobby_7,2023-01-10 11:53:17,6,Apply glass these drug suddenly they. Speech these record bed if pay sure forward. Idea size short effect someone their.
User_105,Hobby_4,2022-09-28 02:00:53,2,"Hour success pressure opportunity pick require. Though sit adult tell of executive.
Under unit rule interest. Bar high down after save weight. Amount official miss as mind responsibility own court."
User_106,Hobby_5,2020-06-08 02:25:16,7,"Site fill control north spend. National less evidence network sometimes. Response ground build stage note blue create.
Quite follow detail wife affect choose. Water several government."
User_107,Hobby_3,2021-11-09 05:13:45,8,"Reach about sort nearly shoulder star student. Expect effect practice seem. Job onto phone reveal cold foot painting.
Center modern something better. See environment place discussion Congress."
User_108,Hobby_4,2021-08-13 08:47:56,1,Maybe our kind view owner. Relate general century. Before to involve job. Meeting single night.
User_109,Hobby_7,2020-05-21 00:53:45,4,Its market network brother six compare best. Argue left both catch behind. Wear watch bank week hit somebody draw.
User_110,Hobby_1,2022-10-24 07:08:11,10,"Employee base base affect.
If tree movie TV accept evidence decide. Interest measure or enjoy nature. Conference style from know."
User_111,Hobby_1,2021-07-20 11:27:05,8,Right unit seek fine base blue. Let event course answer reduce bed. Participant could note talk modern.
User_112,Hobby_5,2022-09-18 01:04:27,1,Seven ball around challenge they speak car. Expect trial treatment leave identify year. Production official high staff option might thousand.
User_113,Hobby_7,2022-11-22 08:51:56,2,"Stuff happy hit most raise. Evening player produce involve serve care. Attorney assume should itself.
Stand little always network economy. Day about realize serve."
User_114,Hobby_2,2021-01-06 00:29:01,9,"Entire those hand. Capital run thing establish.
Well investment memory cell first. From case manager myself. Age apply here choose happen sell final argue."
User_115,Hobby_6,2022-01-24 02:22:30,10,"Base often like operation very. Stop support along since language chair yeah.
National pick save. Degree red draw bring. Receive bill before someone if western memory road."
User_116,Hobby_2,2024-01-17 21:51:28,1,Subject film the vote beautiful wrong. Concern threat opportunity local magazine check. Pressure about yard alone special.
User_117,Hobby_2,2020-04-14 04:05:47,7,"Drug create imagine pay citizen. Break believe service require pass. Decade language five evidence trip reflect.
Reflect east cold with spend cause. Rest in ready region remember."
User_118,Hobby_6,2020-08-14 13:45:22,10,"Interesting ask serious Republican defense back very. Rest against goal decide one training.
Serve successful use yet resource. Last national suddenly tonight southern."
User_119,Hobby_8,2020-09-24 19:44:19,7,"Beautiful nearly but two into wish evening. Leave finish lose teach western inside accept.
Positive determine rise agent modern adult place. Ok hotel draw though."
User_120,Hobby_7,2023-07-27 05:43:39,3,"Back important attention job onto.
Decade nature success catch those computer. Occur he your wind spring large. My present I newspaper already cold."
User_121,Hobby_3,2020-07-19 16:58:44,8,"Beautiful reveal finally where keep him apply. Example standard bed nice. Seven increase television.
Wish turn win sense find."
User_122,Hobby_0,2023-01-08 17:17:06,2,"Social identify report activity. Culture baby idea take prove beat. Police hot treatment.
Relate move city hard miss.
Enter concern success enjoy popular. Traditional quite discussion visit."
User_123,Hobby_0,2020-11-16 19:36:06,1,"Full agree short pay myself.
Know ball somebody easy consider. His bar argue.
Usually goal statement source. Appear large here let win any single. Couple paper surface change."
User_124,Hobby_0,2021-09-21 16:11:08,3,"Someone seem something country late pull lawyer. Large argue probably his.
Edge wind expect word perform hot plan. Across nature sound wear soldier. What enter must security he surface."
User_125,Hobby_6,2022-09-27 22:21:59,3,Growth phone activity tough visit away. Traditional eat key your number explain. Response another when another.
User_126,Hobby_7,2020-09-30 10:02:58,7,Southern record another her support. Head since plan training full long manage. Knowledge past increase.
User_127,Hobby_9,2021-10-13 15:47:24,9,"Despite level space either enter. Woman evening recently key different girl full. Guy religious figure since watch.
Power recent quality into."
User_128,Hobby_6,2020-05-31 01:32:46,1,"Beautiful boy forget join foot. Many real agree wide. Live computer participant draw form suggest method.
Responsibility reach billion option population. Growth drive big."
User_129,Hobby_1,2020-12-24 04:47:13,2,Possible budget make economic last behavior yes. Agency only over role standard. Glass party trial on identify talk.
User_130,Hobby_2,2021-09-30 13:39:33,6,"Anyone lead large give special oil agency mother. Stand music law population.
Water save skill star image act. Movement look consider night machine. Above house rest threat arm."
User_131,Hobby_5,2023-10-03 09:00:22,5,Cold hope effort look. End American late right increase until student wrong. Third civil bank drive lead research group.
User_132,Hobby_7,2022-02-05 05:55:10,3,"Three eight door friend. Mission true medical large Mrs.
Minute foreign attack stay put why follow program. Occur because fly my land religious maybe. Practice second join tonight lot."
User_133,Hobby_1,2023-02-09 01:02:49,4,"Answer peace thing difficult bad east base air. Administration short authority special generation want.
My recognize be line."
User_134,Hobby_0,2020-07-06 22:26:29,1,"Camera somebody true. Area take what might share idea talk.
Cup home wrong sell stand degree wonder.
Pm house education seven where manager build. Speak writer before accept building."
User_135,Hobby_7,2023-02-28 03:19:11,2,"Employee million because. Writer arm late. If team manager open act back.
Even strategy from act. This production now sea center rather factor."
User_136,Hobby_6,2022-04-01 22:35:15,6,"Example around think crime fire ahead body.
Practice herself health visit player list could probably. Your space newspaper air crime through population. Office task management scientist."
User_137,Hobby_8,2023-04-18 08:26:35,8,"Born than talk ask thousand move. With win situation history full down the look. Be west pull.
Budget meet range board news father clearly."
User_138,Hobby_1,2022-11-08 03:24:00,10,Wish natural their mention writer nearly. Drop finally majority at house tend avoid. Build be let exactly. Establish popular list feel.
User_139,Hobby_0,2023-04-19 05:34:15,3,Available lay enough exactly sure. Experience tree be drive low company. Think tell guy list two simply.
User_140,Hobby_3,2020-05-16 22:12:51,4,"Image sit talk position. Pass role place.
Because between cause series.
Understand strong owner approach. Cause street such firm. Top later budget common phone decide outside."
User_141,Hobby_6,2021-04-05 01:35:44,1,South catch minute himself type. Book person culture develop thing say. His some must dream. According simply story its agree.
