Username,Hobby,Date_liked,Interest,Comment
User_283,Hobby_5,2022-08-03 20:40:59,6,"Easy significant service other. Let enter him cell image ever. If knowledge either blue.
Return language eight remember while everybody development religious. Medical total food affect I toward."
User_284,Hobby_6,2021-12-21 23:12:09,3,"Sense left yet. Poor they either create.
Method speech single more avoid. Set hold rule fly reach. Card last while way rise everything answer piece."
User_285,Hobby_6,2023-02-18 22:25:01,10,"Happy little effort page event. Involve team site catch short prepare world.
Question put off work the huge medical garden. The understand window begin even stand everybody."
User_286,Hobby_7,2021-08-06 10:07:08,1,"Hotel property study that half stand result. Long through least whatever left.
Shoulder Republican available lose. Article task star there policy reflect lay adult. Eat land create."
User_287,Hobby_7,2022-10-23 18:19:46,5,"Expert off citizen call perhaps always cost.
Range improve evening resource might necessary million. Computer campaign daughter strong manager story ever claim."
User_288,Hobby_8,2024-02-11 04:33:12,8,"Six nature Democrat back around.
Describe owner market because wait for hand. Ok nor friend serious teach."
User_289,Hobby_4,2022-05-24 20:40:03,9,Almost check various ball after fund group. Debate fill politics may between physical check. Four just hotel season.
User_290,Hobby_4,2024-01-30 09:50:13,1,Thousand official senior. Price role world court. Single hold decide enough particularly then account.
User_291,Hobby_5,2023-08-01 22:22:52,5,Surface stage avoid by culture east beat. Spring bank heavy cultural day. Expect start cell beat significant. Finally stage consider boy political.
User_292,Hobby_0,2023-12-01 08:41:43,10,Management explain rather herself kid. Large leave car cell look during trip. Again charge market foreign finish stop who.
User_293,Hobby_9,2020-11-09 07:43:01,2,"Into check similar.
Though church western. Black skin organization probably tonight letter religious.
Happen glass in maybe. Happy maintain wrong month since debate. Behind least base decision chair."
User_294,Hobby_8,2022-07-08 18:29:06,7,"Throw his final recent sure. Per visit good set federal industry guy. Power what south artist our meet good.
Candidate maintain general person individual for."
User_295,Hobby_2,2023-12-28 03:22:34,6,"Someone sport themselves. Break skin be majority no building reveal.
Into music between blood."
User_296,Hobby_0,2023-05-13 05:36:41,8,"Truth stay voice control. Environmental want then crime data few few cold. End get force may hit.
Resource degree fill four sit. Each city compare at. Game lay friend our course think within."
User_297,Hobby_4,2020-01-05 13:59:22,4,Truth level fish run ability. Minute through page short particular social check. Still Congress economic body mouth defense.
User_298,Hobby_4,2022-07-06 23:01:36,7,Something after who pattern stage. Star answer whose. Might success reality knowledge film recognize evidence.
User_299,Hobby_1,2021-02-02 16:11:48,9,Positive do political office task understand. Reason sure will include politics class. Some dinner join.
User_300,Hobby_7,2024-01-18 11:52:13,8,"Chair collection skin improve key more. Again operation author region air part including live. Dream each enjoy somebody source last two.
Four management accept. Alone field job way."
User_301,Hobby_3,2021-02-11 05:41:11,4,"Phone detail tax research view. Movement lot world suffer movie improve.
Environmental partner talk act Democrat. Find type down better else.
Wide reach race six fall."
User_302,Hobby_5,2022-09-13 02:53:18,5,"Answer case tell forget. Officer idea thus already include.
Job rule table citizen detail. Carry wonder low decide.
Sell really but cold in. Early commercial individual."
User_303,Hobby_0,2022-12-05 18:22:51,8,"How person court time quite plan manager.
Their mean skin himself others. Per teach phone might.
Field not unit writer save case. Social position sense training pick care partner."
User_304,Hobby_2,2024-03-03 07:17:12,10,"Why long him their. Watch media area capital. Reflect analysis one range mother feeling.
Employee worry property our hair quickly without. East third sit everyone build."
User_305,Hobby_8,2024-03-18 19:17:53,4,"Figure pressure southern phone want section outside. Save little cell wonder particular administration.
Response may financial alone. American must treatment figure."
User_306,Hobby_1,2020-09-09 12:00:20,2,"Single since simply end professor much case left. Voice budget our thing parent.
Law should increase stock idea leader trial. Student maybe budget impact far. Sing sometimes product."
User_307,Hobby_5,2022-04-14 08:49:46,4,Here out hope allow. Site second pressure work picture clearly. Apply soon personal. Positive ball bag their realize.
User_308,Hobby_4,2020-04-13 04:03:31,6,Example learn together hospital. Only within officer drop. I house fact economic factor summer main. Risk sing place exist add.
User_309,Hobby_3,2023-11-21 08:50:53,3,"Wonder lot wait case hair college work. International board foreign here our outside. Thousand study feeling box.
Cover exist company serious."
User_310,Hobby_4,2021-06-04 02:22:21,6,"Fine beautiful network consider. Involve course they together. Bed religious position pick reason example. Create certain gun training wind affect political first.
In effect series probably."
User_311,Hobby_6,2023-01-09 15:55:32,7,Base entire deep general get very. There ready resource since themselves you necessary. Religious number education view magazine.
User_312,Hobby_8,2020-05-26 21:08:45,4,"Government old seven environmental. Discuss feeling receive hear event than weight. Career fly recently follow.
Hundred data war hold. Magazine such miss."
User_313,Hobby_7,2022-08-25 12:53:33,8,Thing question maintain item. Soon kitchen seven minute. Write scientist occur political last mouth for miss. Administration yourself PM standard four school ability special.
User_314,Hobby_5,2023-05-07 06:58:01,4,Up leg wear her picture common if.
User_315,Hobby_6,2022-06-09 05:49:57,1,Standard try foot interesting hand. General about type. Federal just still check.
User_316,Hobby_9,2020-01-26 03:57:50,1,Heart authority concern. Authority particularly writer political at agent. Unit particular movie hospital attention if something east.
User_317,Hobby_5,2022-10-19 21:06:45,9,"Form care improve million seem news. Concern word son law believe pay against small. Opportunity live growth clear any.
Along employee answer public. Low painting charge particular us."
User_318,Hobby_5,2022-01-15 06:41:43,6,"Decision individual him agree. Detail seek government mission. Already follow his their.
Simply skin early star summer news space voice."
User_319,Hobby_7,2020-07-03 06:10:23,2,"Us thought parent most inside.
Relationship visit threat ground they not these. Recently position fly marriage."
User_320,Hobby_3,2023-10-10 22:51:27,6,"Child political early. Black reveal let. Cup but help deal black event.
Inside food experience notice might practice which. Line artist some big security feel summer. Section century safe true money."
User_321,Hobby_5,2021-04-01 16:13:58,3,"End back marriage future. Us too throughout outside believe carry gun.
May trial appear man and generation to. Picture after get himself watch court season."
User_322,Hobby_0,2022-08-07 23:09:56,2,Dog film indeed few others. Cold military thank film listen understand maintain. Return operation respond wait about whose girl. Event data believe former price.
User_323,Hobby_4,2024-02-05 04:30:12,10,"Tv about foreign. Different for far special cost. Ability walk rich amount.
Model audience reason more. Create three church on develop perhaps during ready."
User_324,Hobby_4,2022-08-09 14:16:49,2,Discussion sit game. Approach best foreign anything kid kitchen need learn. No recognize follow mission read property rate. Significant almost house chance.
User_325,Hobby_1,2021-05-26 13:55:59,5,Season half mention table reveal work. Major truth law leader forward. War edge assume.
User_326,Hobby_8,2020-10-23 00:19:17,6,Place number leader first piece. Mention cause southern somebody poor challenge move message. Report space economic race song level community fill.
User_327,Hobby_1,2020-07-01 22:21:56,5,Marriage himself myself TV. Fly man behavior cup executive.
User_328,Hobby_7,2020-02-29 10:05:27,2,"Near home phone who research more. Often course think actually heavy official system. Day say kid close.
Ground direction official most phone young certainly nor. Crime news south wide throw her."
User_329,Hobby_5,2020-11-27 00:46:30,4,As they year popular plant. Relate enter else whether provide policy ask last. Second news concern notice.
User_330,Hobby_7,2021-06-20 02:10:28,3,Student some region member writer foreign. Activity fall TV force situation even a. Professional scene plan dinner same lose want. Bring hope generation another.
User_331,Hobby_6,2023-08-21 04:12:16,2,"Former doctor compare set.
Say any seven main several. Thought north who song by sound."
User_332,Hobby_2,2023-05-06 02:39:21,8,"Candidate investment image child.
No provide else your.
Experience case member product me appear prevent. Himself individual still rock matter subject the. Court attention main oil at sense west."
User_333,Hobby_8,2023-05-05 09:42:02,7,Million turn more ago mission. Fund reality there. Remain conference movement during moment close probably. Of past source save everything stay.
User_334,Hobby_2,2023-04-10 01:58:07,2,Down great million do draw add. Door thousand population this. Finish sing house wind you letter evening.
User_335,Hobby_5,2022-04-06 14:47:39,10,"Place explain its guess.
May big study enjoy success ago investment over. Produce majority economic think probably long around whose. Congress run account compare wife in."
User_336,Hobby_1,2021-06-17 06:31:55,1,"Majority behind parent if necessary check. Middle keep various.
Say program cause anyone college section church. Employee popular else room activity pretty out."
User_337,Hobby_9,2020-10-08 03:49:36,1,"Paper recognize they impact collection if.
How wonder agency might. Could by company base.
Pattern stop serious on want develop tough. Key enter man poor break discussion."
User_338,Hobby_2,2023-12-18 15:13:53,1,"Possible free hair.
Short eat painting physical white miss. Research compare matter bar break collection some strong.
Poor week agent foreign. Direction use Congress why. Control than image cause."
User_339,Hobby_7,2021-07-17 02:15:49,8,Former foot imagine pick themselves five. Poor yourself teach day. Follow present throughout suddenly himself street face.
User_340,Hobby_0,2021-02-04 23:03:05,1,"Could your lose meeting. Late beat agency herself career behavior.
Movie test next huge. Somebody around plant bank challenge probably unit. Hundred as public wind while."
User_341,Hobby_0,2021-08-25 09:07:51,3,Official soldier story quite base all concern. Fine him leg foreign both. Course agreement which usually seek federal newspaper employee.
User_342,Hobby_3,2024-02-20 16:48:07,10,"Tv contain billion letter artist. Fact sell tax structure. Leg form thing major might easy.
Future out reason both. Blue into rather show."
User_343,Hobby_0,2021-02-18 05:13:28,3,"While son effort executive they land control outside. Buy analysis television build case.
School inside would put. Crime account six.
Artist past catch. Happen agency must. Draw out power shake this."
User_344,Hobby_9,2023-01-18 19:15:32,10,"Away still time television garden final. Both place crime Republican. Identify big rather it official technology.
Help participant coach choice. Give professional situation. Section much very."
User_345,Hobby_6,2022-11-09 06:35:11,2,Wonder week car tree daughter number. List star plant finish role. Control build rule anyone these meeting director. Off despite know Mr on.
User_346,Hobby_4,2024-01-30 01:30:21,1,"Close development group environmental suggest ago. Offer left whom parent.
Still most practice speech thought others work. Success development do pretty."
User_347,Hobby_9,2021-07-31 20:12:38,3,"Science organization through but. Church teach film.
Note travel staff wife apply over. To peace I. Machine hold real western.
Feel easy discuss pattern message. Partner main quite value let."
User_348,Hobby_3,2020-09-28 01:20:07,1,"Lose like most serve. Box on commercial once news situation through test.
Ability chair daughter everything sound. Edge growth interesting TV space weight. Bed believe science lose huge believe."
User_349,Hobby_8,2020-12-11 12:45:33,6,Reflect street force relate. Community close safe talk culture agent. Little list end report plan research.
User_350,Hobby_6,2021-02-22 21:15:33,10,"Safe try majority. Rich father key challenge film.
Him late without entire office somebody. Artist during type play space former water. Remain especially sort. Young ability test though guy."
User_351,Hobby_1,2023-03-22 07:45:33,2,Here foreign writer hold well matter cell. Series source less among. Claim also stop build. Newspaper quickly miss on buy especially.
User_352,Hobby_8,2022-03-08 15:56:27,5,Close direction several television thank note choose. Dream couple ready see deep carry. Mind instead commercial camera something.
User_353,Hobby_8,2021-02-16 10:27:38,4,"Study coach thing nor. Develop go reason.
General participant affect contain. Scene personal culture course.
Avoid wonder seven receive specific. News tell agency majority part film."
User_354,Hobby_9,2023-08-26 05:39:34,4,"During leave human. Benefit necessary subject common much just.
Certain analysis nice yes benefit south. Range exactly manager day speak born wind. Able decision although population never dog."
User_355,Hobby_4,2023-11-19 21:30:53,9,"Off material try husband focus government along. Growth red total follow.
Decade usually mouth source why follow. Idea close consider friend hear."
User_356,Hobby_1,2020-06-16 21:59:03,4,Sell young pretty place. Like season identify particular in thousand still range. Nice seven investment.
User_357,Hobby_6,2023-12-31 09:56:19,1,"Suggest scientist indeed majority. Finish smile at sometimes myself western follow although.
Each drug describe responsibility generation staff. It carry speech free the guess task."
User_358,Hobby_0,2023-06-13 12:38:32,4,Police blue of strategy eat. People campaign clear before lawyer. Forget explain language point recognize interest green.
User_359,Hobby_3,2021-01-23 11:39:41,5,"Magazine reality bit team law hit key. Support share customer around almost west hear.
Along situation radio play add born degree whom."
User_360,Hobby_8,2023-12-10 21:58:15,10,"Water leg seek teach yes. Especially blue daughter thought stock number enough also.
Eight office any crime. Game everybody professor executive."
User_361,Hobby_4,2022-10-23 12:38:37,8,"Low do might agree these. Certain theory anything beautiful learn inside.
Fall today explain out. Fall they win parent modern marriage two."
User_362,Hobby_3,2023-02-06 04:31:12,5,"Serious peace your ahead assume. Stay senior within.
Hour really during. Administration institution method that onto outside.
Final draw help still style. Majority buy close push."
User_363,Hobby_1,2020-05-18 14:28:56,9,Include specific inside situation eat kid. Idea pressure reflect mouth so dream. High should new standard bar piece black. Fund ball visit have.
User_364,Hobby_8,2023-08-24 08:57:42,6,"Stock care receive yet president though another. Region where I wear concern. Mouth tree food find your.
Necessary article final. Piece voice my reality listen at about."
User_365,Hobby_9,2021-02-28 15:47:45,1,Large news commercial use shoulder into. Role off in able prevent side radio attention.
User_366,Hobby_3,2020-12-12 02:14:07,2,Focus certainly value nature. Attention together memory point statement form.
User_367,Hobby_9,2021-08-28 14:30:51,9,"Choice hospital thought evidence. Easy those poor.
This describe per many voice other you. Yes former structure treat. Ground occur where end."
User_368,Hobby_4,2022-06-14 14:21:00,9,"Discuss pressure outside common feel. Year window join as family.
Develop value pressure. During fast enjoy try mind chair consider. Let member page interesting return."
User_369,Hobby_1,2021-03-10 02:30:35,8,Follow evidence through could well range however ago. Itself mouth and interesting especially life camera expert. Network card avoid.
User_370,Hobby_5,2023-10-28 10:25:25,1,"Million wear major boy. Majority behind song into treatment.
Hand add identify product almost responsibility. Professor debate hair."
User_371,Hobby_3,2022-12-21 07:33:42,7,"Single none benefit however either ago speech. Contain local the month. Current future so attention owner might.
Family budget clear out. Cut mind free any."
User_372,Hobby_6,2022-08-19 18:20:45,1,"Truth car least issue receive recognize impact race. Fast fill both more gas.
Ground game majority business. Former song even cultural.
Value in cost unit. Operation activity toward other might."
User_373,Hobby_6,2023-06-07 08:59:42,10,"Raise discuss be group rest population. Describe subject not professor majority. Law use happy for top imagine data say.
Finally above base safe. Second finally edge clear."
User_374,Hobby_3,2020-10-11 11:06:40,6,"Rate learn career else. Laugh top old program fund.
Billion knowledge former full finally candidate. Wife hear school enter. Former movie service side."
User_375,Hobby_1,2023-03-21 03:19:12,1,"Book message wall firm candidate truth. All arm tax and later practice. As when wrong poor peace.
Send increase bed hear. Head prove because save throughout.
Arrive no local quite scientist against."
User_376,Hobby_2,2023-11-26 01:08:54,2,"Morning issue with mind project discussion seem. Any reach after become.
Serve particularly young. Join statement Mr thought. Check church in scientist within show natural."
User_377,Hobby_4,2023-11-16 00:47:25,5,Election north value country special professional east. Investment leg million be shoulder always current. Remain adult would product together our game.
User_378,Hobby_5,2022-04-15 20:47:06,2,"Baby letter clear method. Accept office rest many.
Single yes she beat. Democratic stand resource skill."
User_379,Hobby_8,2020-10-11 11:06:25,4,Event theory easy. The range management strong. Reduce answer issue.
User_380,Hobby_3,2024-01-09 11:19:47,6,"Above modern maybe though offer type least. Us notice government natural wait.
Why east despite inside. Part defense point compare prevent street."
User_381,Hobby_1,2021-08-22 22:24:16,5,"Entire item past statement win heart. Agreement identify defense.
Nothing carry various those. Popular major program power ok size well.
Create week include walk step."
User_382,Hobby_2,2020-02-07 17:31:16,5,Together wait hit town. Spend against often own. Develop kind add exist. Star now person environment nature performance first top.
User_383,Hobby_0,2021-12-06 06:34:52,9,"Hospital Republican choose TV score office bed. Suggest fly hotel would bring when sort. Talk purpose song sister shoulder.
I traditional born. Risk last easy price foot letter apply."
User_384,Hobby_9,2020-11-09 04:07:48,2,"Year answer take ahead business not. While he ever agreement hear growth.
Important finish form shoulder energy prevent. Manage ask contain option."
User_385,Hobby_1,2022-12-29 13:41:17,7,"Past almost herself during response. Degree glass magazine learn former indeed land. Example table right.
Alone television some hot. Find heavy know five."
User_386,Hobby_0,2024-01-22 21:26:56,6,"Morning partner parent goal behind idea. Space concern tax democratic response study soon.
Pass artist half bed. Conference music TV any.
Alone foreign many. Loss goal yeah attack attorney blood."
User_387,Hobby_9,2024-02-09 09:53:04,2,"Development phone today medical economic Mrs within. Television popular job until figure. Actually similar others subject kid.
Political medical lay somebody ten lay nature. Peace end during require."
User_388,Hobby_4,2022-07-08 05:41:38,9,Become important someone provide. Nice blue may tonight low cultural information.
User_389,Hobby_8,2021-11-10 12:01:55,9,Read degree story international. Catch so health read national operation under. According main let before.
User_390,Hobby_9,2022-08-07 21:01:15,2,"Example talk military thing. Ready drug physical on country. Approach social leave somebody whatever.
Head and floor. Side another begin laugh kid study."
User_391,Hobby_1,2022-08-26 06:17:47,1,Rise person happy them rather enter. To region social maybe any heavy.
User_392,Hobby_3,2021-12-02 01:36:59,1,"Over cut cultural stand heart wide include reach. Indicate much letter him. Nation spend huge similar what.
Write recently gas agreement perform. This say during money wrong fear."
User_393,Hobby_6,2020-07-27 12:10:41,3,"Not issue you money push teacher. Provide answer little relationship.
Standard star significant soon two. Decision section sort reality worry."
User_394,Hobby_0,2023-05-13 14:26:58,9,Role recent avoid security spend. Letter effort notice executive life save ground determine.
User_395,Hobby_5,2024-03-30 08:51:12,3,Writer run enter better bank professional. List cold long already. Coach discuss write no former letter care.
User_396,Hobby_1,2021-10-22 08:12:49,7,Including address no kid cup well. Line book amount weight change country quite.
User_397,Hobby_7,2022-02-23 14:27:20,7,"Start lose animal military why. Seek give claim.
Middle eight receive system. Peace size administration Democrat want during away.
Similar ten ago pattern eye. Theory five fear factor."
User_398,Hobby_8,2024-01-23 00:45:48,4,Management affect left TV. Congress admit system pull during interest. Service be his certain.
User_399,Hobby_4,2020-12-27 19:12:36,9,"Mr thus opportunity war attorney. Chair power determine course strong yourself.
Month serious its force science nor. Opportunity something picture. Strong law however west call however."
User_400,Hobby_9,2021-04-29 11:29:13,9,"Generation level no enter. Dinner answer final need. Great skin sense product four court laugh traditional.
Instead watch sit. Somebody three with box."
User_401,Hobby_7,2020-10-18 10:12:05,1,Know material option. Voice mean eye street necessary old movie.
User_402,Hobby_4,2020-07-12 18:14:13,8,"Else miss end important lot plant parent.
With concern store person eat. Site inside edge effort affect fast. Image let high none professor second."
User_403,Hobby_3,2020-08-25 06:43:44,2,Student difference answer Republican commercial. Boy middle whatever always type sign reflect. East friend race ten.
User_404,Hobby_7,2022-10-04 01:35:20,2,All whatever though capital drive find ask once. Turn side use rise today with actually.
User_405,Hobby_1,2021-02-08 10:23:00,8,Close skin teacher bar quality employee administration couple. Collection sea prove sound American. Ago table born loss perhaps attack attorney some. Plant meeting view against.
User_406,Hobby_9,2023-03-06 06:00:13,8,"Kind gas another group recent develop account. Budget cause in trial term. Use economy seat side follow.
Name sell answer yourself west. Job use side about gas agree."
User_407,Hobby_0,2020-01-10 04:05:14,3,Boy understand necessary star college explain. But statement technology education all concern more. Stock like seven themselves.
User_408,Hobby_3,2022-02-28 17:43:31,1,"Poor poor full type through.
Painting floor on bar car share. Crime around often left people beyond difference.
Event lead serious. Wear throw then whose tend clearly."
User_409,Hobby_5,2023-12-07 23:20:04,6,Development according product friend grow area yes. Receive now focus beyond smile. Admit investment seven although.
User_410,Hobby_2,2023-03-20 15:19:02,9,Right east live third. Let station tough contain article myself quite.
User_411,Hobby_5,2020-02-09 13:57:22,9,"Recognize fast concern book. Building during watch soldier.
View our into start view once. Available word side political affect on.
Figure none sound between."
User_412,Hobby_8,2021-05-07 14:30:15,10,"Up exactly relate perhaps. Study article red top never. Set data along peace media explain simple.
World mention ready miss fire. Find mean south your. Evening run president upon cause foot."
User_413,Hobby_0,2021-09-24 15:54:17,8,Section Republican since above nearly school personal. Represent indicate owner computer service class. Relate magazine charge another nor.
User_414,Hobby_2,2021-05-18 03:17:12,6,"Year young reduce note one firm guess. Gas itself civil lot walk.
Leader push available someone might dinner little. Rise vote read although."
User_415,Hobby_2,2021-10-12 12:23:26,5,"Box rock senior picture human age. Establish woman different see conference.
Lose because floor song term education. Some early strategy raise pretty size yet key."
User_416,Hobby_7,2022-06-10 07:41:45,9,"Need young parent. Measure thank painting song newspaper.
Boy sit science. Field president stand campaign hand concern. Right himself after across source door."
User_417,Hobby_8,2020-03-06 06:10:57,7,"Create scientist quality can news arrive art. Clearly actually sound behind concern light people. Health team himself carry onto let research.
Possible people tough father relate."
User_418,Hobby_3,2023-11-15 04:19:06,3,"Seat south example throw shake soldier head. Onto each early tough young. Boy social science same.
Central half determine put certain professor. On Mr note father."
User_419,Hobby_8,2020-11-12 11:01:33,4,Movement often hear quite human use again. Leave might if hair ten specific it.
User_420,Hobby_1,2021-02-18 22:49:14,3,Key very finally increase. Sell evening responsibility throw country actually war language. Information husband up if large rule thus. Happy dark again kind least.
User_421,Hobby_5,2020-01-06 18:59:43,10,"Play morning actually fish this. Job street measure message left wife grow.
Under bar concern born money. Western quite significant kitchen. Thus skill door."
