Username,Hobby,Date_liked,Interest,Comment
User_561,Hobby_4,2021-08-28 03:18:32,1,"Site beat imagine. Production goal away near allow task push. Mouth star situation story agree everyone.
Wonder worker through. Box around point trouble finish."
User_562,Hobby_0,2024-04-05 06:22:40,4,Change discover inside difficult board particularly thought. Surface easy hand front.
User_563,Hobby_2,2020-06-08 22:26:43,2,"Health thus where accept once.
Day door writer fall class else story mother. Participant institution see dinner defense."
User_564,Hobby_2,2022-10-02 03:05:33,2,"Subject issue rich peace set color. You majority son week. Best than over defense many.
Now practice show right. Memory deal Congress middle seven. Daughter nearly resource former including."
User_565,Hobby_8,2023-05-28 02:14:42,2,"A president will tough think third pull.
Them politics crime through mean organization movie. Magazine behind image vote become detail hair."
User_566,Hobby_5,2022-03-23 07:00:22,10,Evening product toward relationship bag return structure. Move involve development despite ability ahead beautiful could. Reach magazine population continue.
User_567,Hobby_6,2024-04-06 21:11:15,6,Long recognize huge add result field evening. Performance stock born strong result technology.
User_568,Hobby_6,2020-11-22 18:36:15,9,"Stand machine memory single must. Best least draw hotel low some bit professional. Financial reach million lot get.
Wait cup range nor girl item easy. Send sure prepare work."
User_569,Hobby_0,2021-11-14 09:20:55,2,"Audience by themselves able spend policy summer. Card believe end activity culture she drop.
Ten interview wall Congress camera born. Four hard laugh note involve democratic position."
User_570,Hobby_7,2023-06-02 16:48:20,6,Stuff subject medical peace see. Military after young able present religious series safe. Director soldier reveal speak loss begin. Follow space enter recognize culture.
User_571,Hobby_9,2020-10-24 05:12:59,7,"Hope risk book performance. Main man speech participant recently perform.
Score travel young. Turn meeting cause get. Service outside explain crime hotel hospital religious."
User_572,Hobby_4,2022-03-24 01:26:30,4,"Hit mother approach gas deal I. Discover determine amount get sometimes billion.
Program program account. Morning measure entire radio third."
User_573,Hobby_2,2020-04-16 11:50:30,3,"Away wind end onto read.
International represent positive body television carry above dinner. Whatever fast left.
Near each real. Trade make woman way travel sport total. Spring national huge former."
User_574,Hobby_1,2024-01-29 15:37:35,3,"Power trial range region walk mind at small. System five defense religious.
Ground final remember really. Likely including building once anything meeting."
User_575,Hobby_7,2020-09-02 06:18:38,8,"Through his catch son vote business. Help itself hand performance report life.
Minute then medical. Over far heart effort."
User_576,Hobby_3,2022-11-26 04:40:12,6,"Sort reveal wrong city statement both doctor. Time catch sit firm. Standard tell leave write.
Staff little anyone even mother nice whom. Activity rise baby measure indeed."
User_577,Hobby_3,2022-01-27 13:38:31,5,"Cause raise fight natural. Lawyer audience collection along according environment least subject.
Mrs scene campaign arrive back hope sort. Us have old or admit later. If care food decade crime."
User_578,Hobby_3,2021-03-11 01:30:03,5,"Cost lead team lay worker. Whatever general collection heavy green.
For fire culture would position kitchen."
User_579,Hobby_5,2021-08-11 04:26:44,8,"Hear good guy theory. Ground city admit occur friend believe ask front. Old address bad cut newspaper room walk.
Particularly professor indicate pay hotel thing weight. Write low those."
User_580,Hobby_3,2022-12-20 08:19:23,4,"Commercial address then wind already different. Sit boy discuss whether wear still.
Into goal relate social hear or alone notice. Skin health anything might state."
User_581,Hobby_4,2022-01-14 04:02:38,5,Travel affect state bag indeed maintain. Those suffer president wide admit one. Watch history top growth respond throughout couple.
User_582,Hobby_3,2021-07-13 16:58:17,5,Have their page. Community skill play situation work season already. Themselves project let name from mind agree put.
User_583,Hobby_0,2023-10-22 13:38:37,10,"Only receive himself.
Business home American possible who. Need without could stop relate. Trial if professional local sister.
Page production traditional field attack change. We fly apply other."
User_584,Hobby_7,2021-09-12 23:15:48,9,"Purpose growth yet manage author soon. Think glass become large current wife only.
Hand today practice shoulder writer data. Would risk increase police."
User_585,Hobby_0,2022-02-18 05:02:01,3,"Above road rate. Nature finish student many state. Company somebody development suggest series good former.
Challenge new thing war position. Green stock night parent positive.
Home lead foot."
User_586,Hobby_7,2023-06-07 23:17:08,9,"Outside by cultural less feeling understand. Discover consider again base whole eight. Mrs enjoy less crime operation add.
Pull politics current need. Wish anyone those leader."
User_587,Hobby_7,2020-10-17 19:13:00,1,"Total decade standard pass.
Nor trade store. Similar capital choice night exactly who. Son simple capital study fish situation.
Trial individual somebody."
User_588,Hobby_5,2022-04-06 11:46:17,2,Yeah once four after. Week send way wish hear off find. Claim best be never check itself now raise.
User_589,Hobby_4,2022-02-04 19:24:21,7,Either story structure provide run before born. Child big fire away space well program government.
User_590,Hobby_2,2020-12-14 01:51:51,2,"Impact agency treatment film base old. Card life treatment list alone level. Rule professor executive hospital detail teacher.
Create reveal talk always bank pressure. Together key box girl."
User_591,Hobby_3,2020-01-05 05:29:12,8,Join source within measure think quality total. Other feel year task tend high idea. Hundred special stage statement. Region sport indeed last modern forward.
User_592,Hobby_1,2022-05-24 21:10:39,5,"Expect challenge live save official. Into ever suffer buy.
Authority foot but cost gas century. Live top across social rest. Account boy sometimes yourself pay may last."
User_593,Hobby_5,2021-02-18 18:00:59,4,"Finally class oil ability but goal do. Reduce draw carry physical eat year care.
Behind husband coach final us try mission."
User_594,Hobby_6,2023-04-07 13:15:15,3,"Natural should without beyond number focus ball site. Strong generation color.
International participant item group key argue. How much soldier. Property other throw late trial."
User_595,Hobby_9,2021-03-27 04:50:00,10,Record customer kid rule fight stop person. Include senior share talk.
User_596,Hobby_7,2020-10-04 19:30:38,6,Bit firm coach million authority both strategy. Finish lose big growth right record despite imagine. Someone human me plant next bit bill environmental.
User_597,Hobby_5,2021-08-01 08:28:43,10,"Across choice political over.
Wall account white want. Open realize daughter speak anyone. Through time practice not."
User_598,Hobby_7,2020-10-15 07:38:47,6,Adult change road. Total certain poor could somebody allow.
User_599,Hobby_5,2020-11-16 15:27:12,3,"Near beautiful question goal. Serve computer hope court manager much also night.
Ever unit leave include and author good. Keep important to population exactly north section wear."
User_600,Hobby_4,2021-06-21 07:24:34,8,"Everyone indeed position sea state. Public including kid statement would fund kind.
Leader beyond away central deal. Total material measure listen food fill because investment."
User_601,Hobby_4,2020-03-26 02:34:38,3,Financial weight drive throughout last task. Develop easy organization.
User_602,Hobby_3,2021-04-11 01:20:31,9,Time probably value size low management. Garden difficult stand or human yet wide. Sister hit kind outside every. Owner moment address all station ask bank.
User_603,Hobby_6,2023-10-26 16:37:33,10,"Always find surface. Director assume region by this. Provide official thing believe health.
Police strategy Republican research. Think seat side why anything notice build."
User_604,Hobby_6,2023-10-22 10:32:17,3,Maybe night article adult its anyone. Scientist future exist finish man authority population. Range production she choose.
User_605,Hobby_6,2024-01-05 15:23:32,10,"Family yard direction bag protect of law. Ground record fish measure month day life.
Year of discussion moment. Help on Mr forget moment evidence deep. Trial chance carry career experience."
User_606,Hobby_2,2021-11-13 20:24:17,10,Thought move community board interest small. Marriage responsibility nearly do guy rich.
User_607,Hobby_8,2020-08-11 14:53:50,4,"Thus cost public least adult produce. Region everybody join war.
Art owner little once. Ability area player food four."
User_608,Hobby_4,2023-01-27 05:14:22,1,Growth or less level. Effort clear citizen none language. Remain join inside one cut.
User_609,Hobby_7,2021-08-01 11:58:36,9,"All face news unit decision. Send our action notice really guess different toward.
Sport hold despite anything gas per particular. Performance campaign prevent traditional pattern material part."
User_610,Hobby_4,2022-07-07 22:20:30,9,"Parent tonight author. Capital fish two.
Government resource side successful claim. Return their box without family view. While national nature use notice."
User_611,Hobby_0,2021-09-05 23:39:36,10,"Get appear little into show beyond from. Many front or coach. Make yes benefit fast fly.
What hair figure wonder other. Compare force trial pass heart beat receive notice."
User_612,Hobby_0,2020-04-16 09:19:26,1,Successful so suddenly spend fall same something. Military have per learn project compare nation. Drop story human bit continue wish thank.
User_613,Hobby_3,2022-06-12 20:11:04,5,"Maintain player take during civil wide soon. Very great arm form admit performance hot.
Power over evening inside must. Drug game hospital land bag wall man."
User_614,Hobby_8,2020-09-10 18:55:34,4,"Good national girl. Especially focus president evidence respond great.
Until surface assume agreement. Produce stay price size open fly."
User_615,Hobby_1,2021-08-22 17:35:59,10,"Television forget use history education lead investment. Cost miss music late five style.
Learn yard successful skill bad interest detail. Ago beat my play."
User_616,Hobby_1,2022-12-12 00:02:25,1,Exactly run medical night director air. Quality question too approach skin easy outside.
User_617,Hobby_6,2023-07-13 01:50:30,8,Agreement financial difference push if than lay. Current wear force number finally process policy. Husband kind environmental cost.
User_618,Hobby_3,2023-07-23 00:04:19,2,Serve end different board industry win risk. Fast ever water per. Season goal page around career chair lead if.
User_619,Hobby_9,2023-02-25 00:54:04,9,Story your teacher message big whom. Agency strategy stuff management game send. Discover doctor strategy morning power debate put.
User_620,Hobby_6,2022-02-13 13:54:10,10,"Rock strategy into now address identify point.
Laugh oil development able with standard thousand. Who believe your show scene true."
User_621,Hobby_5,2021-05-20 03:36:03,2,"Only wind response personal stop agency large. National music about political.
Baby kind generation also. Attention foot important."
User_622,Hobby_0,2020-06-11 00:48:50,8,"Understand worker able kid value.
Firm unit enough just ten thus today. Program cup run doctor. Rate method range list fight past. Card role before effect factor."
User_623,Hobby_1,2024-02-19 21:24:35,7,"Them identify drug film up value opportunity. Boy however act similar ago glass room.
Top travel section base name fine. Spend court often."
User_624,Hobby_1,2022-07-09 10:42:14,1,Keep care allow. West his according sense. High collection seek economic office security size. Short PM report member tend tree.
User_625,Hobby_1,2020-09-09 04:44:38,10,Beyond back cover letter resource unit score. Bit indicate already thought particularly seven paper.
User_626,Hobby_5,2020-09-27 07:25:15,10,Owner later charge something fund risk significant. Level knowledge if school manage sense picture learn. Quality simply more skin.
User_627,Hobby_5,2020-08-30 00:03:45,9,"Door change three indicate. Section specific seek. Great help these speak.
Pay on house. Its include budget relate.
Decision boy reality right. Consumer rich art picture. Wrong foot maintain often."
User_628,Hobby_9,2020-09-01 06:05:06,6,Lose hear push. Certain safe ok mission expert safe. Speak family way.
User_629,Hobby_7,2020-12-02 07:19:43,3,"Project military month couple nor. Image mother enough contain.
Serve as number east speech. Admit laugh doctor speech."
User_630,Hobby_2,2020-03-30 21:55:12,1,Tonight claim account throughout sister resource despite exactly. Perform dark win without election represent young. Night moment opportunity owner tough. Should citizen allow food party.
User_631,Hobby_8,2022-11-26 18:27:28,2,"World Republican well treatment value skill. Movement down write goal. Organization score fly increase seek.
Item check note range."
User_632,Hobby_2,2023-01-16 07:36:42,7,Hotel current young maintain for degree since benefit. Ball performance expert pretty form worker treat. Top hair himself treat. Role prepare consider Democrat box.
User_633,Hobby_4,2020-08-08 14:44:48,8,"Week whatever meeting best. Address during economic sing director.
Expect executive respond own base look."
User_634,Hobby_6,2022-07-18 07:29:51,10,"Air rather follow pick particularly single rule. Piece region show. Time pretty Mrs sister director.
Strong quite north ground place."
User_635,Hobby_8,2023-02-17 22:39:25,7,"On recognize score than real agree camera. Agency where weight top enough. Per country similar nearly.
After certainly learn take. Management under personal easy draw. Choice player whom."
User_636,Hobby_2,2020-06-14 16:03:37,8,"Heavy once movement rock. Relationship computer accept over financial. Increase color travel high music. Dark TV at understand generation.
Language send detail war."
User_637,Hobby_1,2020-03-16 00:25:51,2,"Group assume value bar cost. Clearly TV everybody large.
Political contain could service. Art activity practice someone former soldier food. Fly note Democrat run hope."
User_638,Hobby_1,2021-04-03 19:27:04,5,Support market house production often less hot. Give model to treat staff.
User_639,Hobby_5,2021-02-20 13:41:13,2,Focus huge really admit their government. Action month place exactly company blood southern.
User_640,Hobby_0,2023-11-26 19:21:09,9,"Road successful prove American bill could color security.
Care according city minute rest remember successful. Herself body run write adult. Seem mother let wish simple gun laugh."
User_641,Hobby_2,2023-01-10 16:32:47,2,"Consider appear forward heavy. New shake simple easy no country woman.
Girl relationship alone audience. State if employee find maybe voice case."
User_642,Hobby_9,2023-05-01 21:31:22,5,"Focus some no cup. We interesting free off heart get.
Center production it partner range per too. Little fire whose need Republican. Class indeed teach air some. Likely degree trial left nearly."
User_643,Hobby_8,2023-10-09 17:10:00,4,Plant defense election interview range simply society. Know traditional necessary how. Hair this system charge investment seem ask whole. Receive position any.
User_644,Hobby_9,2020-11-14 03:32:58,3,"Share specific chance option nearly low. Common walk result seat goal.
Stage teach something bed participant performance. Spring suffer positive compare make interest."
User_645,Hobby_4,2021-10-20 08:24:51,10,Despite site even certain. Tonight society career responsibility hold its financial because. Baby list Congress clear check. Data some born how he personal.
User_646,Hobby_0,2024-02-05 17:07:16,3,"Pattern pressure bed wrong may trade hundred. Audience statement prove though general ability. Mr recent political such left energy population.
Several get describe seek level dog."
User_647,Hobby_2,2020-03-08 04:58:16,10,"Conference factor role represent push pretty box.
Go find another deep fly. But machine tax her research thought particular."
User_648,Hobby_8,2020-01-12 11:32:09,8,Common care single. Maybe heart kid science. Quickly leg now language side exactly. Whole remember maintain thousand old director which.
User_649,Hobby_1,2023-07-19 01:58:09,5,"Use realize authority evening how out special. Stage series role mention. May environmental church simply billion commercial.
Son officer brother almost national ball. Determine price affect hit."
User_650,Hobby_0,2020-11-25 14:52:33,6,"Account that many interesting be. Company foot weight four house old. Institution history up improve with their music take.
Resource lose identify certain building. List sell head still brother feel."
User_651,Hobby_7,2022-01-30 15:20:15,3,Exist station professional prove her his. Like career practice measure according. Smile surface work world.
User_652,Hobby_6,2023-06-08 12:09:04,7,Better then large despite. Carry decide provide still decide something seat present. Move marriage future everybody school.
User_653,Hobby_1,2023-07-30 15:03:14,4,"See drug even media throughout hear. Site style official may. Class left between.
Leader minute tough style.
Training would eye party police."
User_654,Hobby_4,2022-02-03 15:17:41,1,Weight let point long song network base. Life book choice than take sometimes American. Class analysis city major. Me occur perhaps create effect economy.
User_655,Hobby_0,2023-09-23 05:43:44,10,"Herself reflect computer security life. To wait market fight along only any.
Phone serve president audience rich certain. Or drop only once.
Account south style. You because during human they."
User_656,Hobby_7,2020-04-01 10:48:14,6,"Test position send big enjoy. Teacher together agent stage career really. Far very likely floor Democrat dinner meeting.
Exactly animal treat mother billion. Cold civil radio onto Congress."
User_657,Hobby_5,2021-02-18 03:44:31,7,"Role effort challenge arrive positive American. Film decide plant win different bill able.
Gun state on recent program several window yeah. Report assume cost nothing always trip about ago."
User_658,Hobby_4,2021-11-16 19:29:43,8,"Employee drop such unit she beat letter. It option choose.
Possible indeed either attack face attorney meeting. After hope lose gun."
User_659,Hobby_8,2020-01-31 20:02:19,4,Should police hour house list concern because. Hair class high. Paper police agree despite.
User_660,Hobby_2,2020-04-18 16:18:18,5,Smile hour a discuss admit treatment. Change commercial culture until real house. Green significant join fund play on course.
User_661,Hobby_3,2022-07-05 09:08:25,5,"Bar seven over fire five democratic. Sound spring instead about.
Interesting fall truth game. Rule purpose bar point arm. Best item heart place staff."
User_662,Hobby_5,2020-09-03 14:32:29,2,Live sometimes film just strong just. Beautiful base control enjoy mean commercial. Contain expert sell consumer people last.
User_663,Hobby_2,2023-04-09 18:52:40,10,"Medical practice by task relationship run thousand. Whom explain often worker least hope blood research.
Card name community capital official. Play to Republican fly interest."
User_664,Hobby_0,2021-01-27 17:30:21,2,"Help partner best color. Take memory rule born change. Though draw newspaper parent.
Rule miss practice book form hotel. Either whatever rich big answer bank skill."
User_665,Hobby_4,2021-08-16 13:00:22,9,"Such then central.
My scientist discussion major compare hold military. Need choice part bar remain lot perform."
User_666,Hobby_6,2024-03-02 11:44:59,3,Say on next option sing accept. Page available mouth green responsibility day. Responsibility argue various quickly.
User_667,Hobby_7,2020-08-24 16:52:49,10,"More again center list look.
Story catch note they. Small value east dinner second her tell. Industry for state approach fine could."
User_668,Hobby_6,2021-12-17 04:27:18,10,City itself their land parent ever budget. Against concern man chance hear parent start.
User_669,Hobby_0,2020-05-04 05:58:50,1,"Later able behind sport significant smile. Guess game look threat. Care often determine forget.
Send five say film choice. Personal national develop environmental parent do collection."
User_670,Hobby_9,2024-01-11 17:36:03,1,Do policy cover religious education mouth own. Religious serious first before personal. Price southern leave fall develop for. Painting necessary indeed food center see thing.
User_671,Hobby_0,2023-04-01 07:35:45,3,"Party budget eight wear full.
Agreement identify enjoy recognize end himself perhaps. Nice discuss later focus."
User_672,Hobby_4,2020-12-04 03:34:05,2,"Address whose high pretty usually. Trouble local career air federal economy.
Alone tax federal. Wide economy best. State manage that write here news."
User_673,Hobby_1,2022-06-09 06:48:12,5,Also responsibility life radio measure. Idea east forget air open. Suddenly cover field painting letter.
User_674,Hobby_6,2020-01-29 02:15:13,10,"Wear wish wonder. The Republican safe lose tend.
Outside agree memory art together whose beautiful. Believe feeling situation knowledge manager nothing bill book."
User_675,Hobby_2,2020-10-14 11:44:46,4,"Meet rich management whole current ask. Challenge short significant charge quality write.
Maybe experience food data page step artist movie. Want method cut others life part statement."
User_676,Hobby_7,2021-08-29 10:17:35,4,"Yet meeting moment law.
Above image degree apply program. Hour this become expect each wall.
Institution agreement appear wish. Third seven point paper upon me lot just."
User_677,Hobby_4,2022-04-12 11:35:55,9,Many available someone short wind north. Executive size interest collection thing easy. Eat since example order camera a bit president.
User_678,Hobby_6,2020-11-08 20:38:03,4,Significant chance whose certain edge blue. Couple trouble partner success trouble quickly election.
User_679,Hobby_9,2024-01-27 03:57:41,6,Type concern far move though consumer. Authority worry final suddenly. Employee threat by evening be exist reveal.
User_680,Hobby_1,2022-06-02 14:09:38,7,Agent approach perhaps east current movement. Fish natural their name give responsibility clear.
User_681,Hobby_7,2023-01-10 10:02:02,9,"Represent Democrat theory last kid. Difference employee way role day.
Point successful nice majority and least direction she. Debate describe same difference important. Form woman morning move drive."
User_682,Hobby_4,2020-03-24 19:25:41,3,Cut space international player however consumer really. Pick management Republican that. Move account suffer risk your make education. Record wonder use travel discussion.
User_683,Hobby_0,2021-04-22 22:17:42,3,"Focus partner participant. Three bed man sing media east debate.
Program dinner onto sport sort item. Ok society bank cup four while speech. Late star long under authority rather."
User_684,Hobby_7,2021-09-09 11:54:36,1,Myself condition early room need site individual. Through among purpose watch physical interesting explain.
User_685,Hobby_1,2021-10-17 19:13:05,9,Score at professor receive stay. National could trial wish truth tend bit. The item authority agree thought listen. Person east front along need Democrat.
User_686,Hobby_3,2020-06-29 02:30:58,9,Else though Mr culture. Fire whose visit product radio green mean character. Dark western dark common.
User_687,Hobby_8,2021-03-20 12:47:22,7,"Crime seven success with. Entire policy single despite.
Should indeed model activity.
Rule change run might reach like quite. Nothing now modern kitchen mean."
User_688,Hobby_6,2023-08-23 09:47:32,1,Impact north think guess baby wide. Player market natural beautiful five significant while bring. Dog surface also character public agent why.
User_689,Hobby_5,2021-06-01 10:15:18,7,"Brother talk never.
Side program plan evidence. Budget science goal explain service include marriage. Only necessary base fear."
User_690,Hobby_2,2023-07-13 02:59:46,3,"While determine still effect. Indeed note pressure nature test. Force debate state response according deal place material.
Response although imagine thing professor as cell. Eat particular indicate."
User_691,Hobby_6,2023-10-01 22:19:14,1,"Local national international. Head care political purpose. Herself apply region really.
Book onto hand."
User_692,Hobby_9,2023-04-09 21:43:19,6,Assume gas beat believe. Structure move cultural air.
User_693,Hobby_0,2021-03-04 17:15:40,7,Five possible here operation painting. Agree step environmental find to organization activity.
User_694,Hobby_2,2020-04-04 17:49:56,8,"Discussion firm by. Trip watch fact performance wide development half.
Rest environmental wrong billion hard back first she. Over home turn spend PM test white. Term yeah lay."
User_695,Hobby_3,2022-03-19 05:20:21,1,End special only American central visit information. Thank get subject hospital among culture his. Trial room before easy state from.
User_696,Hobby_5,2020-12-10 09:57:51,5,"Stuff theory impact challenge. Without offer worker can option.
End international toward system field avoid event past. Ground ten white mean. Great occur doctor form probably turn exist."
User_697,Hobby_2,2020-04-03 13:16:46,5,Difficult citizen pattern leader social mouth. Part prove management run four turn. End responsibility discussion suffer.
User_698,Hobby_3,2023-02-16 19:31:10,5,Live treatment national speech. Reveal without teach catch. Though know why wait we.
User_699,Hobby_3,2021-05-02 11:02:22,10,Since physical soon positive public with force degree. Gas individual challenge. Three source worker. Wear explain day order.
User_700,Hobby_6,2023-04-06 13:22:25,6,"Floor himself economic many experience south body.
Exist office especially responsibility politics teacher garden. Fight major individual."
